Tweet,Fecha,Estado,Locacion,Tipo,Longitud,Latitud,Poblacion
"@ReginadelC @tatianotzin Explico: 1) dolor de cabeza por mezcla de cocktails, 2) mosquito HDSPM que me escoge a mi… https://t.co/A3AxjanhWl",Sun May 09 13:51:43 +0000 2021,Ciudad de México,Miguel Hidalgo,U,-99.2115105,19.4299345,414470
"No había querido quejarme... Pero que pinche calor y neta que no lo extrañaba en nada, tampoco a los mosquitos.",Sun May 09 14:10:39 +0000 2021,Tabasco,Nacajuca,R,-92.9447745,18.175748,531
Me desperté y estaban golpeando en una casa quien sabe q demolían y ahora las campanas de la iglesia y lara el colmo un resto de mosquitos,Sun May 09 16:31:46 +0000 2021,Veracruz de Ignacio de la Llave,Xalapa,R,-96.886083,19.542054,0
The Mosquitos are TERRORIZING me 😭😭😭,Mon May 10 15:31:07 +0000 2021,Oaxaca,Oaxaca de Juárez,R,-96.7250025,17.090319,685
The mosquitos in Mexico wanna suck the citizenship outta me I’m itchy all over,Tue May 11 04:04:55 +0000 2021,Tamaulipas,Reynosa,R,-98.36253100000002,25.836567499999997,1
"Odio ODIO los mosquitos, ojalá se extingan junto con las víboras, aunque me quede sin amigas ahvea!",Tue May 11 04:24:09 +0000 2021,Querétaro,Querétaro,R,-100.4405945,20.7152745,9
@HOMME_MASAJES @diablitxsantxx ¿Como se les sacan los mosquitos a un bebé?🤔,Tue May 11 04:36:19 +0000 2021,Ciudad de México,Xochimilco,R,-99.08179,19.236244499999998,123
Me cagan los putos mosquitos.,Tue May 11 07:13:49 +0000 2021,Ciudad de México,Tláhuac,U,-99.00501849999999,19.2623115,323771
@lailamontero Uffff quien fuera ese mosquito 😁😘,Tue May 11 11:32:20 +0000 2021,Puebla,Amozoc,R,-98.1542665,19.0322295,616
Maldito mosquito 🤬🥱,Tue May 11 12:40:56 +0000 2021,Morelos,Cuernavaca,R,-99.260819,18.933812,78
"@Angeluchoxxx Yo pero por los mosquitos Jajajajaja

Así ya no me pican",Tue May 11 17:40:07 +0000 2021,Ciudad de México,Cuauhtémoc,U,-99.153366,19.432836,545884
"""Dance like a fly, bite like a mosquito"".

Foto: @JaminAleman
#ArenaConstitución #BoxDeBarrio https://t.co/iHdeOVzSda",Tue May 11 22:43:55 +0000 2021,Jalisco,Zapopan,R,-103.48477450000001,20.790657000000003,40
"Porque les gusta el calor? Hay mosquitos, cucarachas, arañas 🙅🏼‍♀️🥴",Wed May 12 03:29:02 +0000 2021,Chihuahua,Cuauhtémoc,R,-106.90850850000001,28.7677765,5
"Infectoloca nivel: estoy 100% de que el mosquito que me acaba de picar, es un Aedes aegypti.",Wed May 12 03:34:33 +0000 2021,Nuevo León,Guadalupe,R,-100.196134,25.6766035,28
Los mosquitos me comen mas que tú 🥲,Wed May 12 06:33:00 +0000 2021,Sonora,Hermosillo,R,-111.498181,28.9698625,5
last night was rough 😂 I got bit by mosquitos and couldn’t stop crying,Wed May 12 13:18:57 +0000 2021,Michoacán de Ocampo,Morelia,R,-101.27577,19.652724,84
maybe once I have kids I’ll stop crying over mosquito bites,Wed May 12 14:41:19 +0000 2021,Michoacán de Ocampo,Morelia,R,-101.27577,19.652724,84
I was up all night crying because a mosquito bit my finger and it was swollen - I’m definitely not ready for kids lol,Wed May 12 16:26:31 +0000 2021,Michoacán de Ocampo,Morelia,R,-101.27577,19.652724,84
hasta los mosquitos,Wed May 12 21:53:25 +0000 2021,Ciudad de México,Cuauhtémoc,U,-99.153366,19.432836,545884
"Qué placentero es cuando un mosquito está zumbando en tu oído mientras tú estás acostado, empezando a quedarte dorm… https://t.co/ywmTbXjJNJ",Thu May 13 06:11:54 +0000 2021,Ciudad de México,Benito Juárez,U,-99.1614805,19.380613,434153
Que chinga me acaba de dar un fucking mosquito 🥲,Fri May 14 01:09:50 +0000 2021,Puebla,Amozoc,R,-98.1542665,19.0322295,616
"El acoso callejero es como ese zumbido de mosquito que molesta a personas específicas, pero las que no lo sufren, c… https://t.co/rT3wEjaxgp",Fri May 14 02:22:46 +0000 2021,Querétaro,Querétaro,R,-100.4405945,20.7152745,9
"Oaxaca... Fin del mundo, exceso de mosquitos pero la puesta de sol, es  mejor que he visto en mi corta vida 💞💞🤘🏽… https://t.co/qdBsDXzaZG",Fri May 14 17:50:42 +0000 2021,Ciudad de México,Coyoacán,U,-99.15234000000001,19.328383000000002,614447
"""Si crees que eres muy pequeño para marcar la diferencia, intenta dormir con un mosquito"" 

😅 https://t.co/ftx1C4Rl4u",Fri May 14 19:49:10 +0000 2021,Hidalgo,Tulancingo de Bravo,R,-98.3604,20.130287,2
I just got 5 mosquito bites today after not getting any all week &amp; omg I can’t stop scratching them especially with this heat 😭😭,Fri May 14 23:25:57 +0000 2021,Michoacán de Ocampo,Lázaro Cárdenas,R,-102.45755600000001,18.083858499999998,12
No entiendo aún los pinches mosquitos en la cdmx!!!!!,Sat May 15 00:31:34 +0000 2021,Ciudad de México,Cuauhtémoc,U,-99.153366,19.432836,545884
"Bien atletica alas 5 am pero me traen los mosquitos, de bajada 🥺",Sat May 15 16:47:50 +0000 2021,Sinaloa,Guasave,R,-108.5232665,25.501625500000003,25
Es horrible cómo los mosquitos 🦟 pueden acabar contigo en una sola noche 😭😭😭,Sun May 16 00:37:09 +0000 2021,Ciudad de México,Miguel Hidalgo,U,-99.2115105,19.4299345,414470
"8.Mayo.2021

#paradise #beach #sand #holbox #shell #morshilove #tripcumpleañero5dimaio en Punta Mosquito, Holbox. https://t.co/zXNvnckr20",Sun May 16 02:38:00 +0000 2021,Nuevo León,Apodaca,R,-100.27047400000001,25.736714999999997,0
"8.Mayo.2021

#holbox #beach #sand #ocean #paradise #morshilove #tripcumpleañero5dimaio en Punta Mosquito, Holbox. https://t.co/VnsLiF362H",Sun May 16 02:43:09 +0000 2021,Nuevo León,Apodaca,R,-100.27047400000001,25.736714999999997,0
@HTX_Amy That’s a big ass mosquito 😭😭,Sun May 16 03:38:08 +0000 2021,Oaxaca,San Pedro Mixtepec,R,-97.0558365,15.942708,89
"8.Mayo.2021

#beach #holbox #puntamosquito #paradise #morshilove #tripcumpleañero5dimaio en Punta Mosquito, Holbox. https://t.co/sXLxriMf4y",Sun May 16 06:26:55 +0000 2021,Nuevo León,Apodaca,R,-100.27047400000001,25.736714999999997,0
Putos Mosquitos me cagan de a madres.,Sun May 16 06:41:27 +0000 2021,México,Toluca,U,-99.655676,19.284321499999997,33089
Que tal eh? Tenemos una pequeña compañerita en casa....vamos a ver si le encontramos algunas moscas y mosquitos par… https://t.co/jDEVFSLKGv,Sun May 16 21:39:22 +0000 2021,Jalisco,Teocaltiche,R,-102.58449800000001,21.4820115,11
@regicabrera Pa la prox se lleva todo un arcenal contra mosquitos :/,Mon May 17 21:44:50 +0000 2021,Yucatán,Mérida,R,-89.62361100000001,20.941035,0
Malditos mosquitos en la habitación cómo se sienten... https://t.co/J833hpnQP4,Tue May 18 06:36:02 +0000 2021,Querétaro,Querétaro,R,-100.4405945,20.7152745,9
"En temporada de lluvia, los mosquitos 🦟 suelen tener más presencia, sobre todo si hay recipientes con agua por much… https://t.co/jgcJoY3gUK",Tue May 18 16:24:48 +0000 2021,Jalisco,Zapopan,R,-103.48477450000001,20.790657000000003,40
The mosquitos are having a feast off me right now 🥴 https://t.co/8hpuW1r2La,Tue May 18 17:32:08 +0000 2021,Jalisco,Chapala,U,-103.2254295,20.278502000000003,11439
Estamos en tu casa y tu eres un mosquito así que yo soy tu repelente.,Wed May 19 03:13:45 +0000 2021,Veracruz de Ignacio de la Llave,Emiliano Zapata,R,-96.7223325,19.455647499999998,56
"Me acaba de picar un mosquito, a ver si no amanezco con una cepa nueva del dengue porque así soy yo, no puedo estar… https://t.co/hqS5cfNv6G",Wed May 19 05:30:46 +0000 2021,Sinaloa,Mazatlán,R,-106.2717475,23.46814,0
Chiiiingaaaaas a tu maaadreeee mosquito de mieeerda!,Wed May 19 08:49:56 +0000 2021,Jalisco,Guadalajara,U,-103.335882,20.676651999999997,1385621
Cuanta felicidad habría en el mundo si los mosquitos chuparan grasa en lugar de sangre.,Wed May 19 11:42:26 +0000 2021,Coahuila de Zaragoza,Monclova,R,-101.220857,26.878203499999998,0
"Que pedo mosquitos, me tienen hasta la madre.",Wed May 19 14:32:32 +0000 2021,Hidalgo,Santiago Tulantepec de Lugo Guerrero,R,-98.404774,20.0291985,4
No sé qué mosquito les picó a mis hermanas y se la pasan escuchando a C-kan jajajajaj y a mi me critican por escuchar a Gera Mx,Wed May 19 17:05:33 +0000 2021,Aguascalientes,Aguascalientes,R,-102.327207,21.849459000000003,0
"He entablado diálogo con un mosquito que insiste en picarme. No atino a matarlo (mis intentos son muy torpes), ni e… https://t.co/i68UbeHKi6",Thu May 20 00:28:24 +0000 2021,México,Ecatepec de Morelos,R,-99.0444445,19.56828,615
"Le puse un manotazo a un mosquito y sólo lo ataranté, cayó como borracho de cantina 😂",Thu May 20 16:13:16 +0000 2021,Jalisco,San Pedro Tlaquepaque,R,-103.34832399999999,20.592133,0
"Son tiempos en qué el mosquito es más abundante, tomemos nuestras precauciones.
@VictorSanoro",Thu May 20 20:59:34 +0000 2021,Jalisco,Guadalajara,U,-103.335882,20.676651999999997,1385621
"Perdón, pero me declaro AFICIONADO y AMANTE de matar mosquitos con las raquetas electrificadas 🏸⚡️",Thu May 20 22:42:51 +0000 2021,Jalisco,Zapopan,R,-103.48477450000001,20.790657000000003,40
One more mosquito bite &amp; I’m buying a flight back home 😫😫😫😫😫,Thu May 20 22:52:12 +0000 2021,Jalisco,Guadalajara,U,-103.335882,20.676651999999997,1385621
"La generacion 2021 mosquitos es invisible e inaudible.

Ha comenzado el apocalipsis......",Fri May 21 04:35:20 +0000 2021,Jalisco,Zapopan,R,-103.48477450000001,20.790657000000003,40
"Ni que no tuviera lana para pagar plumas que salgan a defenderlo por un pequeño chayotito.... Hasta ""El Mosquito""… https://t.co/6DCtTvYIAp",Fri May 21 04:54:50 +0000 2021,Sonora,Hermosillo,R,-111.498181,28.9698625,5
There’s a mosquito in my room): I woke up with like 10 new bites,Fri May 21 16:32:53 +0000 2021,Jalisco,Chapala,U,-103.2254295,20.278502000000003,11439
Vivo con el temor eterno de que un mosquito choque con mi globo ocular 😑,Fri May 21 23:55:42 +0000 2021,Yucatán,Mérida,R,-89.62361100000001,20.941035,0
Me picaron los mosquitos en la cara. 😰,Sat May 22 02:10:05 +0000 2021,México,Tlalnepantla de Baz,U,-99.1642825,19.543933000000003,658907
Mosquitos fucked me up 🙂,Sat May 22 18:53:24 +0000 2021,Guanajuato,Pénjamo,R,-101.845557,20.405994,163
@Ingridjeg pantalón x los mosquitos,Sun May 23 00:55:13 +0000 2021,Tabasco,Huimanguillo,R,-93.71282000000001,17.7624055,0
If you could press a button and kill every single mosquito on the planet would you do it?,Sun May 23 04:40:19 +0000 2021,Quintana Roo,Isla Mujeres,R,-87.0541055,21.402667,3
Me ando ahogando más yo con el Raid que los mosquitos que se mueran! 😭🤬,Sun May 23 06:34:42 +0000 2021,México,Cuautitlán,U,-99.1634475,19.678076,117995
Me ando más intoxicándome yo con el Raid que los mosquitos se mueran! 😭🤬,Sun May 23 06:44:44 +0000 2021,México,Cuautitlán,U,-99.1634475,19.678076,117995
Todo sería más bonito si los mosquitos chuparan grasa en vez de sangre.,Mon May 24 05:08:36 +0000 2021,Chiapas,Comitán de Domínguez,R,-92.1752655,16.289696,121
Por andar aplaudiendo para matar un mosquito.. ya desperté a la bebé https://t.co/kU3ETjoThO,Mon May 24 05:27:19 +0000 2021,Ciudad de México,Coyoacán,U,-99.15234000000001,19.328383000000002,614447
"Plebes, anoche el Jacobo dejó el vidrio de mi carro abajo y se metieron un chingo de mosquitos. Por cada mosquito a… https://t.co/gzG16lR2fc",Mon May 24 16:01:22 +0000 2021,Sonora,Cajeme,R,-109.84179,27.713652500000002,0
Ser un imán de mosquitos es mi pasión https://t.co/3Br3YPSbDt,Mon May 24 18:07:01 +0000 2021,Ciudad de México,Xochimilco,R,-99.08179,19.236244499999998,123
No mamar hoy todos los mosquitos se vinieron de pijamada a mi cuarto,Tue May 25 05:10:46 +0000 2021,Coahuila de Zaragoza,Saltillo,R,-101.166961,25.0326315,97
Confirmadísimo! Pero aguas con los mosquitos.,Tue May 25 15:21:30 +0000 2021,México,Tlalnepantla de Baz,U,-99.1642825,19.543933000000003,658907
Lo único de acampar que no me gusta es que soy en exceso atractivo para los mosquitos,Tue May 25 18:02:27 +0000 2021,Tamaulipas,Ciudad Madero,U,-97.8225365,22.283026,205933
Why do I gotta have mosquito bites on both my ankles tho :/,Tue May 25 20:41:30 +0000 2021,Oaxaca,San Mateo Cajonos,R,-96.21069,17.1575475,128
Soy alimento de mosquitos... No hay luz en mi casa tiene una hora. #teodioCFE,Wed May 26 02:45:28 +0000 2021,Tabasco,Nacajuca,R,-92.9164995,18.0219595,432
"No estoy moreno, estoy quemando y los mosquitos me han destrozadooo uh oh oh 🎶❣️❣️❣️",Wed May 26 03:48:29 +0000 2021,Ciudad de México,Cuauhtémoc,U,-99.153366,19.432836,545884
"there is a mosquito in this room and containment efforts have thus proved futile

send help",Wed May 26 03:55:11 +0000 2021,Ciudad de México,Cuauhtémoc,U,-99.153366,19.432836,545884
"Aquí en la casa sufren de calores nocturnos, yo 🤐, lo malo es la RE PICADA que me acaba(n) de meter uno(s) mosquito… https://t.co/ZVZqhENq72",Wed May 26 07:15:33 +0000 2021,Puebla,Amozoc,R,-98.1542665,19.0322295,616
"¿cuál es el propósito de las cucarachas y los mosquitos?

neta que aportan a la vida 😡😠🤬😤",Wed May 26 14:56:55 +0000 2021,México,Nezahualcóyotl,R,-99.01701650000001,19.432722,85
"Estoy seguro que los mosquitos evoluciona.  En mi casa están por todos lados,  solo agarro mi súper raqueta mata mo… https://t.co/fot7MviBJQ",Wed May 26 15:57:35 +0000 2021,Yucatán,Mérida,R,-89.62361100000001,20.941035,0
"Estoy seguro que los mosquitos evolucionan.  En mi casa están por todos lados,  solo agarro mi súper raqueta mata m… https://t.co/KVCm703L9A",Wed May 26 15:59:06 +0000 2021,Yucatán,Mérida,R,-89.62361100000001,20.941035,0
@ulimorales10 Llevarle una botella de mosquito y una de garañona,Wed May 26 16:37:14 +0000 2021,México,Toluca,U,-99.655676,19.284321499999997,33089
y’all know what sucks? not being able to scratch the mosquito bites on my legs LMAOOO these nails ain’t doing it for me,Wed May 26 16:58:53 +0000 2021,Yucatán,Mérida,R,-89.62361100000001,20.941035,0
These mosquitos suckin everything but my dick,Wed May 26 22:18:59 +0000 2021,Quintana Roo,Puerto Morelos,R,-87.0316645,21.048719,0
Voy a tener que ponerme mas salalado por que si no los mosquitos acabaran con bonjo,Thu May 27 15:44:34 +0000 2021,Ciudad de México,Iztapalapa,U,-99.050461,19.342788499999997,1835486
2 am y los mosquitos siguen al ataque madre mia quiero dormir,Fri May 28 06:51:46 +0000 2021,Ciudad de México,Iztapalapa,U,-99.050461,19.342788499999997,1835486
I have huge mosquito whelps 😭😭,Fri May 28 15:19:56 +0000 2021,Zacatecas,Miguel Auza,R,-103.50578449999999,24.165032000000004,14
Estoy súper deliciosa para los mosquitos.,Sat May 29 05:14:33 +0000 2021,Guanajuato,Apaseo el Alto,R,-100.583428,20.431131999999998,480
"Me andaba jodiendo un mosquito pero ya lo maté 

Cosas que les vale madres...",Sat May 29 07:11:57 +0000 2021,Tabasco,Nacajuca,R,-92.9164995,18.0219595,432
"Insomnio, calor, mosquitos... Ya me desperté Diosito. ¿Que más quieres de mi? https://t.co/MI0nHvnz2z",Sat May 29 10:17:17 +0000 2021,Ciudad de México,Azcapotzalco,U,-99.18212600000001,19.4857835,432205
La dirección de Salud Municipal en #Lerdo realiza acciones preventivas para evitar la propagación del mosquito tran… https://t.co/2oP3fjCX1l,Sun May 30 02:30:03 +0000 2021,Coahuila de Zaragoza,Viesca,R,-103.23313,25.244222999999998,36
"Que rico es dejarles el culito bien lleno de mosquitos, apoco no?

@Lalecheria1 @JNcdmx #lavergademexico https://t.co/OSIVoTXpkH",Sun May 30 06:24:18 +0000 2021,Ciudad de México,Coyoacán,U,-99.1525965,19.3206955,614447
I HATE MOSQUITO BITES,Sun May 30 12:23:04 +0000 2021,Quintana Roo,Isla Mujeres,R,-87.0541055,21.402667,3
En el mar la vida es más sabroleeee en Playa Mosquito https://t.co/V0STyQj6kF,Sun May 30 15:04:41 +0000 2021,Quintana Roo,Isla Mujeres,R,-87.0541055,21.402667,3
Bueno a dormir después del baño espero que los mosquitos no me acaben de chupar,Mon May 31 06:26:23 +0000 2021,Jalisco,Tlajomulco de Zúñiga,R,-103.407581,20.489708999999998,15
¿Quieres generar el músculo de la paciencia? … duerme en una habitación con mosquitos y sin repelente.,Mon May 31 08:04:00 +0000 2021,Oaxaca,Santa María Colotepec,R,-96.93732499999999,15.853071499999999,79
Soy un imán de mosquitos 😩,Mon May 31 16:13:00 +0000 2021,Chiapas,Chilón,R,-92.0478535,17.106698,105
"Un mosquito no me dejó dormir toda la madrugada, siento que dormí como media hora :(. Si de por si parece que me de… https://t.co/tAM9gPcpTa",Mon May 31 19:09:45 +0000 2021,México,Tlalnepantla de Baz,U,-99.1158905,19.518656,13030
"@zabicky Atiéndete con un colega orate mentiroso. ¿De cuándo acá hablas con mosquitos anofelinos?

Te refieres al E… https://t.co/PTW9fG2Zac",Mon May 31 20:23:46 +0000 2021,Yucatán,Mérida,R,-89.62361100000001,20.941035,0
Nada más molesto que te pique un mosquito en la oreja 😒,Mon May 31 23:03:10 +0000 2021,Jalisco,Zapotlán el Grande,R,-103.5109195,19.7004725,0
I wish I loved myself as much as mosquitos love me 😔,Mon May 31 23:50:53 +0000 2021,Quintana Roo,Felipe Carrillo Puerto,R,-88.0134815,19.749553,11
Malditos mosquitos hijos de perra. Los odio.,Tue Jun 01 01:09:35 +0000 2021,Tabasco,Nacajuca,R,-92.9164995,18.0219595,432
Mosquito bites,Tue Jun 01 02:51:01 +0000 2021,Jalisco,Mascota,R,-105.14858050000001,20.697052499999998,0
@Yomilrr Sin mosquitos por favor 😣 a la próxima mejor vámonos a SC,Tue Jun 01 04:59:10 +0000 2021,Sonora,Cajeme,R,-109.84179,27.713652500000002,0
@Rociocsb @Yomilrr Por esooooooooo 😍 y porque allá no hay mosquitos jaja 😎,Tue Jun 01 05:00:33 +0000 2021,Sonora,Cajeme,R,-109.84179,27.713652500000002,0
"Pinche mosquito, me picó en el pómulo.",Tue Jun 01 07:15:04 +0000 2021,Ciudad de México,La Magdalena Contreras,U,-99.24800950000001,19.318042,246428
Estúpido mosquito déjame en paz...,Tue Jun 01 19:33:32 +0000 2021,Sonora,Hermosillo,R,-111.498181,28.9698625,5
Pinches mosquitos mamones...,Wed Jun 02 05:41:36 +0000 2021,Tabasco,Nacajuca,R,-92.9164995,18.0219595,432
Mosquitos r vampires they just aren’t cool or what ever,Wed Jun 02 13:46:59 +0000 2021,Ciudad de México,Cuauhtémoc,U,-99.153366,19.432836,545884
"El mosquito está muy enamorado de mi 🥰 pobre iluso, hoy muere 🙂",Wed Jun 02 14:25:39 +0000 2021,Sonora,Hermosillo,R,-111.498181,28.9698625,5
"Evitemos la propagación del mosquito transmisor del dengue, zika y chikungunya. Limpia tu patio, techo y porche, ti… https://t.co/XBUVzE9kjj",Wed Jun 02 14:34:42 +0000 2021,Nuevo León,Monterrey,U,-100.29359149999999,25.6417185,1142952
"atrapar un mosquito con una sola mano es tan satisfactorio, me siento como un titan de AOT",Wed Jun 02 15:06:13 +0000 2021,Baja California,Playas de Rosarito,R,-116.929102,32.3328765,5
Vaya noche tuve lloviendo fuerte lugo un caloron y para rematar los mosquitos picando,Wed Jun 02 16:12:24 +0000 2021,Ciudad de México,Iztapalapa,U,-99.050461,19.342788499999997,1835486
"Según yo compré un repelente contra mosquito para la academia , y ya me lo acabe...
ODIO LOS MOSQUITOS",Thu Jun 03 02:36:19 +0000 2021,Sonora,Hermosillo,R,-111.498181,28.9698625,5
"No le tengo miedo al Covid, le tengo miedo al Dengue pinched mosquitos!",Thu Jun 03 03:42:16 +0000 2021,Quintana Roo,Puerto Morelos,R,-87.0316645,21.048719,0
"Odio a los mosquitos, no dejan dormir 😪",Thu Jun 03 04:23:43 +0000 2021,Veracruz de Ignacio de la Llave,Xalapa,R,-96.886083,19.542054,0
1 like and I’ll beat the shit out of this mosquito in my room,Thu Jun 03 08:59:02 +0000 2021,Quintana Roo,Solidaridad,R,-87.346982,20.5845305,27
No tendré novio pero los mosquitos me tienen bien servida.,Thu Jun 03 15:07:58 +0000 2021,Sonora,Nogales,R,-111.001401,31.192592,2
"Dice Jorge Urzúa:
Los círculos de infierno Tapatío: calor, lluvia, mosquitos, dengue, desapariciones, inseguridad, incendios",Thu Jun 03 19:57:13 +0000 2021,Jalisco,Guadalajara,U,-103.335882,20.676651999999997,1385621
"Pa los youtuber,s que están como pinches mosquitos 🤣🤣🤣 https://t.co/JkcZf7oKvH",Thu Jun 03 21:30:07 +0000 2021,Ciudad de México,Cuauhtémoc,U,-99.153366,19.432836,545884
"@elnorte @elnortelocal @elnorteseg estancamiento de agua por lluvias, hay mucha larva y mosquitos. Particular bloqu… https://t.co/z0dGeS7bSd",Thu Jun 03 23:59:00 +0000 2021,Nuevo León,Guadalupe,R,-100.196134,25.6766035,28
@PoshLad_MX Jajaja ve si te pica un mosquito jajaja,Fri Jun 04 01:43:48 +0000 2021,Nuevo León,García,R,-100.640491,25.8057225,714
Salgo a la calle en pijama y con los mosquitos molestando solo para cuidar a mi sobrino que está jugando fútbol con los de la cuadra. 🙂,Fri Jun 04 03:09:57 +0000 2021,Veracruz de Ignacio de la Llave,Coatzacoalcos,U,-94.43248200000001,18.135455,212540
Como me an comido los pinchis mosquitos,Fri Jun 04 04:32:42 +0000 2021,Sinaloa,El Fuerte,R,-108.643339,26.252688,256
"Esta fresco feesco, y se metió un mosquito a mi cuarto! Son tan molestos que los 0di0!",Fri Jun 04 08:10:26 +0000 2021,Jalisco,San Pedro Tlaquepaque,R,-103.34832399999999,20.592133,0
Alexa.. mata ese pinché mosquito que no me deja dormir. 🦟😒😴💤,Fri Jun 04 08:42:49 +0000 2021,Jalisco,Guadalajara,U,-103.335882,20.676651999999997,1385621
Se me olvidó que en la temporada de lluvias ya se empiezan a caer los mosquitos. 😩😩😩,Fri Jun 04 20:21:05 +0000 2021,Jalisco,Guadalajara,U,-103.335882,20.676651999999997,1385621
"Que miedo con los mosquitos, son spr agresivos 😿",Fri Jun 04 23:52:26 +0000 2021,Coahuila de Zaragoza,Viesca,R,-103.23313,25.244222999999998,36
@la_la_laura Aquí andamos haciendo fiesta con los mosquitos,Sat Jun 05 02:44:01 +0000 2021,Yucatán,Mérida,R,-89.62361100000001,20.941035,0
"@GloriousGT @ClaudioXGG @lopezobrador_ Buena alegoría, comparando al señor X como aquel mosquito que busca herir al elefante a piquetes…",Sat Jun 05 04:35:01 +0000 2021,México,Ecatepec de Morelos,R,-99.0444445,19.56828,615
"The Mosquito Coast.
Siete episodios de la 1a temporada.
Si tienen oportunidad, veanla.
Tremendas actuaciones, trama… https://t.co/KIRGmfoi6s",Sat Jun 05 05:10:54 +0000 2021,Ciudad de México,Benito Juárez,U,-99.1614805,19.380613,434153
Claro qué sí! Y también el aerosol mata moscas/mosquitos...deleite 👌🏽,Sat Jun 05 12:16:50 +0000 2021,Ciudad de México,Benito Juárez,U,-99.1614805,19.380613,434153
"A fin de evitar la presencia ddl mosquito transmisor del dengue, Salud Municipal de #GómezPalacio llevan a cabo un… https://t.co/p7ViPpyfLu",Sat Jun 05 22:00:03 +0000 2021,Coahuila de Zaragoza,Viesca,R,-103.23313,25.244222999999998,36
Me picó un mugroso mosquito en la planta del pie. LOS ODIOS!!!!,Sat Jun 05 22:37:54 +0000 2021,Jalisco,Guadalajara,U,-103.335882,20.676651999999997,1385621
Odio a los malditos mosquitos,Sun Jun 06 01:48:33 +0000 2021,Veracruz de Ignacio de la Llave,Agua Dulce,R,-94.17138299999999,18.0902165,17
No único que me está comiendo son los mosquitos 😔,Sun Jun 06 04:47:49 +0000 2021,Puebla,Chiautzingo,R,-98.4862845,19.165014499999998,24
Y todo iba de forma ideal.  Hasta que llegaron los mosquitos.,Sun Jun 06 07:17:30 +0000 2021,Baja California,San Quintín,R,-115.5798785,30.156488499999995,4
"Mosquitos have been eating me for breakfast, lunch and dinner 😩😭 nunca me habían picado así!! y nada de pendejos po… https://t.co/2kqEFrTHYg",Mon Jun 07 06:14:42 +0000 2021,Guanajuato,Celaya,R,-100.772211,20.5226915,9
Pinches mosquitos 🦟 otra vez en la cara,Mon Jun 07 08:24:48 +0000 2021,Jalisco,Guadalajara,U,-103.335882,20.676651999999997,1385621
"coming back home w 50 mosquito bites, tired, two shades darker and brokeeee. cancun won 😩",Mon Jun 07 11:15:30 +0000 2021,Quintana Roo,Puerto Morelos,R,-87.0316645,21.048719,0
Me caga el chingado mosquito,Mon Jun 07 12:12:29 +0000 2021,Tabasco,Comalcalco,R,-93.341606,18.291262,1056
"Buenos días!

Es lunes de iniciar con todo la semana, acá la inicio con todos los mosquitos de la región alrededor… https://t.co/U7s9NKYYPF",Mon Jun 07 12:24:43 +0000 2021,Veracruz de Ignacio de la Llave,San Rafael,R,-96.8987215,20.212532500000002,0
"Amo las lluvias, detesto los mosquitos. https://t.co/HBeOOpFLLb",Mon Jun 07 14:10:21 +0000 2021,Morelos,Xochitepec,R,-99.1828615,18.811717,109
"Ⓜ️📺RECUERDA La mejor forma para prevenir el #Dengue, #Zika y #Chikungunya es evitar que el mosquito encuentre lugar… https://t.co/xgtUEDoOmU",Mon Jun 07 21:01:15 +0000 2021,Oaxaca,Oaxaca de Juárez,R,-96.7250025,17.090319,685
"Era un mosquito, cuidémonos entre todas y todos del Dengue, Zika y Chikungunya.",Tue Jun 08 02:38:39 +0000 2021,Nayarit,Tepic,R,-104.8725575,21.626666,654
"@NiTanChidaa Aún no, a parte de no tener sueño, tengo un mosquito que está chingue y chingue.",Tue Jun 08 06:26:56 +0000 2021,Puebla,Atlixco,R,-98.4531485,18.902124,48
"- Neta detesto cualquier tipo de mosquito, los odioooo, bye. 😡🦟",Tue Jun 08 10:32:05 +0000 2021,Puebla,San Jerónimo Xayacatlán,R,-97.95139999999999,18.278284,52
"vale verga, quiero q tú me comas y nomas los mosquitos lo hacen",Tue Jun 08 12:57:15 +0000 2021,Jalisco,Mascota,R,-105.14858050000001,20.697052499999998,0
Me picaron los mosquitos😣,Tue Jun 08 14:18:20 +0000 2021,México,Naucalpan de Juárez,R,-99.310428,19.473793999999998,149
this fat mosquito bite on my neck making everyone think I got a hickey.,Tue Jun 08 16:09:22 +0000 2021,Jalisco,Zapotlanejo,R,-103.0757815,20.642842,642
"Lo único imposible es aquello que no intentas
#puntamosquito
#holboxmexico en Playa Mosquito https://t.co/JPpigSnHCz",Tue Jun 08 16:30:23 +0000 2021,Quintana Roo,Isla Mujeres,R,-87.0541055,21.402667,3
"Si me concedieran 3 deseos, los 3 serían que desaparecieran todos los mosquitos del mundo.",Wed Jun 09 02:29:41 +0000 2021,Ciudad de México,Coyoacán,U,-99.15234000000001,19.328383000000002,614447
"🦟Mosquitos🦟

Pandemia del 2021",Wed Jun 09 04:29:28 +0000 2021,Coahuila de Zaragoza,Piedras Negras,R,-100.6071045,28.774769,124
Ya no imagino mi vida sin piquetes de mosquitos ha. 🦟,Wed Jun 09 04:51:38 +0000 2021,Oaxaca,Santa María Tonameca,R,-96.67803550000001,15.784410999999999,93
