Tweet,Fecha,Estado,Locacion,Tipo,Longitud,Latitud,Poblacion
"@maduroscampeche Sueños, xq ricos serian si fuera el mosquito que picotea x las noches esas delisiosas nalguitas",Mon Apr 11 04:05:09 +0000 2022,Campeche,Campeche,R,-90.27714,19.601414,0
Matar mosquitos… es mi pasión 🤬,Mon Apr 11 04:10:29 +0000 2022,Tabasco,Nacajuca,R,-92.9164995,18.0219595,432
Igual que el mosquito más tonto de la manada yo sigo tu luz aunque me lleve a morir......💛🤎en silencio pensaré tan… https://t.co/X1wljdsg0a,Mon Apr 11 05:34:55 +0000 2022,Nuevo León,García,R,-100.640491,25.8057225,714
"Prepara tu auto antes de salir de viaje con una NANO Cerámica! Protégete de piedras, mosquitos, lodos, y otros daño… https://t.co/0YGw7t3dNN",Mon Apr 11 13:33:53 +0000 2022,Jalisco,Zapopan,U,-103.388761,20.697297,1257547
@AnaluSauceda Buenos días mosquito suertudo 😋,Mon Apr 11 14:53:10 +0000 2022,Baja California Sur,La Paz,R,-110.8545845,24.107996999999997,0
Nomás vine para ser alimento de mosquitos UnU 😩,Tue Apr 12 03:45:07 +0000 2022,Veracruz de Ignacio de la Llave,Veracruz,R,-96.22939650000001,19.183953,3
"Los mosquitos están tratando de arruinar mis vacaciones, lo peor de todo es que solo a mi me han picado alv. 🤦🏻‍♂️",Tue Apr 12 13:33:28 +0000 2022,Nayarit,Compostela,R,-105.07711699999999,21.114418,0
@PatoCulto Semos patos pobres aún… puro mosquito para cenar,Tue Apr 12 19:49:00 +0000 2022,Ciudad de México,Coyoacán,U,-99.15234000000001,19.328383000000002,614447
"El único que me pica es el pinche mosquito.🦟
😭😭😭",Wed Apr 13 01:05:45 +0000 2022,Ciudad de México,Cuauhtémoc,U,-99.153366,19.432836,545884
Jajaja esa madre del plátano! No pues el único remedio para que no te ataquen los mosquitos 🦟 es poner un mosquiter… https://t.co/wUHsOWEeTG,Wed Apr 13 12:30:13 +0000 2022,Hidalgo,Mineral de la Reforma,U,-98.77580800000001,20.1056375,5108
"Bien amanecida, nunca he sufrido por los mosquitos, creo que no me pican. 
#MañaneroSanto
Perooooo una vez me picar… https://t.co/3cjRu8zJ99",Wed Apr 13 13:00:40 +0000 2022,Ciudad de México,Coyoacán,U,-99.15234000000001,19.328383000000002,614447
@castisos1 Mosquito bites,Wed Apr 13 22:08:28 +0000 2022,Quintana Roo,Puerto Morelos,R,-87.0316645,21.048719,0
"Para mosquitos como éste que no hacen nada pero son latosos. Pide Moskifin en FarmaCasa a sólo $38 no mancha, no ir… https://t.co/GnLCy56BWx",Wed Apr 13 23:57:32 +0000 2022,Hidalgo,Tizayuca,U,-98.9642575,19.8533755,2926
"@JoaoPixeles @bettyrjce La costa de los mosquitos, home before dark, for all mankind, me he dado cuenta que unas co… https://t.co/M76tZggCR7",Thu Apr 14 00:31:43 +0000 2022,Michoacán de Ocampo,Nuevo Parangaricutiro,R,-102.1675635,19.439252,0
if i could fight a mosquito i would 😠,Thu Apr 14 03:04:35 +0000 2022,Quintana Roo,Solidaridad,R,-87.346982,20.5845305,27
@melishcs Una vez mi vecina en Xalapa me fue a reclamar porque le golpee la pared... había matado un mosquito.,Thu Apr 14 04:03:59 +0000 2022,Veracruz de Ignacio de la Llave,Veracruz,R,-96.22939650000001,19.183953,3
"Me invitaron a acampar y que emocioooon, el lago se ve hermosoooooo, ya se que voy a ser comida de mosquitos, pero… https://t.co/mPOQHWgFE5",Thu Apr 14 04:15:23 +0000 2022,Jalisco,Guadalajara,U,-103.335882,20.676651999999997,1385621
"@Anaro74 Sí, por favor. A mí me atacó un &amp;-$+#$!! mosquito a las 2:30 de la mañana. Pero ya estamos listos para el juevecito",Thu Apr 14 13:45:27 +0000 2022,Ciudad de México,Benito Juárez,U,-99.1614805,19.380613,434153
Protégete del sol y ahuyenta mosquitos en el mismo producto. Disponible en #FarmaCasa que no te lo ganen. https://t.co/M9Jb292IWF,Thu Apr 14 16:37:58 +0000 2022,Hidalgo,Tizayuca,U,-98.9642575,19.8533755,2926
Y me comieron los mosquitos!!! Pero seguimos en el viaje!!! #latinactor #actor #acteur #attore #ator #viaje #tour… https://t.co/ySRAF7QthO,Thu Apr 14 17:07:23 +0000 2022,Chiapas,Tuxtla Gutiérrez,U,-93.13965950000001,16.7424355,578830
"@EdMoisesss Es una planta aromática que supuestamente funciona como
 repelente  de mosquitos, debido a su intenso a… https://t.co/cjOjyux8Kc",Fri Apr 15 01:06:31 +0000 2022,Yucatán,Mérida,R,-89.62361100000001,20.941035,0
@AventureroSoyYo Piernas locas crane y el dragón mosquito verdes https://t.co/W19CzS5mnb,Fri Apr 15 02:28:41 +0000 2022,Yucatán,Progreso,U,-89.6748995,21.22812,7361
Lo único malo de la costa es que la señal es mala… y hay mucho calor… y mosquitos… y esta bien lejos… etc etc jaja,Fri Apr 15 05:17:58 +0000 2022,Oaxaca,Santa María Huatulco,R,-96.150956,15.779152,365
"Cosas que más odio:
1.- Las infidelidades 🙅🏻‍♂️
2.- Los mosquitos 🦟😤
3.- El menudo 🥣🤢",Fri Apr 15 08:43:55 +0000 2022,Hidalgo,Tula de Allende,R,-99.384564,20.0567145,888
El desorden del sueño que puede provocar un mosquito. 😒,Fri Apr 15 14:38:44 +0000 2022,Ciudad de México,Coyoacán,U,-99.15234000000001,19.328383000000002,614447
Con una raqueta para mosquitos 😝,Fri Apr 15 23:25:56 +0000 2022,Jalisco,San Pedro Tlaquepaque,R,-103.34832399999999,20.592133,0
Puros mosquitos.🤬,Sat Apr 16 02:11:52 +0000 2022,Sinaloa,Ahome,R,-109.1037265,25.921946500000004,308
Ojalá el team calor este feliz con el regreso de los mosquitos. 🙃🤬,Sat Apr 16 02:52:13 +0000 2022,Puebla,Huauchinango,U,-98.053888,20.1744365,58957
Ojalá me comieras tú y no unos mosquitos ☹️🦩,Sat Apr 16 03:07:08 +0000 2022,Querétaro,Querétaro,R,-100.4405945,20.7152745,9
"@ismaccino No, arde más con algunas lociones como la de los mosquitos si en las piernas arde un chingo no me imagino en el ☆",Sat Apr 16 17:33:50 +0000 2022,Baja California Sur,Los Cabos,R,-109.7662685,23.269879,2
I have more mosquito bites on my left arm now then I have had in my entire life. Send help,Sat Apr 16 21:54:11 +0000 2022,Jalisco,Guadalajara,U,-103.335882,20.676651999999997,1385621
"Como cedemexeña en Querétaro, hoy morí. Y de mosquitos ni hablamos. https://t.co/Nh7X1Bkyh5",Sun Apr 17 01:41:39 +0000 2022,Querétaro,Querétaro,R,-100.4405945,20.7152745,9
Me han picado como 800 mosquitos esta semana 🥺,Sun Apr 17 01:42:04 +0000 2022,Sinaloa,Guasave,R,-108.5232665,25.501625500000003,25
Se acabó mi súper poder de ser inmune a los mosquitos :(((((,Sun Apr 17 05:18:56 +0000 2022,Aguascalientes,Aguascalientes,R,-102.327207,21.849459000000003,0
Los mosquitos 🦟 no me dejaron dormir toda la noche por el manglar https://t.co/57sjzJ6MP7,Sun Apr 17 05:31:50 +0000 2022,Campeche,Campeche,R,-90.27714,19.601414,0
ahora un puto mosquito 💔😩,Sun Apr 17 08:02:40 +0000 2022,México,Tlalnepantla de Baz,U,-99.1642825,19.543933000000003,658907
Entre el calor y los mosquitos no me dejan dormir...,Sun Apr 17 09:04:59 +0000 2022,Veracruz de Ignacio de la Llave,Emiliano Zapata,R,-96.7223325,19.455647499999998,56
"@profdimas30 @vanehupp Vivo en condesa rodeado de árboles, que crees? En las zonas exclusivas también hay mosquitos 🤣",Sun Apr 17 13:15:19 +0000 2022,Ciudad de México,Miguel Hidalgo,U,-99.2115105,19.4299345,414470
7 sin mosquitos,Sun Apr 17 17:02:02 +0000 2022,Oaxaca,Oaxaca de Juárez,R,-96.7250025,17.090319,685
@JJIMENEZO Repelente para los mosquitos!🦟🦟,Sun Apr 17 20:24:37 +0000 2022,Morelos,Yautepec,R,-99.041365,18.873686,2
@anibonita0 La del mosquito,Sun Apr 17 22:50:20 +0000 2022,Baja California Sur,Los Cabos,R,-109.7662685,23.269879,2
@christianbleu Los mosquitos https://t.co/vTisO3IdXT,Mon Apr 18 02:25:19 +0000 2022,Ciudad de México,Miguel Hidalgo,U,-99.2115105,19.4299345,414470
"Pinches mosquitos, hay un chingo... 🙂",Mon Apr 18 02:39:30 +0000 2022,Querétaro,San Juan del Río,U,-100.014785,20.388074500000002,177719
No me estés rondeando como mosquito frutero,Mon Apr 18 03:40:56 +0000 2022,Ciudad de México,Azcapotzalco,U,-99.18212600000001,19.4857835,432205
"@Winston27629331 No es posible, solo el demonio de mi recamara y el mosquito que se filtró... 🤣😂🤣",Mon Apr 18 05:03:04 +0000 2022,Querétaro,Querétaro,R,-100.4405945,20.7152745,9
@vanehupp Pon un jardín pequeño con plantas aromáticas que espanten a los mosquitos (cuestión de investigar cuáles)… https://t.co/4COwqByZ80,Mon Apr 18 05:11:59 +0000 2022,Yucatán,Mérida,R,-89.62361100000001,20.941035,0
"Odio el calor.
Odio al mosquito que no me dejó dormir.
😡
Y eso que todavía no llega el verano 😳",Mon Apr 18 06:44:32 +0000 2022,Ciudad de México,La Magdalena Contreras,U,-99.24800950000001,19.318042,246428
Over these fucking mosquitos,Mon Apr 18 19:56:10 +0000 2022,Sinaloa,Guasave,R,-108.5232665,25.501625500000003,25
Hagamos de cuenta que no hace calor y me duelen las piernas de tantos piquetes de mosquito jaja :v,Mon Apr 18 20:54:30 +0000 2022,Ciudad de México,Iztapalapa,U,-99.050461,19.342788499999997,1835486
Siguen cayendo. Como moscas. Digo como mosquitos en Urapan Michoacan https://t.co/Xyq2uNG05r,Mon Apr 18 22:55:15 +0000 2022,Michoacán de Ocampo,Nuevo Parangaricutiro,R,-102.1675635,19.439252,0
Igual que el mosquito más tonto de la manada...,Tue Apr 19 01:37:34 +0000 2022,Sinaloa,Culiacán,R,-107.3420565,24.6624885,0
"Con el calor vienen los mosquitos, los alacranes y los insectos...
Y con el frío... con el frío salen pingüinos ¿Y… https://t.co/sRahGRZpol",Tue Apr 19 03:32:24 +0000 2022,Morelos,Cuernavaca,R,-99.260819,18.933812,78
"@julianvargaspin Ja ja ja ¿le creeré? 
¿Tu que dices @DbEstrada ?
🤔🤪
Lo que pasa es que usted dice de 11 mosquitos… https://t.co/ogIxD7dgo5",Tue Apr 19 06:08:22 +0000 2022,Jalisco,Zapopan,R,-103.48477450000001,20.790657000000003,40
"Aplaudo para matar a un mosquito a las 3am, mi chihuahua se despierta y me voltea a ver con ojos de odio y me da la espalda",Tue Apr 19 08:13:45 +0000 2022,Ciudad de México,Miguel Hidalgo,U,-99.2115105,19.4299345,414470
Estúpidos mosquitos 😡,Tue Apr 19 08:33:22 +0000 2022,Ciudad de México,Cuauhtémoc,U,-99.153366,19.432836,545884
🤔 Is it a mosquito net? 🦟,Tue Apr 19 16:09:58 +0000 2022,Ciudad de México,Miguel Hidalgo,U,-99.2115105,19.4299345,414470
2 en 1 bloqueador solar + repelente de mosquitos. Encuéntralo en #FarmaCasa entrega a domicilio sin costo extra den… https://t.co/3aKxxzVJxp,Tue Apr 19 22:33:33 +0000 2022,Hidalgo,Tizayuca,R,-98.990349,19.866101,0
Mugres mosquitos!! Los odio a ellos y las ronchas que dejan 😒,Wed Apr 20 00:15:43 +0000 2022,Ciudad de México,Cuauhtémoc,U,-99.153366,19.432836,545884
Deja te encuentro mosquito culero.,Wed Apr 20 03:21:00 +0000 2022,Querétaro,Querétaro,R,-100.4405945,20.7152745,9
Mosquito Slayer,Wed Apr 20 04:42:33 +0000 2022,Ciudad de México,Cuauhtémoc,U,-99.153366,19.432836,545884
"4:12 y todo sereno.
No es cierto. Hay un mosquito malvado que no me deja dormir, este sillón es tan incómodo.
Tengo… https://t.co/2Qkc4P6cQR",Wed Apr 20 09:14:57 +0000 2022,Ciudad de México,Iztacalco,U,-99.09649599999999,19.399101,404695
@MERKACON @PonchoGutz Si los mosquitos pican a Poncho es porque es muy sangron.,Wed Apr 20 12:42:09 +0000 2022,Baja California,Mexicali,R,-115.22918000000001,31.789669500000002,19
Me come mas un mosquito que la que quiero 🙄,Wed Apr 20 17:09:19 +0000 2022,Sonora,Hermosillo,R,-111.498181,28.9698625,5
"Una de las razones por las que quiero irme de Tabasco es que hay un buen de mosquitos, cuando estabamos en San Salv… https://t.co/HcJhlubvrf",Wed Apr 20 20:24:24 +0000 2022,Tabasco,Nacajuca,R,-92.9164995,18.0219595,432
Declaró la guerra a mi peor enemigo que es: el mosquito que se esconde 🤬,Wed Apr 20 23:07:12 +0000 2022,Chihuahua,Chihuahua,R,-106.1628985,28.941865999999997,0
Ando en modo rush haciendo la maleta y un mosquito cree que es buen momento de meterse en mi boca. 🤮,Wed Apr 20 23:24:46 +0000 2022,Ciudad de México,La Magdalena Contreras,U,-99.24800950000001,19.318042,246428
Ya llegó la temporada en dónde me comen más los mosquitos que el vato que me gusta,Thu Apr 21 05:09:40 +0000 2022,México,Ecatepec de Morelos,R,-99.0444445,19.56828,615
"Busco relación seria con quien me rasque los piquetitos de zancudo/mosquito.

Muero de comezón😭😭😭",Fri Apr 22 01:36:08 +0000 2022,Querétaro,Querétaro,R,-100.4405945,20.7152745,9
Traigo urticaria en un ojo y el dr: agarra un mosquito para que te pique el otro ojo y te veas pareja🙃🙃🙃,Fri Apr 22 14:30:33 +0000 2022,Sonora,Hermosillo,R,-111.498181,28.9698625,5
@Javier_Hidalgo @DeporteCDMX @Ponte_Pila Se nota que eres rudo... pa' eso de la pndejada ! Nche carrocería de mosquito.,Sat Apr 23 02:12:04 +0000 2022,Nuevo León,San Pedro Garza García,R,-100.366033,25.650287499999997,2
"Estoy en un nivel impresionante de irritado. El calor, el ruido, los mosquitos y la pobreza me tienen mal",Sat Apr 23 23:14:26 +0000 2022,Sinaloa,Culiacán,R,-107.3420565,24.6624885,0
Me quería dormir temprano... Finalmente vencí al mosquito. https://t.co/xwvTPrwL42,Sun Apr 24 08:33:12 +0000 2022,Ciudad de México,Azcapotzalco,U,-99.18212600000001,19.4857835,432205
@DSIrapuato @JAPAMIgob @irapuatogob Cuando comienzan con fumigación contra mosquitos en comunidades rurales?,Sun Apr 24 18:05:17 +0000 2022,Guanajuato,Irapuato,R,-101.3403935,20.673542,23
Odio a los mosquitos 🦟 y los mosquitos me aman. Otro amor no correspondido.,Sun Apr 24 21:00:34 +0000 2022,Quintana Roo,Puerto Morelos,R,-87.0316645,21.048719,0
Me pico un puto mosquito en el pezón 😭,Sun Apr 24 21:31:32 +0000 2022,Chihuahua,Saucillo,R,-105.3186885,28.009444000000002,0
Sólo salí a barrer y me comieron los mosquitos. 🥲,Tue Apr 26 00:53:13 +0000 2022,Quintana Roo,Othón P. Blanco,R,-88.3857435,18.5934905,0
"Pinches mosquitos, andan picando bien resio los hijos de su ptm",Tue Apr 26 01:10:00 +0000 2022,Tabasco,Nacajuca,R,-92.9164995,18.0219595,432
Que echo raid para matar unos mosquitos y puff ! Me trague la nube de insecticida 🤢,Tue Apr 26 03:48:08 +0000 2022,Ciudad de México,Cuauhtémoc,U,-99.153366,19.432836,545884
"Sabes que ya llegaste a Acapulco cuando: te sacan las nudes en grindr y te terminan bloqueando, cuando los mosquito… https://t.co/rst2egG1Ge",Tue Apr 26 07:48:41 +0000 2022,Guerrero,Acapulco de Juárez,R,-99.73564950000001,16.9589495,5
"El #Paludismo es una enfermedad que se transmite por la picadura del mosquito Anopheles sp.
Si identificas estos sí… https://t.co/1upSrZthuj",Tue Apr 26 15:04:47 +0000 2022,México,Tecámac,R,-98.9903395,19.7051795,531
jk y’all I’m returning as a mosquito with all these damn mosquito bites,Tue Apr 26 22:25:46 +0000 2022,Jalisco,Tlajomulco de Zúñiga,R,-103.407581,20.489708999999998,15
"@teresacastellmx @mario_delgado @CitlaHM Tere son peppa pig y mafafa mosquito , fíjate bien son ellos se salieron d… https://t.co/F47VvZ3Lxx",Tue Apr 26 22:56:01 +0000 2022,Durango,Gómez Palacio,R,-103.50417999999999,25.711095,3
"@azucenau Sra. Uresti la foto es de mafafa mosquito , se equivocó ?",Tue Apr 26 23:10:58 +0000 2022,Durango,Gómez Palacio,R,-103.50417999999999,25.711095,3
@valerialfarog También sería bonito que los niños pudieran  dormir y descansar bien sin que los mosquitos lo impida… https://t.co/wgM3YkakgF,Wed Apr 27 03:43:43 +0000 2022,Guanajuato,Irapuato,R,-101.3403935,20.673542,23
@AJolines Los mosquitos ayudaron un poco.,Wed Apr 27 10:19:39 +0000 2022,México,Ocoyoacac,U,-99.4177725,19.259489000000002,29068
"¿Me extrañaron desgraciados?

Yo hablándole a los mosquitos, cosas que no extrañaba ni un poco.",Wed Apr 27 18:54:31 +0000 2022,Yucatán,Mérida,R,-89.62361100000001,20.941035,0
Bien movidos ! Vuelan más los mosquitos q los aviones ...😂😂😂,Thu Apr 28 03:20:13 +0000 2022,México,Cuautitlán,U,-99.1634475,19.678076,117995
"""Coman mosquitos, cuaracuacua"". #Monoficción",Thu Apr 28 04:04:50 +0000 2022,Jalisco,Guadalajara,U,-103.335882,20.676651999999997,1385621
le dije a Luigi que me voy a tatuar un mosquito en la pompa jajajajajaja https://t.co/6aIOwTfVhb,Thu Apr 28 04:32:42 +0000 2022,México,Tlalnepantla de Baz,U,-99.1642825,19.543933000000003,658907
Have I mentioned how much I hate mosquitos,Thu Apr 28 16:00:01 +0000 2022,Jalisco,Tepatitlán de Morelos,R,-102.71283700000001,20.818671000000002,4
"Odio, odio a las moscas... Incluso más que a las cucarachas o mosquitos, a esos los exterminas con productos, pero… https://t.co/rRtHMlZkS3",Thu Apr 28 20:45:46 +0000 2022,Querétaro,San Juan del Río,U,-100.014785,20.388074500000002,177719
Detesto los mosquitos,Fri Apr 29 03:12:42 +0000 2022,Tamaulipas,Tampico,R,-97.91677200000001,22.270295,19
Alguien trae mosquitos de resfriado 🤧,Fri Apr 29 19:24:34 +0000 2022,México,Zinacantepec,R,-99.7991405,19.2038105,271
ahorita ya andamos tomando gin con repelente de mosquitos,Sat Apr 30 01:16:31 +0000 2022,Oaxaca,Santa María Tonameca,R,-96.544838,15.665568,267
Los mosquitos de mi habitación viendo que voy a dormir desnudo. https://t.co/q3VWsqr9pq,Sat Apr 30 01:18:00 +0000 2022,Ciudad de México,Cuauhtémoc,U,-99.153366,19.432836,545884
Ash con los mosquitos!!,Sat Apr 30 06:13:07 +0000 2022,Michoacán de Ocampo,Morelia,R,-101.27577,19.652724,84
Jamás me habías desvelado tanto por alguien como por este mosquito que hace unas hora lo tengo dando vueltas en la cabeza ...,Sat Apr 30 06:38:48 +0000 2022,Querétaro,Querétaro,R,-100.4405945,20.7152745,9
@Excelsior @mario_delgado A mafafa mosquito no se le quita lo arrastrada tapete del dictadorzuelo,Sat Apr 30 09:26:04 +0000 2022,Durango,Gómez Palacio,R,-103.50417999999999,25.711095,3
Woke up in a battle against 5 mosquitos. They’re all dead now.,Sat Apr 30 11:02:32 +0000 2022,Oaxaca,Santa María Tonameca,R,-96.67803550000001,15.784410999999999,93
"Cazar mosquitos mi pasión, 
la comezón,
mi penitencia.",Sat Apr 30 19:19:36 +0000 2022,Jalisco,Zapopan,R,-103.48477450000001,20.790657000000003,40
"Todos contra el mosquito transmisor del #Dengue 🦟

Esta tarde, se realizaron trabajos de fumigación en el plantel S… https://t.co/WIzpIetdx9",Sat Apr 30 21:38:36 +0000 2022,Jalisco,Tlajomulco de Zúñiga,R,-103.407581,20.489708999999998,15
desde ayer que llegue perdí la batalla contra los mosquitos… 😩🥹,Sun May 01 16:04:46 +0000 2022,Yucatán,Mérida,R,-89.62361100000001,20.941035,0
#mosquito 🦟🦟🦟 en Bosque de Chapultepec https://t.co/ihlSW3xMcj,Sun May 01 18:53:43 +0000 2022,Ciudad de México,Miguel Hidalgo,U,-99.2115105,19.4299345,414470
Los mosquitos se siguen haciendo presente 🤬,Mon May 02 01:15:55 +0000 2022,Campeche,Palizada,R,-91.939035,18.2559695,4
¿Que hago con el mosquito? https://t.co/jnEU3cuACf,Mon May 02 19:32:21 +0000 2022,Sonora,Hermosillo,R,-111.498181,28.9698625,5
I got hella mosquito bites,Tue May 03 02:24:00 +0000 2022,Guanajuato,Manuel Doblado,R,-101.87674150000001,20.691353,0
"Mientras que me coman los mosquitos, calor insoportable, mis cosas refri se echaron a perder y 2da noche sin dormir… https://t.co/wvl27TFQmY",Tue May 03 02:36:44 +0000 2022,Yucatán,Mérida,R,-89.62361100000001,20.941035,0
"To whoever invented mosquito nets, thank you for making my time in nature possible.

Te odio calor con mosquitos 😡,Tue May 03 05:09:27 +0000 2022,Guanajuato,Salamanca,R,-101.17017200000001,20.651612,10
Malditos mosquitos los odio 🦟🦟,Tue May 03 05:30:49 +0000 2022,Nuevo León,García,R,-100.640491,25.8057225,714
These mosquito bites are annoying af,Tue May 03 17:32:56 +0000 2022,Guanajuato,Manuel Doblado,R,-101.87674150000001,20.691353,0
"Nada como una mañana fresca, café, mar, muchos mosquitos y #sandboarding 😅😂🤣 en Topolobampo, Sinaloa https://t.co/Ljs7XJRqcH",Tue May 03 21:06:43 +0000 2022,Sinaloa,Ahome,R,-109.1037265,25.921946500000004,308
Mi novia es una cazadora de mosquitos,Wed May 04 02:39:29 +0000 2022,Sinaloa,Culiacán,R,-107.3420565,24.6624885,0
Ayer dimos el banderazo de inicio de la primera campaña de eliminación masiva de criaderos de mosquito transmisor d… https://t.co/EUZnRZdqBT,Wed May 04 15:13:12 +0000 2022,Veracruz de Ignacio de la Llave,Minatitlán,R,-94.3909125,17.706791000000003,8
"@bta_Demian Demian , ya adivine es mafafa mosquito , dime que acerté porfis",Wed May 04 19:13:00 +0000 2022,Durango,Gómez Palacio,R,-103.50417999999999,25.711095,3
"@bta_Demian Demian ya me fijé bien , es el resultado de la cruza de Peppa pig y mafafa mosquito , ahora si le atine ?",Wed May 04 19:15:39 +0000 2022,Durango,Gómez Palacio,R,-103.50417999999999,25.711095,3
"Mi karma claramente son los mosquitos.
Like why are you so obsessed with meeee???",Wed May 04 19:17:58 +0000 2022,Querétaro,El Marqués,R,-100.2783405,20.7456405,14
@Aladelagarza Pues me ha servido a mí conservarme en alcohol como mosquito en ámbar.,Wed May 04 21:09:54 +0000 2022,Puebla,Amozoc,R,-98.1542665,19.0322295,616
quien con comportamiento de mosquito Aedes?¿ https://t.co/YzUD6TvHm3,Thu May 05 00:11:28 +0000 2022,Chihuahua,Juárez,R,-106.568008,31.452274000000003,-

Assholes.",Thu May 05 00:21:11 +0000 2022,Ciudad de México,Cuauhtémoc,U,-99.153366,19.432836,545884
"ser un imán para los mosquitos y además ser alérgica a sus picaduras, son de las peores combinaciones…",Thu May 05 05:06:03 +0000 2022,Ciudad de México,Benito Juárez,U,-99.1614805,19.380613,434153
"@El__Barbas Noooo, ches mosquitos...",Thu May 05 05:53:14 +0000 2022,Querétaro,Querétaro,R,-100.4405945,20.7152745,9
"Qué onda con la gripe en temporada de covi, solo te escurren tus mosquitos, te escuchas mormada, y no te da tos 🤔😂… https://t.co/1r7HJQiRQK",Thu May 05 12:47:25 +0000 2022,México,Zinacantepec,R,-99.7991405,19.2038105,271
Tengo UNA misión en esta vida y es matar los 4 mosquitos que hay en este Primera Plus.,Thu May 05 21:44:23 +0000 2022,Querétaro,Querétaro,R,-100.4405945,20.7152745,9
@taller2006 Calor + mosquitos...😩 https://t.co/O4OvjOYrMR,Fri May 06 01:36:26 +0000 2022,México,Cuautitlán,U,-99.1634475,19.678076,117995
"Hoy no dormí nada los mosquitos se dieron un festin conmigo. resolví el problema abrazando el abanico, pero fue muy… https://t.co/XiVVXU1TXn",Fri May 06 15:10:10 +0000 2022,Baja California,Mexicali,R,-115.22918000000001,31.789669500000002,19
"@DemocraUSAMex @mario_delgado Mafafa mosquito debe de ir a la cárcel , A S E S I N O",Sat May 07 04:38:14 +0000 2022,Durango,Gómez Palacio,R,-103.50417999999999,25.711095,3
"Fuck u, mosquito.",Sat May 07 05:57:04 +0000 2022,Coahuila de Zaragoza,Viesca,R,-103.23313,25.244222999999998,36
Si me destapo me atacan los mosquitos,Sat May 07 07:42:58 +0000 2022,Veracruz de Ignacio de la Llave,Xalapa,R,-96.886083,19.542054,0
Odio la temporada de mosquitos,Sat May 07 18:11:53 +0000 2022,Hidalgo,Mineral de la Reforma,U,-98.77580800000001,20.1056375,5108
@Huevi8 No habia en el oxxo. Asi q compre spray OFF!. ya no me molestaron los mosquitos.,Sat May 07 18:59:07 +0000 2022,Baja California,Mexicali,R,-115.22918000000001,31.789669500000002,19
"@SaludGuanajuato Cuando fumigan en comunidades rurales, actualmente un problema el número de mosquitos y aún no lle… https://t.co/GStLjmO4v7",Sat May 07 21:55:27 +0000 2022,Guanajuato,Irapuato,R,-101.3403935,20.673542,23
Estoy harrrrta del calor 😒 de las moscas y mosquitos aghhh 🙂🙂 y esto a penas empieza,Sun May 08 07:06:20 +0000 2022,Veracruz de Ignacio de la Llave,Huatusco,R,-96.86945750000001,19.145273500000002,235
"Y sin luz ni agua peor 
Los mosquitos al ataque 😖😩
Menos mal que ya regresó la luz hace unos minutos aquí en 2Camin… https://t.co/2CxIXImYtQ",Sun May 08 07:35:01 +0000 2022,Veracruz de Ignacio de la Llave,Veracruz,R,-96.22939650000001,19.183953,3
Solo le tengo odio a los mosquitos 🤗,Mon May 09 00:30:26 +0000 2022,Querétaro,Querétaro,R,-100.4405945,20.7152745,9
Enamorada de este clima aún que me coman los mosquitos,Mon May 09 01:52:29 +0000 2022,Baja California,Mexicali,R,-115.22918000000001,31.789669500000002,19
Adentro no se puede estar por el calor y afuera no se puede estar por los mosquitos. Qué quieres de mi México? Que… https://t.co/dd3ClPnKgy,Mon May 09 03:05:44 +0000 2022,Guanajuato,Celaya,R,-100.772211,20.5226915,9
"Jamás podré ser team calor, cuando en estas fechas es cuando hay chingo de mosquitos 😒🦟",Mon May 09 03:24:49 +0000 2022,México,Texcoco,R,-98.787435,19.468545499999998,2725
"Mosquito, mi cuarto es como una ciudad entera para ti y a huevo tienes que volar en mi perra oreja?",Mon May 09 05:24:50 +0000 2022,Coahuila de Zaragoza,Saltillo,R,-101.166961,25.0326315,97
"Lagos... te recordaré, a ti y tus mosquitos. 🦟 https://t.co/tqwcTqXlt9",Mon May 09 13:43:35 +0000 2022,Jalisco,Lagos de Moreno,R,-101.8688765,21.5335195,218
Hay aves que cruzan los mosquitos 🦟 y el pantanal y pa acabar de joder el infierno 🔥 verde 😁,Mon May 09 16:19:15 +0000 2022,Tabasco,Nacajuca,R,-92.9164995,18.0219595,432
"Me están comiendo los mosquitos, ya se que estoy bien rica pero no mamen 😤 https://t.co/2YiNbSnh5p",Tue May 10 00:26:35 +0000 2022,Nuevo León,Monterrey,U,-100.29359149999999,25.6417185,1142952
"Mosquito bites ✅
Sunburn ✅ https://t.co/rV7fscyHjh",Tue May 10 04:17:09 +0000 2022,Jalisco,Zapopan,R,-103.6026365,20.838477,0
not a fucking mosquito biting me in the fucking boob,Tue May 10 05:48:38 +0000 2022,Michoacán de Ocampo,La Piedad,R,-102.06711800000001,20.300655499999998,9
Una de las cosas que más odio es el sonido que hacen los mosquitos.,Tue May 10 12:15:13 +0000 2022,Nuevo León,General Escobedo,R,-100.3652735,25.807314499999997,1682
ok it’s hella beautiful here and all but the 16 mosquito bites on ONE leg is just not doing it for me,Tue May 10 14:21:44 +0000 2022,Jalisco,Mascota,R,-105.14858050000001,20.697052499999998,0
Se pasó de verga el Mosquito con esa jugada.,Tue May 10 20:02:48 +0000 2022,México,Tlalnepantla de Baz,U,-99.1158905,19.518656,13030
"Pinshi calor, pinshi mosquitos en Jardines de la Silla, Juarez https://t.co/KwJIbbwrqU",Tue May 10 23:29:55 +0000 2022,Nuevo León,Juárez,R,-100.118882,25.6083315,5
