Tweet,Fecha,Estado,Locacion,Tipo,Longitud,Latitud,Poblacion
@Josemal123456 Para matar cucarachas y mosquitos,Sat Aug 08 19:10:34 +0000 2020,Ciudad de México,Iztapalapa,U,-99.050461,19.342788499999997,1835486
@taniaalcantar Los mosquitos que se inflaman es por que se dieron un chingazo volando?,Sat Aug 08 22:15:11 +0000 2020,Sonora,Hermosillo,R,-111.498181,28.9698625,5
"Repelente de mosquitos y otros insectos, 100% natural, 60 ml. De venta en casadelpanchiapas en Real de Guadalupe 55… https://t.co/vceiL49WBQ",Sat Aug 08 22:18:44 +0000 2020,Chiapas,San Cristóbal de las Casas,R,-92.534411,16.663044499999998,0
"Plan de sábado... jugar con los clavos para ahuyentar mosquitos y Pendragon sin rastas 😀

#CasaVerdeRose… https://t.co/l17nhVEL9f",Sun Aug 09 02:14:25 +0000 2020,Morelos,Xochitepec,R,-99.2446225,18.7644275,685
Quisiera el súper poder de matar mosquitos con la mirada ALV,Sun Aug 09 07:10:09 +0000 2020,Ciudad de México,Cuauhtémoc,U,-99.153366,19.432836,545884
Me pican los mosquitos 🦟,Sun Aug 09 08:13:15 +0000 2020,Sinaloa,Culiacán,R,-107.3420565,24.6624885,0
"Se metió una pandilla de mosquitos a mi cuarto... 👀

*Modo ninja activado*",Sun Aug 09 09:39:28 +0000 2020,Ciudad de México,Azcapotzalco,U,-99.18212600000001,19.4857835,432205
"Still killing mosquitos at the airport, I’m ready to the GET THE FUCK ASAP. https://t.co/1x85hwY6bZ",Sun Aug 09 12:47:36 +0000 2020,Jalisco,Tlajomulco de Zúñiga,R,-103.300766,20.525411,23
Me when I see a mosquito or a fly https://t.co/kwwINOvfSm,Sun Aug 09 13:44:56 +0000 2020,Jalisco,Tlajomulco de Zúñiga,R,-103.407581,20.489708999999998,15
No hay mejor sentimiento que matar a un mosquito que lleva todo el día molestando,Mon Aug 10 01:58:08 +0000 2020,Guanajuato,León,R,-101.601401,21.09806,3
"3:11 un pediasure, y mate a dos mosquitos que me molestaban.",Mon Aug 10 08:12:26 +0000 2020,México,Lerma,R,-99.47699349999999,19.3262775,945
"Toda la cuarentena porque mosquitos satánicos. 
Esta semana porque la inspiración me a partir de las 3:30 am. 
El v… https://t.co/ZqDvWoxlt9",Mon Aug 10 08:53:39 +0000 2020,Ciudad de México,Cuauhtémoc,U,-99.153366,19.432836,545884
La picada de mosquito en el tobillo es de las cosas más cagantes de esta vida,Mon Aug 10 17:02:56 +0000 2020,Jalisco,Zapopan,R,-103.48477450000001,20.790657000000003,40
"Odio los mosquitos, parece que no tienen a más gente que picar 🙄😢",Mon Aug 10 19:16:54 +0000 2020,Veracruz de Ignacio de la Llave,Isla,R,-95.55394249999999,18.1218475,1
4 horas de sueño en 2 días...mosquitos 🦟 los saludos,Mon Aug 10 22:30:06 +0000 2020,Guanajuato,Guanajuato,R,-101.250134,21.0254965,0
Pinches mosquitos ya me tienen hasta la madre 🤬,Mon Aug 10 23:01:42 +0000 2020,Jalisco,Guadalajara,U,-103.292942,20.708994,1385621
Alguien sabe si los repelentes de mosquitos son veneno - pregunta seria 🤣JJAJAJAJ,Tue Aug 11 01:29:58 +0000 2020,Puebla,Amozoc,R,-98.1542665,19.0322295,616
These mf mosquitos have been going IN on me. ENOUGH 😩,Tue Aug 11 02:24:06 +0000 2020,Baja California,Tecate,R,-116.27497600000001,32.4072635,2
"voy a poner en mi bio:

“cazador y aniquilador profesional de mosquitos y cucarachas x las noches”.",Tue Aug 11 03:26:31 +0000 2020,Veracruz de Ignacio de la Llave,Emiliano Zapata,R,-96.7223325,19.455647499999998,56
@BJAlcaldia por las lluvias se está haciendo un criadero de mosquitos en Vértiz. Entre Diagonal de San Antonio y Mo… https://t.co/YLkckznrVj,Tue Aug 11 18:25:41 +0000 2020,Ciudad de México,Benito Juárez,U,-99.1614805,19.380613,434153
"Formas de alejar al mosquito chupasangre. Hace años me la hizo, en 2020, mi hermana, mi cuñado y yo, somos víctimas… https://t.co/yi37UNtuE0",Wed Aug 12 03:02:58 +0000 2020,Tamaulipas,Gómez Farías,R,-99.17776549999999,22.9917735,0
Neta que le ven de bueno al calor? Los mosquitos te comen y no puedes dormiiiir que horror ya me urge friesito.,Wed Aug 12 03:23:34 +0000 2020,Coahuila de Zaragoza,Saltillo,R,-101.166961,25.0326315,97
"Tremendo putazo me puse por matar un mosquito que hasta el hunter despertó Jajajaja, lo peor no lo mate 🙄",Wed Aug 12 03:30:34 +0000 2020,Jalisco,Zapopan,R,-103.48477450000001,20.790657000000003,40
"Pues gracias a Dios no fue COVID-19 pero me dio Chikungunya 😭😓 
#TemporadaDeLluvia #Mosquitos #DolorDeHuesos",Wed Aug 12 06:15:07 +0000 2020,Veracruz de Ignacio de la Llave,Amatlán de los Reyes,R,-96.80263599999999,18.823349,31
Puto mosquito 😡,Wed Aug 12 06:51:05 +0000 2020,Ciudad de México,Coyoacán,U,-99.15234000000001,19.328383000000002,614447
@ChavaFerrer @jozsolis @SrIrakini Malditos mosquitos 🦟 días,Wed Aug 12 12:38:41 +0000 2020,Guanajuato,León,R,-101.601401,21.09806,3
Estoy a un pendejo mosquito de agarrar el raid y un encendedor y arder todos en e infierno,Wed Aug 12 12:45:20 +0000 2020,Nuevo León,Apodaca,R,-100.27047400000001,25.736714999999997,0
Tengo chingos de piquetes de mosquito.,Wed Aug 12 16:34:53 +0000 2020,Jalisco,Zapopan,R,-103.48477450000001,20.790657000000003,40
"Cuatentena, inhalar diario insecticida para mosquitos en todas lss presentaciones posible porque comunidad de dengue alv.",Wed Aug 12 17:10:27 +0000 2020,Nuevo León,Monterrey,U,-100.29359149999999,25.6417185,1142952
"Cuarentena, inhalar diario insecticida para mosquitos en todas las presentaciones posible porque comunidad de dengue alv.",Wed Aug 12 17:10:53 +0000 2020,Nuevo León,Monterrey,U,-100.29359149999999,25.6417185,1142952
Mi vida es una guerra campal entre los mosquitos y yo🤬🤬,Wed Aug 12 19:52:03 +0000 2020,Veracruz de Ignacio de la Llave,Tierra Blanca,R,-96.3057195,18.5272195,65
"Refuerza Comisaría de Bahía de Kino acciones contra la proliferación de mosquitos.
De forma coordinada con la Direc… https://t.co/8jhyl2MxXm",Wed Aug 12 19:56:41 +0000 2020,Sonora,Hermosillo,R,-111.498181,28.9698625,5
"“Sin criaderos no hay mosquitos y sin mosquitos 🦟 no hay dengüe”.
Iniciemos las medidas preventivas contra las enfe… https://t.co/Io0hZZQPLC",Wed Aug 12 21:08:53 +0000 2020,Coahuila de Zaragoza,Piedras Negras,R,-100.6071045,28.774769,124
Pinché madre con este mosquito que me esta zumbando en la oreja,Thu Aug 13 02:41:25 +0000 2020,Nuevo León,Apodaca,R,-100.1687175,25.778679,1879
Pinches mosquitos no me dejaron dormir,Thu Aug 13 13:01:08 +0000 2020,Querétaro,Querétaro,R,-100.4405945,20.7152745,9
Inexperiencia en la 🚲 nivel Hugo: me tragué 4 mosquitos 🦟,Thu Aug 13 13:23:40 +0000 2020,San Luis Potosí,San Luis Potosí,R,-100.955511,22.3111195,18
"Y qué onda, a cuantos de ustedes los levantó un mosquito cantador a media noche... 🥵🦟",Thu Aug 13 14:17:41 +0000 2020,Ciudad de México,Cuauhtémoc,U,-99.153366,19.432836,545884
@BelenMarin @Domeherrera26 Ni los mosquitos me paran bola y te mandas semejante tuit. Belen es malo burlarse de la desgracia ajena.,Thu Aug 13 16:13:44 +0000 2020,Michoacán de Ocampo,Tangamandapio,R,-102.4609915,19.890579,128
These mosquitos tore me up. I must taste good or sumthing 🥴,Thu Aug 13 20:06:31 +0000 2020,Baja California,San Quintín,R,-115.5798785,30.156488499999995,4
@pablorubenv pti Aparecen mosquitos gigantes en Tampico del tamaño de una moneda de 5 pesos https://t.co/tSB7i0T18a,Thu Aug 13 21:56:20 +0000 2020,Morelos,Cuernavaca,R,-99.260819,18.933812,78
I was in a cave accidentally touching bat poop and getting mosquito bites to the face,Thu Aug 13 22:37:45 +0000 2020,Quintana Roo,Felipe Carrillo Puerto,R,-88.0134815,19.749553,11
"Con estas acciones se combate a los mosquitos transmisores de enfermedades vectoriales, para salvaguardar la salud… https://t.co/12AmzluKlG",Fri Aug 14 00:32:23 +0000 2020,Campeche,Campeche,R,-90.27714,19.601414,0
I DEFINITELY will choose to have a whole bunch of bats!! They a… https://t.co/h8UIghOzOv",Fri Aug 14 04:46:02 +0000 2020,Jalisco,San Pedro Tlaquepaque,R,-103.34832399999999,20.592133,0
Puto mosquito,Fri Aug 14 06:57:37 +0000 2020,Baja California,Playas de Rosarito,R,-116.929102,32.3328765,5
I wish someone would love me the way mosquitos love me.,Fri Aug 14 15:47:54 +0000 2020,Quintana Roo,Puerto Morelos,R,-87.0316645,21.048719,0
"Para evitar la propagación del mosquito transmisor del #Dengue, #Zika y #Chinkugunya.

Estas #Acciones reafirman el… https://t.co/GjqNUdKptD",Fri Aug 14 18:57:44 +0000 2020,Tamaulipas,Valle Hermoso,R,-97.85997549999999,25.7817945,0
"Sabías que Sahumando evitas mosquitos, moscas y algunas  plagas de insectos, porque las plantas medicinales sueltan… https://t.co/xsKVaXgycY",Sat Aug 15 01:04:09 +0000 2020,Quintana Roo,Puerto Morelos,R,-87.0316645,21.048719,0
"Pinches mosquitos, son mutantes!",Sat Aug 15 01:05:23 +0000 2020,Jalisco,Tepatitlán de Morelos,R,-102.71283700000001,20.818671000000002,4
"@gpfotografiaMty Cuando la tomé, se escuchaban ranas, grillos, abejas.. y mosquitos en la oreja.. 🥴 Pero eso no sal… https://t.co/oXgFMSCzkk",Sat Aug 15 01:37:07 +0000 2020,Nuevo León,Apodaca,R,-100.27047400000001,25.736714999999997,0
"¿Saben que me caga de los mosquitos?
Su mera existencia",Sat Aug 15 03:04:31 +0000 2020,Hidalgo,Tezontepec de Aldama,R,-99.28307450000001,20.175542999999998,215
¿Por qué los mosquitos son tan mamones?,Sat Aug 15 13:08:25 +0000 2020,Chihuahua,Juárez,R,-106.568008,31.452274000000003,-
Parece que los mosquitos hacen fila para chingar.,Sat Aug 15 23:53:05 +0000 2020,Jalisco,Zapopan,R,-103.48477450000001,20.790657000000003,40
Ya estoy harto de los mosquitos!!!!,Sun Aug 16 03:43:51 +0000 2020,Durango,Lerdo,R,-103.657843,25.471381,0
"Tulum mosquitos are a different breed. Have tried every brand, lotion and spray over the years and am still literal… https://t.co/BO80efCblc",Sun Aug 16 05:36:37 +0000 2020,Quintana Roo,Felipe Carrillo Puerto,R,-88.0134815,19.749553,11
Why my best nights out here gotta end with 30 mosquito bites 💀,Sun Aug 16 08:42:22 +0000 2020,Quintana Roo,Felipe Carrillo Puerto,R,-88.0134815,19.749553,11
@brujaporras Asi es jajaja pinches mosquitos solo despiertan a uno cuando estas privado,Sun Aug 16 19:02:18 +0000 2020,México,Atizapán de Zaragoza,R,-99.269192,19.564587500000002,13
"Mientras tú me ignoras, los mosquitos me disfrutan.",Mon Aug 17 01:26:58 +0000 2020,Hidalgo,Tetepango,U,-99.148397,20.112789499999998,9145
What do mosquitos do with the blood they steal from us. So rude.,Mon Aug 17 01:49:39 +0000 2020,Quintana Roo,Felipe Carrillo Puerto,R,-88.0134815,19.749553,11
Insultar mosquitos es parte del ritual de matar moscos !,Mon Aug 17 04:20:17 +0000 2020,México,Atizapán de Zaragoza,R,-99.269192,19.564587500000002,13
Fuck man.  I really cannot is these fucking mosquito bites. Like I’m really boutta lose my shit,Mon Aug 17 05:08:47 +0000 2020,Quintana Roo,Felipe Carrillo Puerto,R,-88.0134815,19.749553,11
"Other than wanting to jump into hot lava to burn off my 40+ mosquito bites, life is GOOD. https://t.co/JZUfgI8Pnk",Mon Aug 17 07:59:27 +0000 2020,Quintana Roo,Felipe Carrillo Puerto,R,-88.0134815,19.749553,11
Yo soy del porcentaje que le dice de cosas al mosquito cuando estoy apunto de matarlo o lo acabo de matar!… https://t.co/ExaA8Fzx74,Mon Aug 17 12:05:39 +0000 2020,San Luis Potosí,San Luis Potosí,R,-100.955511,22.3111195,18
"Bueno, de un cuerpo de más de 50 kilos, el mosquito me ha picado en el ojo.  Ya no necesito el filtro de ojos de caricatura 🤷🏻‍♀️",Mon Aug 17 12:50:03 +0000 2020,Ciudad de México,Benito Juárez,U,-99.1614805,19.380613,434153
@diabla1_ el mosquito después de ver este tuit: 👁️👄👁️,Mon Aug 17 15:43:00 +0000 2020,Nuevo León,Monterrey,U,-100.29359149999999,25.6417185,1142952
Ya no siento las inyecciones  pero si los mosquitos 🤦🏻‍♂️,Mon Aug 17 16:13:30 +0000 2020,Querétaro,Corregidora,R,-100.43973100000001,20.478755,2494
Me picó un mosquito en una nalga. :)))),Mon Aug 17 16:50:29 +0000 2020,Michoacán de Ocampo,Morelia,R,-101.27577,19.652724,84
Ahora q voy al rancho seguido no aguanto la picazon de mosquitos y polvillo 😣😣,Mon Aug 17 20:30:14 +0000 2020,Tamaulipas,Aldama,R,-98.062778,22.962645000000002,1
Tú qué sabes de dolor si nunca te has sacado un mosquito con pelito 😢,Mon Aug 17 21:59:20 +0000 2020,Tabasco,Nacajuca,R,-92.9164995,18.0219595,432
"▶️ Con el inicio de la #TemporadaDeLluvias 🌧️ en nuestro estado, aumenta la reproducción del mosquito transmisor de… https://t.co/imaDCSU1w8",Mon Aug 17 22:45:19 +0000 2020,Puebla,Atlixco,R,-98.4531485,18.902124,48
Pinches mosquitos,Mon Aug 17 23:24:15 +0000 2020,Guanajuato,Irapuato,R,-101.3403935,20.673542,23
"“Sin criaderos no hay mosquitos y sin mosquitos 🦟 no hay dengüe”.
“NO TE AUTOMEDIQUES” 
En caso de presentar síntom… https://t.co/CxLtB1x7LA",Tue Aug 18 02:57:40 +0000 2020,Coahuila de Zaragoza,Piedras Negras,R,-100.6071045,28.774769,124
Ya estoy a punto de dormir y un mosquito anda moliendo !!!! https://t.co/TG4UNKShsz,Tue Aug 18 06:30:18 +0000 2020,Puebla,Amozoc,R,-98.1542665,19.0322295,616
"@marianamayorgam El clima o los mosquitos, o ambos. 🤧",Tue Aug 18 07:38:41 +0000 2020,Aguascalientes,Aguascalientes,R,-102.327207,21.849459000000003,0
#UnGifparaDecirte que ya te calmes... ( inche mosquito)...@YODEBUENAS @La99fm @ClubChavorrucos https://t.co/lLeRX4javw,Tue Aug 18 10:34:47 +0000 2020,Morelos,Jiutepec,U,-99.1686505,18.886686500000003,174629
@Becky_Lanz Los piquetes de mosquito no arden 🤔,Tue Aug 18 13:48:18 +0000 2020,Querétaro,Querétaro,R,-100.4405945,20.7152745,9
@barbaraadavila mosquitos love my house 😈🥰,Tue Aug 18 15:04:07 +0000 2020,Oaxaca,Oaxaca de Juárez,R,-96.7250025,17.090319,685
Cuando en el avion hay mosquitos 😏,Tue Aug 18 15:58:10 +0000 2020,Jalisco,Guadalajara,U,-103.335882,20.676651999999997,1385621
"Really not rocking with all the scars from these mosquito bites😒

Not gonna trip tho. 
Will figure out w/e Beyoncé… https://t.co/heEEc7Oh64",Tue Aug 18 16:29:35 +0000 2020,Quintana Roo,Felipe Carrillo Puerto,R,-88.0134815,19.749553,11
Adios a los piquetes de mosco te lo frotas en el.cuerpo y no se acercan los mosquitos.. https://t.co/nKeBrpCIIm,Tue Aug 18 17:52:22 +0000 2020,México,Nezahualcóyotl,R,-99.01701650000001,19.432722,85
@_nilsonaguirre Chingos de mosquitos que ha de tener ese de las plantas!,Tue Aug 18 19:40:19 +0000 2020,Ciudad de México,La Magdalena Contreras,U,-99.24800950000001,19.318042,246428
@varjakseoj quien fuera mosquito! aveda...,Tue Aug 18 21:35:18 +0000 2020,Jalisco,Zapopan,R,-103.48477450000001,20.790657000000003,40
"Omg I could do cenotes tours all day erryday😍 
(wearing a full body speedo tho cuz I’m a mosquito magnet lol) https://t.co/NydAGeKJir",Tue Aug 18 22:26:14 +0000 2020,Quintana Roo,Felipe Carrillo Puerto,R,-88.0134815,19.749553,11
qn insulta al mosquito después de matarlo? Para casarnos de a mentiritas,Wed Aug 19 04:53:23 +0000 2020,Tamaulipas,Matamoros,R,-97.547392,25.558993,0
quien insulta al mosquito después de matarlo? Para casarnos de a mentiritas,Wed Aug 19 04:53:54 +0000 2020,Tamaulipas,Matamoros,R,-97.547392,25.558993,0
"No les da un chingo de coraje matar un mosquito en su cuarto y ver que le salio un chingooo de sangre?! 
ES MI SANG… https://t.co/uhgbherbNs",Wed Aug 19 07:38:11 +0000 2020,Baja California,Mexicali,R,-115.22918000000001,31.789669500000002,19
"El mundo sería un sitio más bonito si los mosquitos chuparan grasa, no sangre.",Wed Aug 19 12:14:30 +0000 2020,San Luis Potosí,San Luis Potosí,R,-100.955511,22.3111195,18
Cuando en el avion hay mosquitos @VivaAerobus 😠,Wed Aug 19 17:03:18 +0000 2020,Chiapas,San Cristóbal de las Casas,R,-92.534411,16.663044499999998,0
@absurdeando Entonces seremos dos mosquitos,Wed Aug 19 17:17:26 +0000 2020,Ciudad de México,Iztapalapa,U,-99.050461,19.342788499999997,1835486
"“Sin criaderos no hay mosquitos y sin mosquitos 🦟 no hay dengüe”.
Iniciemos las medidas preventivas contra las enfe… https://t.co/YOmEFZIxKe",Wed Aug 19 17:39:02 +0000 2020,Ciudad de México,Coyoacán,U,-99.15234000000001,19.328383000000002,614447
"🚨🚨🚨 PREGUNTA SERIA 🚨🚨🚨

.      ¿Ustedes también insultan al      .
   mosquito cuando logran matarlo?
╰ ◟◞ ◟  ͜   ◟… https://t.co/S4AOlwLcxq",Wed Aug 19 19:03:06 +0000 2020,Veracruz de Ignacio de la Llave,Emiliano Zapata,R,-96.7223325,19.455647499999998,56
"Nadie:
Absolutamente nadie:
El mosquito de mi cuarto a las 3:00 am:",Wed Aug 19 21:24:44 +0000 2020,México,Tejupilco,R,-100.26228950000001,18.8902945,92
@eduardo_carrera @ea_puerto @pkumamoto Y el dengue es estacional no es permanente a lo largo del año. El mosquito n… https://t.co/I8aeXE0meE,Wed Aug 19 21:56:24 +0000 2020,Jalisco,Zapopan,R,-103.48477450000001,20.790657000000003,40
Me tienen harta los mosquitos,Wed Aug 19 23:57:06 +0000 2020,Baja California,Playas de Rosarito,R,-116.929102,32.3328765,5
"Mosquito #insecto #instamx #alas #zumbido #bug #wing #bnw_planet #instabug #bnw #buzz #bnw_life @ Mexico City, Mexi… https://t.co/HN5GsmquRE",Thu Aug 20 01:25:29 +0000 2020,Ciudad de México,Cuauhtémoc,U,-99.153366,19.432836,545884
Vine al parque para que mínimo está cuarentena me piquen los mosquitos. 🙊,Thu Aug 20 02:44:58 +0000 2020,Nuevo León,Monterrey,U,-100.29359149999999,25.6417185,1142952
"Chingos de piquetes de mosquito, chingo de comezón, me caga ! 😠 https://t.co/zOa6xTdfn4",Thu Aug 20 05:13:46 +0000 2020,San Luis Potosí,San Luis Potosí,R,-100.955511,22.3111195,18
"@licanakari Pero esos piquetes fueron en el Tour Chapala, Jalisco jajaja esperó todo bien 😅 putos mosquitos !",Thu Aug 20 05:23:28 +0000 2020,San Luis Potosí,San Luis Potosí,R,-100.955511,22.3111195,18
Me acabo de meter tremendo zape para aniquilar a un mosquito... y ni lo maté. 🤦‍♀️,Thu Aug 20 08:13:11 +0000 2020,Ciudad de México,Benito Juárez,U,-99.1614805,19.380613,434153
Cuántos mosquitos pueden picarme al mismo tiempo ?,Thu Aug 20 12:30:52 +0000 2020,Yucatán,Mérida,R,-89.62361100000001,20.941035,0
Estaba en la noche pensando “que chido que no hay mosquitos en el hospital” y a las 5 de la mañana entro la enferme… https://t.co/bV96XNkU8F,Thu Aug 20 13:16:52 +0000 2020,Querétaro,Querétaro,R,-100.4405945,20.7152745,9
"Mercado con mosquitos y aguas negras
Los sanitarios no sirven. La inseguridad sigue igual @PoliciaGDL

Mercado Muni… https://t.co/9myFj2SJf1",Thu Aug 20 14:52:16 +0000 2020,Jalisco,Guadalajara,U,-103.304378,20.659088,1385621
"Si estuviera en el manglar contigo, los mosquitos no me preocuparían",Thu Aug 20 14:53:23 +0000 2020,Yucatán,Mérida,R,-89.62361100000001,20.941035,0
"#DiaMundialDelMosquito🦟| Debido a su capacidad para transmitir enfermedades con sus picaduras, los mosquitos se han… https://t.co/KSaCaxPQ47",Thu Aug 20 15:16:21 +0000 2020,Tamaulipas,Valle Hermoso,R,-97.85997549999999,25.7817945,0
Los invito a que durante este día limpiemos nuestros patios para evitar la propagación del mosquito transmisor del… https://t.co/suLY1hJaYa,Thu Aug 20 15:16:23 +0000 2020,Tamaulipas,Valle Hermoso,R,-97.85997549999999,25.7817945,0
Bitch.. I’m leaving my moms town and going to the city officially no more mosquito bites https://t.co/Pvw8sGogd3,Thu Aug 20 15:34:25 +0000 2020,Morelos,Yautepec,R,-99.041365,18.873686,2
@betotok @BJAlcaldia @AccionesBJ @STaboadaMx con las lluvias se está haciendo un excelente criadero de mosquitos. E… https://t.co/RZSXdaVSz5,Thu Aug 20 18:26:42 +0000 2020,Ciudad de México,Benito Juárez,U,-99.1614805,19.380613,434153
"@FerBetancourt9 @Claudiashein Que poca madre y la mafafa mosquito ahora que dirá, lo bueno que ya no se usa la fuer… https://t.co/6ihnXQLFep",Thu Aug 20 23:43:12 +0000 2020,Baja California Sur,Los Cabos,R,-109.7662685,23.269879,2
La generación espontánea si existe. Y los mosquitos de fruta son la prueba alv,Fri Aug 21 00:56:16 +0000 2020,Ciudad de México,Tlalpan,R,-99.208364,19.199485,86
Gracias Sr.Mosquito por devolverme mi sangre. 🦟 https://t.co/yYqONcEGrw,Fri Aug 21 00:59:39 +0000 2020,México,Tlalnepantla de Baz,U,-99.1642825,19.543933000000003,658907
Wow. Diseñaron un mosquito (modificación genética) que optimiza no piquen por sangre sino que se alimenten SOLO de… https://t.co/nR2F6kFdqV,Fri Aug 21 02:22:01 +0000 2020,Ciudad de México,Benito Juárez,U,-99.1614805,19.380613,434153
Me picó un mosquito en la planta del pié 😣,Fri Aug 21 03:10:53 +0000 2020,Yucatán,Mérida,R,-89.62361100000001,20.941035,0
"Yo: Ya me voy a dormir.

Los mosquitos: Oilo. 💉",Fri Aug 21 05:28:42 +0000 2020,Ciudad de México,Azcapotzalco,U,-99.18212600000001,19.4857835,432205
Vale m... Hay un mosquito en mi recámara y ya que voy relajándome me zumba en el oído,Fri Aug 21 06:01:13 +0000 2020,México,Tlalnepantla de Baz,U,-99.1158905,19.518656,13030
not even an hour in and i already have 2 mosquito bites 😪,Fri Aug 21 10:24:41 +0000 2020,Michoacán de Ocampo,Copándaro,R,-101.215994,19.9183735,1861
Soy de esas personas que sí escuchan un mosquito no descansan hasta matarlo.,Fri Aug 21 10:24:56 +0000 2020,Morelos,Cuernavaca,R,-99.260819,18.933812,78
Mosquito https://t.co/cStKiEBEit,Fri Aug 21 11:12:11 +0000 2020,México,Ecatepec de Morelos,R,-99.09030349999999,19.626005,1043
Yo me chingue 10 mendigos mosquitos q no me dejaban dormir,Fri Aug 21 11:48:58 +0000 2020,San Luis Potosí,Soledad de Graciano Sánchez,R,-100.860774,22.291455,0
"Mexico 12 
Adri 0 
My ass is on fire I legit have like 20 mosquito bites 😫🥺",Fri Aug 21 12:49:12 +0000 2020,Baja California Sur,Los Cabos,R,-109.7662685,23.269879,2
Only the mosquitos know how delicious I am.,Fri Aug 21 15:59:19 +0000 2020,Veracruz de Ignacio de la Llave,Veracruz,R,-96.22939650000001,19.183953,3
Hay un puto mosquito que me está molestando y parece que me está dejando sin sangre !!! Los odio!!!!,Fri Aug 21 19:02:08 +0000 2020,Nuevo León,Monterrey,U,-100.29359149999999,25.6417185,1142952
"Si usted es de los que mataría por unos taquitos al pastor gratis, que mejor que mate a los mosquitos, moscas y cuc… https://t.co/i9wFcU90Li",Fri Aug 21 20:54:33 +0000 2020,Jalisco,Guadalajara,U,-103.335882,20.676651999999997,1385621
Las autoridades de Florida planean liberar a 750 millones de mosquitos modificados para contrarrestar los efectos d… https://t.co/EibOg1bzZf,Fri Aug 21 21:50:22 +0000 2020,Puebla,Amozoc,R,-98.1542665,19.0322295,616
Deberíamos estarnos enfocando en cómo desaparecer a los mosquitos sin que afecte a la cadena alimenticia en vez de otras pendejadas,Fri Aug 21 22:54:24 +0000 2020,San Luis Potosí,San Luis Potosí,R,-100.955511,22.3111195,18
Me están comiendo los mosquitos 🦟,Sat Aug 22 01:05:39 +0000 2020,Chiapas,Palenque,R,-91.8061025,17.4616645,167
Los mosquitos ya son inmunes al repelente 😢😭,Sat Aug 22 03:53:44 +0000 2020,Yucatán,Mérida,R,-89.62361100000001,20.941035,0
Nom'bre... Para colmo... ¡Un mosquito!,Sat Aug 22 06:39:49 +0000 2020,Ciudad de México,Iztapalapa,U,-99.050461,19.342788499999997,1835486
Y como se a que mosquito matar!!🤣🤣🤣,Sat Aug 22 07:45:18 +0000 2020,Veracruz de Ignacio de la Llave,Veracruz,R,-96.22939650000001,19.183953,3
These mosquito bites ain’t it 😓,Sat Aug 22 09:00:17 +0000 2020,Jalisco,Degollado,R,-102.157003,20.457765000000002,0
Valoro mi paz nuevamente cuando obtengo el  placer único de matar al mosquito que ha estado jodiendo un buen rato. Namasté. 🍃,Sat Aug 22 19:20:09 +0000 2020,Jalisco,Guadalajara,U,-103.335882,20.676651999999997,1385621
@Lycaones Mosquito 🦟 maldito,Sat Aug 22 22:59:12 +0000 2020,México,Valle de Bravo,R,-100.1125095,19.1713575,227
Waking up from a nap and these damn mosquitos got me on my forehead smh,Sat Aug 22 23:28:19 +0000 2020,Baja California,San Quintín,R,-115.5798785,30.156488499999995,4
Ay me están picando los mosquitos 🥺,Sat Aug 22 23:58:19 +0000 2020,Chiapas,Tapachula,R,-92.3094495,14.920494999999999,8
"@Ecatepec en las colonias Florida, Azteca, Polígonos y Sagitario 8 hay una plaga de mosquitos se requiere que el mu… https://t.co/PvrCRcVboP",Sun Aug 23 00:07:41 +0000 2020,México,Ecatepec de Morelos,R,-99.0444445,19.56828,615
"Naaambre, que van a saber ustedes de relaciones tóxicas si no conocen mi relación con los mosquitos. Esos malditos… https://t.co/yjdj0DEXvL",Sun Aug 23 01:14:28 +0000 2020,Veracruz de Ignacio de la Llave,Veracruz,R,-96.22939650000001,19.183953,3
Cuando aplaudo para matar un mosquito y veo que ni siquiera le atiné 🦟 https://t.co/4Bx6fVt433,Sun Aug 23 01:51:20 +0000 2020,Guanajuato,León,R,-101.601401,21.09806,3
Chuuula picada de mosquitos el miércoles en Mina:) solo espero que no me dé dengue 🙂🙂🙂,Sun Aug 23 02:01:53 +0000 2020,Veracruz de Ignacio de la Llave,Coatzacoalcos,U,-94.43248200000001,18.135455,212540
"Noche nublada luna nueva calor sofocante mosquitos sudor pero eso si panza llena, demos gracias a dios 
Buenas noches",Sun Aug 23 03:00:09 +0000 2020,Sinaloa,Ahome,R,-109.1037265,25.921946500000004,308
Llevo casi una hora tratando de matar a un mosquito 🦟,Sun Aug 23 06:50:50 +0000 2020,México,Tlalnepantla de Baz,U,-99.1642825,19.543933000000003,658907
Atrapar mosquitos con una sola mano y fallar en el intento is my passion,Sun Aug 23 16:53:12 +0000 2020,San Luis Potosí,San Luis Potosí,R,-100.955511,22.3111195,18
"Ayer me percate que había un mosquito en el cuarto. 
Y yo soy de las que cuando hay un mosquito no para hasta matar… https://t.co/mXjMVa1F5P",Sun Aug 23 22:23:46 +0000 2020,Ciudad de México,Iztapalapa,U,-99.050461,19.342788499999997,1835486
"¡Juntos contra el #Dengue!

Conoce sus síntomas y aprende a identificarlo.

Sin criaderos no hay mosquitos, y sin m… https://t.co/EwQDEoCna0",Mon Aug 24 01:41:20 +0000 2020,Tabasco,Nacajuca,R,-92.9164995,18.0219595,432
🦟 no había visto qué hay un emoji de mosquito 🦟,Mon Aug 24 02:51:57 +0000 2020,Campeche,Campeche,R,-90.27714,19.601414,0
