Tweet,Fecha,Estado,Locacion,Tipo,Longitud,Latitud,Poblacion
"Para mi, la noche es un infierno. No duermo, muero de calor, me da ansiedad, me duele la cabeza, mato zancudos, me… https://t.co/8ey2vvQCZG",Wed Apr 22 04:39:19 +0000 2020,Querétaro,Querétaro,R,-100.4405945,20.7152745,9
"Cuando ya no sabes qué más contar, además de ovejas y zancudos, porque nomás no te da sueño... 🥺 #insomnia https://t.co/WSnUtW8OhG",Wed Apr 22 05:23:46 +0000 2020,México,Nezahualcóyotl,R,-99.087817,19.4320755,0
Noche de mierda... increíble el poder que tiene un zancudo para destruirte.,Wed Apr 22 16:06:27 +0000 2020,Ciudad de México,Cuauhtémoc,U,-99.153366,19.432836,545884
Me cagan los zancudos.,Thu Apr 23 03:00:54 +0000 2020,Michoacán de Ocampo,Nuevo Parangaricutiro,R,-102.1675635,19.439252,0
ya maté como 13 zancudos. estoy harta,Thu Apr 23 06:30:46 +0000 2020,Ciudad de México,Benito Juárez,U,-99.1614805,19.380613,434153
"POR FIN PUDE MATAR AL PINCHE ZANCUDO, a ver si ahora ya puedo dormir. https://t.co/aeBCaL234y",Thu Apr 23 10:46:15 +0000 2020,Nuevo León,Guadalupe,R,-100.196134,25.6766035,28
"@Edgarmolinas @BDNSonora Abrir la ventana no es opción, ya hay mucho zancudo",Thu Apr 23 13:17:19 +0000 2020,Sonora,Hermosillo,R,-111.498181,28.9698625,5
@pinchideste Jajajaja si te comen los zancudos es que estas sabroso! 🤭,Thu Apr 23 16:00:47 +0000 2020,Nuevo León,General Zuazua,R,-100.1552455,25.923025000000003,292
Malditos zancudos 🥺 me comen vivaaa🤪🤪,Thu Apr 23 23:16:10 +0000 2020,Coahuila de Zaragoza,Monclova,R,-101.220857,26.878203499999998,0
Esta bien culero cuando te pica un zancudo en la planta del pie😢,Fri Apr 24 02:28:15 +0000 2020,Nuevo León,Monterrey,U,-100.29359149999999,25.6417185,1142952
@k_flores17 Y los malditos zancudos!!,Fri Apr 24 02:49:11 +0000 2020,Nuevo León,Monterrey,U,-100.29359149999999,25.6417185,1142952
"Recuerdo cuando fuimos a acampar:
- Un shingo de zancudos en la noche y no corría aire
- El alacrán k salió en la l… https://t.co/5tD5w2FQjX",Fri Apr 24 03:22:55 +0000 2020,Sonora,Hermosillo,R,-111.498181,28.9698625,5
"Noche Fresquita con mis bestias 🐾, Zancudos de los aferrados🦟 y cucarachas voladoras 👨🏻‍🚀 salud Jefazos brindemos p… https://t.co/XLGv0vedbG",Fri Apr 24 04:36:21 +0000 2020,Nuevo León,San Pedro Garza García,R,-100.366033,25.650287499999997,2
@nelvaldez Y zancudos!!,Fri Apr 24 10:36:45 +0000 2020,Nuevo León,Monterrey,U,-100.29359149999999,25.6417185,1142952
Me picó un zancudo en la frente,Sat Apr 25 01:34:10 +0000 2020,Sonora,Magdalena,R,-111.0074495,30.7620135,0
Como puede un zancudo chingarte aún teniendo mezclilla? 😡,Sat Apr 25 01:55:42 +0000 2020,Colima,Manzanillo,R,-104.36337999999999,19.128538,0
"No están para que les cuente pero hoy en la madruga, cielos, un enorme y gran zancudo se me metió en la nariz, oh d… https://t.co/sLJOT6n8Ad",Sat Apr 25 05:22:42 +0000 2020,Ciudad de México,Benito Juárez,U,-99.1614805,19.380613,434153
Ya hay zancudos.. con dengue‽ 🤐😟,Wed Apr 01 02:20:43 +0000 2020,Jalisco,Guadalajara,U,-103.335882,20.676651999999997,1385621
"Por la tarde hubo arcoíris olía a que iba a llover, incluso entraron zancudos largos. Hasta aquí mi reporte meteorológico.",Wed Apr 01 03:34:57 +0000 2020,Zacatecas,Zacatecas,R,-102.6943495,22.7306065,-
"Día 1 de Homme Office:
- se me pasó rápido 
- sentí que no avanzaba mis pendientes 
- me picaron 2 zancudos",Wed Apr 01 05:58:35 +0000 2020,Nuevo León,Monterrey,U,-100.29359149999999,25.6417185,1142952
Lo único bueno de venir a la oficina es que no hay zancudos,Wed Apr 01 13:35:31 +0000 2020,Nuevo León,Guadalupe,R,-100.196134,25.6766035,28
"Para quien sufre de putos zancudos como yo les paso un tip, compren incienso olor citronela esta madre es una plant… https://t.co/vC73x2SDRq",Wed Apr 01 20:24:00 +0000 2020,San Luis Potosí,San Luis Potosí,R,-100.955511,22.3111195,18
Si no nos friega en los próximos días el coronavirus... lo harán los zancudos. Se dejaron venir.,Thu Apr 02 03:05:07 +0000 2020,Sonora,Hermosillo,R,-111.498181,28.9698625,5
"@Malefica028 Mi rutina desde el 16 de marzo,salir al patio en las mecedoras a darle de comer a los zancudos🧓",Thu Apr 02 04:22:41 +0000 2020,Nuevo León,Apodaca,R,-100.1687175,25.778679,1879
Odio los zancudos,Thu Apr 02 06:38:02 +0000 2020,Puebla,Huauchinango,U,-98.053888,20.1744365,58957
@ixmacrixpin X2 a excepción eventual de algo inmundo y maldito que se llama “zancudos”,Thu Apr 02 14:46:59 +0000 2020,San Luis Potosí,San Luis Potosí,R,-100.955511,22.3111195,18
"Con esto del #COVID19 y el aislamiento, abrí puertas y ventanas y las volví a cerrar, peligro y muera por Dengue... hay zancudos 🤦‍♂️ puffs",Thu Apr 02 16:18:12 +0000 2020,Tamaulipas,Victoria,R,-99.187904,23.685934,0
@biscuitsuzuki Los zancudos??,Thu Apr 02 19:59:24 +0000 2020,Puebla,Huauchinango,U,-98.053888,20.1744365,58957
Cazadora de zancudos 🦟,Fri Apr 03 07:04:53 +0000 2020,Oaxaca,Oaxaca de Juárez,R,-96.7250025,17.090319,685
No se cómo pero anoche me masacraron los zancudos bien cabron,Fri Apr 03 16:13:31 +0000 2020,Coahuila de Zaragoza,Piedras Negras,R,-100.6071045,28.774769,124
Hay un pinché zancudo 🦟 que siempre me come en las noches ya me tiene harta 😭todos los piquetes son de el,Sat Apr 04 07:00:45 +0000 2020,Querétaro,Corregidora,R,-100.43973100000001,20.478755,2494
"Aparte de chingar la madre, ¿los zancudos tienen alguna función en en planeta?",Sat Apr 04 17:31:59 +0000 2020,Chiapas,Jiquipilas,R,-93.536185,16.7863745,335
Y a los zancudos no les aplican el #QuedateEnCasa ? Supinshemadre no dejan de chingarme día y noche,Sat Apr 04 19:17:50 +0000 2020,Sonora,Empalme,R,-110.72232699999999,27.8836995,1
@ladygaga @Jesusernestto  Cuando se pega el Zancudo en la raqueta electrica.,Mon Apr 06 01:16:13 +0000 2020,Sinaloa,Mazatlán,R,-106.2717475,23.46814,0
Que bravos andan los zancudos... Son los dueños del patio 😔,Mon Apr 06 01:41:47 +0000 2020,Sonora,Hermosillo,R,-111.498181,28.9698625,5
Y los zancudos no faltan.,Mon Apr 06 07:46:32 +0000 2020,Veracruz de Ignacio de la Llave,Ursulo Galván,R,-96.397398,19.44633,5
#Zaachila #Zancudos,Mon Apr 06 10:39:57 +0000 2020,Oaxaca,San Raymundo Jalpan,R,-96.778582,16.962189000000002,36
Los zancudos me cargan a monte,Tue Apr 07 08:19:55 +0000 2020,Ciudad de México,Cuauhtémoc,U,-99.153366,19.432836,545884
"Yo diciéndole a un zancudo que voló antes de matarlo...
🦟 https://t.co/OLRkEFbFCZ",Wed Apr 08 02:20:32 +0000 2020,Ciudad de México,Cuauhtémoc,U,-99.153366,19.432836,545884
"Me dormí por la tarde y me picaton los zancudos (lo único que me pica estos días, fue ganancia 😪)",Wed Apr 08 02:26:46 +0000 2020,Veracruz de Ignacio de la Llave,Córdoba,R,-96.937002,18.925289499999998,0
"Yo diciéndole a un zancudo que voló antes de matarlo:
“Te salvaste de mi maldito” 
🦟 https://t.co/bQXxg2nW82",Wed Apr 08 02:28:48 +0000 2020,Ciudad de México,Cuauhtémoc,U,-99.153366,19.432836,545884
La disputa contra un zancudo 🦟 está quitándome el sueño,Wed Apr 08 05:44:41 +0000 2020,Oaxaca,Miahuatlán de Porfirio Díaz,R,-96.64987249999999,16.359471,169
Acabo de hacer algo MUY ESTÚPIDO. Me acabo de dar un cacheteadón porque sentí que el estúpido zancudo (que me tiene… https://t.co/g3EQtUkUYv,Wed Apr 08 06:03:32 +0000 2020,Nuevo León,Monterrey,U,-100.29359149999999,25.6417185,1142952
Me picó un zancudo en el juanete!,Wed Apr 08 07:02:41 +0000 2020,San Luis Potosí,San Luis Potosí,R,-100.955511,22.3111195,18
Odio los zancudos 🥺,Sun Apr 26 02:09:07 +0000 2020,Sonora,Hermosillo,R,-111.498181,28.9698625,5
Acabo de matarme un zancudo en mi frente 🦟 #QuedateEnCasa,Sun Apr 26 04:14:11 +0000 2020,Nuevo León,Linares,U,-99.538038,24.8558175,70378
"En mi cuarto están muchos zancudos y pues dije, deja prendo una de esas cosas que salen humo y que son redonditas y… https://t.co/8opG2IVpKQ",Mon Apr 27 04:29:10 +0000 2020,Nuevo León,Monterrey,U,-100.29359149999999,25.6417185,1142952
Pinches zancudos ya son inmortales o que pedo? https://t.co/uZhbmh0itt,Mon Apr 27 04:32:36 +0000 2020,Nuevo León,Monterrey,U,-100.29359149999999,25.6417185,1142952
Me encanta este clima pero odio a los zancudos!!!!!☹️,Mon Apr 27 04:51:03 +0000 2020,Nuevo León,Guadalupe,R,-100.196134,25.6766035,28
Yo tratando de matar a los pitos zancudos y se me escapan :( https://t.co/4q08o0qARD,Mon Apr 27 08:05:52 +0000 2020,Nuevo León,Monterrey,U,-100.29359149999999,25.6417185,1142952
Los zancudos y mis peluches literal me ven así todas las noches en calzones. JAJAJAJAJA https://t.co/G7eWElZ4w8,Wed Apr 08 16:56:45 +0000 2020,Tamaulipas,Victoria,R,-99.187904,23.685934,0
@BarrazaAlmazan @HermosilloGob @CelidaLopezc De favor No descuiden la fumigada contra los zancudos... Andan desatados.,Thu Apr 09 02:57:31 +0000 2020,Sonora,Hermosillo,R,-111.498181,28.9698625,5
Un pendejo zancudo me está haciendo la vida de cuadritos en las piernas y aunque y encendí la luz no pude matarlo.… https://t.co/z2CHNzESh5,Thu Apr 09 06:40:49 +0000 2020,Jalisco,Guadalajara,U,-103.335882,20.676651999999997,1385621
Se me olvidó comprar raydolitos para los zancudos y pues ahora no puedo dormirrr,Thu Apr 09 06:53:31 +0000 2020,Querétaro,Querétaro,R,-100.4405945,20.7152745,9
"Pinches zancudos, nadie les he dicho de susana distancia.",Thu Apr 09 13:04:08 +0000 2020,Chiapas,Tuxtla Gutiérrez,U,-93.13965950000001,16.7424355,578830
"No creo que esto ayude en algo. 
A menos que sea para matar zancudos.
@municipiodegpe @Cicmty https://t.co/KpEGtwf4hb",Fri Apr 10 02:24:18 +0000 2020,Nuevo León,Guadalupe,R,-100.196134,25.6766035,28
Mama me estan picando los zancudos 😭😭😭,Fri Apr 10 04:19:37 +0000 2020,Nuevo León,Apodaca,R,-100.1687175,25.778679,1879
"@LIC_MGARCIAD Bastante, aparte de ser atacado por una jauría de zancudos que no se de donde salen 😭😭😭",Fri Apr 10 05:04:59 +0000 2020,Guanajuato,Irapuato,R,-101.3403935,20.673542,23
En verdad parece que se metió un puto enjambre de zancudos a mi cuarto,Fri Apr 10 05:14:05 +0000 2020,San Luis Potosí,San Luis Potosí,R,-100.955511,22.3111195,18
Me tienes hasta la madre pinche zancudo irritante🦟,Fri Apr 10 06:09:28 +0000 2020,Jalisco,Villa Corona,R,-103.613843,20.424553,2
"¿Pará esto quieren su pinche calor culero?

🦟🦟🦟🦟🦟
Si piquites de zancudo https://t.co/8ATiKg1oZX",Sat Apr 11 02:13:57 +0000 2020,Guanajuato,León,R,-101.601401,21.09806,3
Me acaba de picar un zancudo en mi recién tatuaje jajajaja ¡PICA!,Sat Apr 11 03:22:35 +0000 2020,Querétaro,Querétaro,R,-100.4405945,20.7152745,9
"Qué pesadilla es esta: calor infernal, insomnio y zancudos feroces 🦟",Sat Apr 11 06:33:39 +0000 2020,Querétaro,Querétaro,R,-100.4405945,20.7152745,9
@Betit0Mixx Zancudos?,Sat Apr 11 07:00:40 +0000 2020,San Luis Potosí,Zaragoza,R,-100.6639345,22.041044,377
Recuerdo que dormía afuera de la casa con mis jefes y mi papá ponía un pabellón para que no nos picaran los zancudo… https://t.co/wBHqJdny5S,Sat Apr 11 07:05:04 +0000 2020,San Luis Potosí,Zaragoza,R,-100.6639345,22.041044,377
No me puedo dormir porque hay un zancudo en la habitación.... si claro... el zancudo.,Sun Apr 12 11:15:53 +0000 2020,Nuevo León,San Pedro Garza García,R,-100.366033,25.650287499999997,2
Don zancudo si me pica en silencio no hay pedo...,Mon Apr 13 08:13:37 +0000 2020,San Luis Potosí,San Luis Potosí,R,-100.955511,22.3111195,18
zancudos culiaos no me dejaron dormir,Mon Apr 13 13:48:44 +0000 2020,Ciudad de México,Cuauhtémoc,U,-99.153366,19.432836,545884
Necesito una raqueta mata zancudos ya!!,Mon Apr 13 17:48:48 +0000 2020,Jalisco,Tonalá,U,-103.2131755,20.6215735,3280
"No puedo creer que esté persiguiendo a un zancudo por toda mi habitación. 🤔. Y además, esté discutiendo con él, si es que eso es posible.",Tue Apr 14 02:38:36 +0000 2020,Ciudad de México,Iztapalapa,U,-99.050461,19.342788499999997,1835486
"Noé cabrón, te respeto y todo pero porque tuviste que subir al arca a una pareja de zancudos nmms!!! Porque????😱😱😱😱… https://t.co/oSdOmCcbwV",Tue Apr 14 05:19:00 +0000 2020,Ciudad de México,Cuauhtémoc,U,-99.153366,19.432836,545884
"Querido diario: hoy salí al jardín y me picó un zancudo, mi yo hipocondríaco me poseyó y empezó a sentir la gargant… https://t.co/Px7WKaC26O",Wed Apr 15 02:41:35 +0000 2020,Jalisco,Zapopan,R,-103.48477450000001,20.790657000000003,40
Acabo de matar un pinche zancudo y para mí sorpresa venía con dos garrapatas recién nacidas creo por qué estaban bi… https://t.co/ubqKbhxeJR,Wed Apr 15 09:22:16 +0000 2020,Oaxaca,Santiago Matatlán,U,-96.341976,16.858059,3687
@CarminaDionne Pues de qué tamaño estaba el zancudo? 🤣,Thu Apr 16 19:47:33 +0000 2020,Tamaulipas,Reynosa,R,-98.36253100000002,25.836567499999997,1
"Me estoy peleando con un mugre zancudo,
¿Por dónde diablos entró?",Fri Apr 17 05:05:17 +0000 2020,México,Nezahualcóyotl,R,-99.087817,19.4320755,0
"Estoy harta si me cobijo me muero de calor, si me descobijo me pican los zancudos. 🙄",Fri Apr 17 05:27:56 +0000 2020,México,Polotitlán,R,-99.8109605,20.203184,66
A ver pinche viuda negra que vives en mi ventana te dejo vivir ahí para que te chingas a los zancudos pero hay dos… https://t.co/CO8AKjQqpD,Fri Apr 17 07:30:32 +0000 2020,Jalisco,Tepatitlán de Morelos,R,-102.71283700000001,20.818671000000002,4
"Rayos me tengo que cuidar del
 - #Covid19 
- Del Dengue #Chikungunya y zika hay demasiados zancudos así que tengo q… https://t.co/XzMCX17KJT",Fri Apr 17 22:38:34 +0000 2020,Chiapas,San Fernando,R,-93.20642749999999,16.912427,8
Solo 2 días me duró el gusto de que no hubiera zancudos 🤬🤬🤬 Los odiiooo tanto!! 😩,Sat Apr 18 00:08:55 +0000 2020,Quintana Roo,Puerto Morelos,R,-87.0316645,21.048719,0
"@reyzapoteco1984 Ese mero, el mata zancudo",Sat Apr 18 00:29:02 +0000 2020,Oaxaca,Oaxaca de Juárez,R,-96.7250025,17.090319,685
"Un zancudo acaba de picar a popeye, jajaja a mi pq soy negro obvio #cosasdenegros https://t.co/qYCtzkN42S",Sat Apr 18 02:13:40 +0000 2020,Sonora,Hermosillo,R,-111.498181,28.9698625,5
Estoy bien agusto acostada ya para dormirme y de repente escucho un perro zancudo rondándome,Sat Apr 18 04:28:47 +0000 2020,Sinaloa,Mazatlán,R,-106.2717475,23.46814,0
5 MINUTOS! Si acaso 5 minutos estuve afuera y me picotearon los putos zancudos 🤬,Sat Apr 18 14:27:18 +0000 2020,Tamaulipas,Río Bravo,R,-98.0124835,25.726919000000002,0
Un zancudo me besó el oído!! Ahh 😫😫😩😖 me dió una ansiedad escucharlo tan cerca !,Sun Apr 19 00:37:50 +0000 2020,Jalisco,Guadalajara,U,-103.335882,20.676651999999997,1385621
"Los pinches zancudos ya me andan comiendo y tú no, Jajajaja chale",Sun Apr 19 17:31:57 +0000 2020,Guanajuato,León,R,-101.601401,21.09806,3
Que ansias que tengo muchos piquetes de zancudo en mis pies😰,Mon Apr 20 12:43:16 +0000 2020,Nuevo León,Apodaca,R,-100.27047400000001,25.736714999999997,0
Entre calor y zancudos pasé una terrible noche. Cuando por fin puedo descansar un poco mis vecinos me despiertan co… https://t.co/F3s8G52hAn,Mon Apr 20 14:17:34 +0000 2020,Jalisco,Chapala,U,-103.2254295,20.278502000000003,11439
#Cosasmolestas y que te pique un zancudo en el dedito de pie😫,Tue Apr 21 01:39:03 +0000 2020,Veracruz de Ignacio de la Llave,Tuxpan,R,-97.409066,20.936595500000003,4
"Disfruté entrenar en el patio de mi casa, aunque unos zancudos no me dejaron en paz en mis últimos ejercicios.",Tue Apr 21 04:34:14 +0000 2020,Querétaro,Querétaro,R,-100.4405945,20.7152745,9
Empieza la temporada de zancudos,Tue Apr 28 03:05:44 +0000 2020,Baja California,Ensenada,R,-116.692937,31.890982,0
Se siente bien padre matar en zancudo después de que te pica.,Tue Apr 28 03:52:50 +0000 2020,Guanajuato,León,R,-101.601401,21.09806,3
cuando anda un pinche🦟 #zancudo en mi cuarto prefiero fumar y atarantarlo con el #Humo así será más fácil matarlo y… https://t.co/7N0NEMbHB9,Tue Apr 28 05:45:40 +0000 2020,Guanajuato,Guanajuato,R,-101.250134,21.0254965,0
Pinche zancudo HDTPM 😡,Tue Apr 28 06:20:09 +0000 2020,Oaxaca,Putla Villa de Guerrero,R,-97.919089,16.979077500000002,32
Dónde está mi tía Mirna y su raqueta matándome los zancudos 😩?,Tue Apr 28 13:41:35 +0000 2020,Colima,Tecomán,R,-103.797207,18.9041045,3
"Acabo de hacer un acto altruista nivel DIOS... había un zancudo en mi cuarto, LOS ODIO, y en vez de matarlo.. lo in… https://t.co/fYoa2hgMyI",Tue Apr 28 22:55:50 +0000 2020,Nuevo León,San Pedro Garza García,R,-100.366033,25.650287499999997,2
"La vida se burla de mi cada que intento matar a un zancudo.🦟Golpeó paredes, mesas, las palmas de mis manos, mis bra… https://t.co/SxPPcitUV2",Wed Apr 29 01:26:54 +0000 2020,Querétaro,Querétaro,R,-100.4405945,20.7152745,9
Ya se que estoy bien rica pero pinches zancudos no me coman,Wed Apr 29 05:53:42 +0000 2020,Nuevo León,Monterrey,U,-100.29359149999999,25.6417185,1142952
"A ok, si me gusta el calor pero sin zancudos 🙄 ya no chingues jaja",Thu Apr 30 05:29:59 +0000 2020,Sonora,Mazatán,R,-110.174993,28.9315265,0
Los zancudos me están atacando ayudaaaaaaaa,Fri May 01 05:14:52 +0000 2020,Guanajuato,León,R,-101.601401,21.09806,3
13 malditas picadas de zancudo en menos de media hora 😡😡😡😡😡,Fri May 01 11:14:16 +0000 2020,Sonora,Hermosillo,R,-111.498181,28.9698625,5
Fan de hacerme una cruz cada que me pican los zancudos,Fri May 01 21:35:42 +0000 2020,Nuevo León,Apodaca,R,-100.27047400000001,25.736714999999997,0
¿Quien invento los zancudos? 😭😭😭... Los odio https://t.co/xBKiL66klX,Sat May 02 04:14:16 +0000 2020,Guanajuato,Irapuato,R,-101.3403935,20.673542,23
"Como voy andar fumando mamá, es incienso para los zancudos. 🙂",Sat May 02 06:11:32 +0000 2020,Oaxaca,Oaxaca de Juárez,R,-96.7250025,17.090319,685
Casi 2 am y yo estoy perdiendo una batalla contra un zancudo que está dentro de mi cuarto,Sat May 02 06:56:07 +0000 2020,Nuevo León,General Escobedo,R,-100.3652735,25.807314499999997,1682
"No puedo dormir si no es por el calor es por el ruido de un zancudo o el árbol que golpea mi ventana, sin mencionar… https://t.co/2hikWu1AQ7",Sat May 02 08:07:42 +0000 2020,Jalisco,Zapopan,R,-103.48477450000001,20.790657000000003,40
A mi no me picaban los zancudos y ahora ando toda devorada 🥺,Sat May 02 19:02:46 +0000 2020,Sonora,Banámichi,R,-110.277029,30.064819,0
Hace como 9 meses que no sabía de zancudos y ahora ptm me traen chando,Sun May 03 02:28:51 +0000 2020,Guerrero,Copala,R,-98.9475865,16.6252435,970
Mate cómo 7 moscas y 4 zancudos que se refugiaron en mi cuarto. Me acosté y ya escuché un puto zancudo zumbar https://t.co/g18VsMNFUA,Sun May 03 07:41:13 +0000 2020,Sonora,Hermosillo,R,-111.498181,28.9698625,5
Me caga el calor y sus pinches zancudos de mierda,Mon May 04 03:48:11 +0000 2020,Nuevo León,Apodaca,R,-100.27047400000001,25.736714999999997,0
Fuckin zancudos,Mon May 04 06:30:39 +0000 2020,Guanajuato,Apaseo el Grande,R,-100.6205445,20.5934045,104
"Acostarte en la hamaca y que te ataquen un montón de zancudos, los odio con todo mi ser.",Tue May 05 01:17:07 +0000 2020,Oaxaca,San Juan Chicomezúchil,R,-96.506171,17.317178,6
Wey me acaba de picar un pinche zancudo en el dedo gordo del pie. 😭,Wed May 06 01:52:03 +0000 2020,San Luis Potosí,San Luis Potosí,R,-100.955511,22.3111195,18
Sabias que los zancudos te pican en las piernas para sacarte el líquido y venderlo en el IMSS?,Wed May 06 04:46:30 +0000 2020,Oaxaca,San Francisco del Mar,R,-94.357655,16.2177105,0
"Bien que lluvio incluso con granizo, lo malo es que se fue la luz y ya me anda con los zancudos y el calor 🥵",Wed May 06 08:19:54 +0000 2020,San Luis Potosí,Ciudad Fernández,R,-100.0744965,21.9820385,315
"Creo, creeeeeeo, que me tragué un zancudo y me picó en la garganta. 👀",Wed May 06 22:17:32 +0000 2020,Nuevo León,Guadalupe,R,-100.196134,25.6766035,28
"Un zancudo me acaba de picar la rodilla derecha, es uno de tus enviados vdd @lalomaciasg ?",Thu May 07 01:45:26 +0000 2020,Nuevo León,Monterrey,U,-100.29359149999999,25.6417185,1142952
Pinches zancudos hijos de su puta madre como me cagan alv,Thu May 07 07:48:54 +0000 2020,Nuevo León,Apodaca,R,-100.27047400000001,25.736714999999997,0
Ya estamos hartos de los zancudos así que los borregueamos pa andar todos iguales.,Fri May 08 04:16:54 +0000 2020,Quintana Roo,Felipe Carrillo Puerto,R,-88.0134815,19.749553,11
Despues de la tormenta siempre llegan los zancudos,Sat May 09 00:34:40 +0000 2020,Nuevo León,Monterrey,U,-100.29359149999999,25.6417185,1142952
Ustedes @freddycoronadov  saben la madriza que me pegó en mi oficina hasta los zancudos no me dejan.,Sat May 09 03:40:20 +0000 2020,Nuevo León,Cadereyta Jiménez,R,-99.9312465,25.519292,0
"Por si no tenían con la pandemia, zancudos con dengue, avispones gigantes, lluvias fuertes , volcanes, ahora esto.",Sat May 09 03:43:11 +0000 2020,Nuevo León,Apodaca,R,-100.1687175,25.778679,1879
Me caga cuando estoy cagando y aparece un zancudo en el baño 🤬,Sat May 09 23:49:29 +0000 2020,Nuevo León,Apodaca,R,-100.27047400000001,25.736714999999997,0
"@sra_costanza Yo empecé a usar chanclas con calcetines para que no me piquen los zancudos.  Antes, hubiera ido a co… https://t.co/tPRyNomPuF",Mon May 11 04:17:35 +0000 2020,Jalisco,Tonalá,U,-103.2131755,20.6215735,3280
Creo que lo que más odio en la vida son los putos zancudos,Tue May 12 23:22:35 +0000 2020,Nuevo León,Guadalupe,R,-100.196134,25.6766035,28
Estoy acostada boca abajo y los zancudos me picaron en las pompis. A ver si así se hinchan piquillo o algo,Wed May 13 01:22:56 +0000 2020,Nuevo León,Apodaca,R,-100.27047400000001,25.736714999999997,0
Porque tantos zancudos??? Hate them,Wed May 13 02:56:57 +0000 2020,Jalisco,Tlajomulco de Zúñiga,R,-103.407581,20.489708999999998,15
Pinches zancudos loco,Thu May 14 05:24:19 +0000 2020,Sonora,Hermosillo,R,-111.498181,28.9698625,5
"Como entro ese zancudo a mi cuarto, hdtpm ya déjame dormir wey",Fri May 15 06:12:29 +0000 2020,Hidalgo,Tolcayuca,R,-98.9274185,19.960557,9
No hay nada que me encabrone más que despertarme por culpa de un puto zancudo,Fri May 15 07:32:43 +0000 2020,San Luis Potosí,San Luis Potosí,R,-100.955511,22.3111195,18
"@nosoychavs Es para que lo saludes con los zancudos, da",Fri May 15 13:43:59 +0000 2020,Jalisco,Guadalajara,U,-103.335882,20.676651999999997,1385621
Pinches zancudos les vale v el raidolito 🤬,Sat May 16 06:08:16 +0000 2020,Nuevo León,Guadalupe,R,-100.196134,25.6766035,28
"Abejas asesinas:

Ni vengan a México Aquí tenemos a la abeja miope🐝,
el zancudo loco
 y a la mariposa traicionera y nos defenderán.

.😂",Sat May 16 20:08:39 +0000 2020,Sonora,Empalme,R,-110.72232699999999,27.8836995,1
@janyhot2303 Jejeje matando zancudos...,Sun May 17 09:06:38 +0000 2020,Jalisco,Zapopan,R,-103.48477450000001,20.790657000000003,40
@lemur____ —los zancudos: https://t.co/4KfuOknihj,Sun May 17 12:55:43 +0000 2020,Quintana Roo,Puerto Morelos,R,-87.0316645,21.048719,0
Malditos sean los zancudos 🦟,Sun May 17 21:28:43 +0000 2020,Guanajuato,Apaseo el Alto,R,-100.583428,20.431131999999998,480
Cacería de zancudos,Mon May 18 05:17:07 +0000 2020,Oaxaca,Oaxaca de Juárez,R,-96.7250025,17.090319,685
Pinches zancudos. ¡Ya no los aguanto!,Mon May 18 16:51:10 +0000 2020,Michoacán de Ocampo,Morelia,R,-101.27577,19.652724,84
Wey pinches zancudos 🦟 tamaño dinosaurios me tienen hasta la madre,Tue May 19 00:11:02 +0000 2020,Nuevo León,Linares,U,-99.538038,24.8558175,70378
Pinches zancudos,Tue May 19 02:41:48 +0000 2020,Nuevo León,Monterrey,U,-100.29359149999999,25.6417185,1142952
Qué pedo con mi alergia si apago el ventilador me chingan los zancudos 🤧,Tue May 19 07:10:12 +0000 2020,México,Amatepec,R,-100.285247,18.7044425,26
Cosas que me harían muy feliz en estos momentos: una raqueta para matar zancudos.,Tue May 19 19:46:28 +0000 2020,Quintana Roo,Felipe Carrillo Puerto,R,-88.0134815,19.749553,11
@NlSalud están fumigando para el zancudo ?  Estamos infestados..se que ahí prioridad en el Edo .. pero ya es insopo… https://t.co/pQsoIM31NX,Wed May 20 02:50:54 +0000 2020,Nuevo León,Guadalupe,R,-100.269928,25.638021,0
@Juandedios_P @Juandedios_P  hay unas lamparitas super buenísimas que solo la conectas a la luz y bye zancudos y lo… https://t.co/byOSvGA03n,Wed May 20 05:39:08 +0000 2020,Michoacán de Ocampo,Los Reyes,R,-102.425111,19.6633765,2631
"No es justo que me despertó un estupido zancudo, picándome la mano.

No respetan ni el aire acondicionado.",Wed May 20 10:47:26 +0000 2020,San Luis Potosí,San Luis Potosí,R,-100.955511,22.3111195,18
Odio las moscas y los zancudos🙄,Wed May 20 16:27:39 +0000 2020,Sonora,Mazatán,R,-110.174993,28.9315265,0
@JulioViggiano Que sabes tu de zancudos y moscos si no vives en Mérida y acaba de llover..😬,Thu May 21 05:19:34 +0000 2020,Yucatán,Mérida,R,-89.62361100000001,20.941035,0
"Puse un raidolito en la ventana nomás por acabarlos porqué ya ni zancudos hay afortunadamente!!! Y que se me cae, s… https://t.co/7uY8L1ZwpI",Fri May 22 01:26:04 +0000 2020,Chiapas,Escuintla,R,-92.58834399999999,15.355297,0
"Oigan ya me pico un zancudo, no he dormido desde ayer a las 11 y el trabajo aún no está, que más puede salir mal 🤧",Fri May 22 01:57:57 +0000 2020,Hidalgo,Tolcayuca,R,-98.9274185,19.960557,9
"¿Neta?
Ya que me decidí a dormir se va la luz, ayyyy 😭 seré comida de zancudos. 
Lo único bueno es que comenzó a llover. 🙏",Fri May 22 06:32:23 +0000 2020,Veracruz de Ignacio de la Llave,Álamo Temapache,R,-97.714151,20.9937245,11
"No me he podido dormir y no es por las preocupaciones o el Coronavirus, es por: 1.- Los zancudos 2.- Tomar café des… https://t.co/va87B5ftSI",Fri May 22 10:48:02 +0000 2020,Ciudad de México,Benito Juárez,U,-99.1614805,19.380613,434153
