Tweet,Fecha,Estado,Locacion,Tipo,Longitud,Latitud,Poblacion
No hay🦟 zancudos que ya es ganancia 🙌🏻🙌🏻,Sun Dec 27 06:54:42 +0000 2020,Guanajuato,Pénjamo,R,-101.845557,20.405994,163
@LaurAlcibar Y sus zancudos 🤪,Tue Dec 29 01:30:20 +0000 2020,Sonora,General Plutarco Elías Calles,R,-112.91591799999999,31.704972999999995,2
"Vas de flor en flor cuál abeja, lastima que solo eres un zancudo.",Fri Jan 01 08:26:10 +0000 2021,Nuevo León,Guadalupe,R,-100.196134,25.6766035,28
"Vas de flor en flor como abeja, lástima que solo eres un zancudo.",Fri Jan 01 08:26:47 +0000 2021,Nuevo León,Guadalupe,R,-100.196134,25.6766035,28
"Cuando hace frío no hay moscas, zancudos, no sudas ni vas de malas en la oruga, te abrigas con tus chamarras pedera… https://t.co/TKXhEkwL6f",Sun Jan 03 14:35:36 +0000 2021,Guanajuato,León,R,-101.601401,21.09806,3
@xeneoscar ¿Tu zancudo se llama Pilar?,Mon Jan 04 18:09:15 +0000 2021,Guanajuato,León,R,-101.601401,21.09806,3
Zancudo en Pueblo Mágico Ixtapan De La Sal https://t.co/74rq3yf3YQ,Fri Jan 08 07:43:29 +0000 2021,México,Ixtapan de la Sal,R,-99.684034,18.8410875,1745
"Si el mejor argumento de los locos para que les guste el frío es que no hay mosquitos, como vergas es que acabo de matar un zancudo?",Fri Jan 08 13:26:03 +0000 2021,Ciudad de México,Cuauhtémoc,U,-99.153366,19.432836,545884
Me estoy hartando del frío pero luego pienso en que con el calor vienen los zancudos y 😩😩😩,Sun Jan 10 06:32:00 +0000 2021,Ciudad de México,Cuauhtémoc,U,-99.153366,19.432836,545884
Por dónde chingados se meten los zancudos?!,Tue Jan 12 06:08:45 +0000 2021,Jalisco,Tlajomulco de Zúñiga,R,-103.407581,20.489708999999998,15
"Ni modo dijo un zancudo cuando volar no pudo, una pata se le atoró y la otra se le hizo nudo",Sun Jan 17 05:03:11 +0000 2021,Tamaulipas,Reynosa,R,-98.36253100000002,25.836567499999997,1
Ya no se si estoy “trabajando” o me estoy dedicando a matar zancudos 🦟,Sun Jan 17 20:52:06 +0000 2021,Morelos,Cuernavaca,R,-99.260819,18.933812,78
"Kha v3rgaz, me picó un zancudo en la planta del pie 🥴",Sun Jan 24 20:35:34 +0000 2021,Guanajuato,León,R,-101.601401,21.09806,3
"Que maravilla es ser NN para los zancudos, mosquitos etc 😍😍",Tue Jan 26 03:44:32 +0000 2021,Quintana Roo,Felipe Carrillo Puerto,R,-88.0134815,19.749553,11
"@TeamPlebes2A Me pican los zancudos brooo

ALE Y ANA X CALLE Y POCHE",Wed Jan 27 04:09:45 +0000 2021,Zacatecas,Villa de Cos,R,-102.5580375,23.6254185,0
"Bro, mejor vete o te va a cargar la verga🙃
(Emma, 2021) al zancudo que esta en su pt cuarto y no la deja dormir 🙃",Thu Jan 28 06:13:11 +0000 2021,Querétaro,Querétaro,R,-100.4405945,20.7152745,9
Mis piernas están llenas de piquetes de zancudo y no las aguantooooo😭,Sun Jan 31 05:31:39 +0000 2021,Nuevo León,Monterrey,U,-100.29359149999999,25.6417185,1142952
No puede ser que los zancudos me picaron hasta en las pompis😭😭😭😭😭😭,Sun Jan 31 17:46:23 +0000 2021,Nuevo León,Monterrey,U,-100.29359149999999,25.6417185,1142952
Estos zancudos insolentes ahora me pican hasta la cara. Ya no hay respeto!,Sun Jan 31 22:55:40 +0000 2021,Ciudad de México,Coyoacán,U,-99.15234000000001,19.328383000000002,614447
Hasta mi gata tiene pretendiente y a mi ni el zancudo se me pega,Tue Feb 02 20:52:28 +0000 2021,Sonora,Hermosillo,R,-111.498181,28.9698625,5
Un zancudo no me deja dormir... ese es todo el tuit. https://t.co/4b52HvL1DI,Thu Feb 04 05:21:18 +0000 2021,Nuevo León,Monterrey,U,-100.29359149999999,25.6417185,1142952
@SWEET_L0V3_ Suertudo zancudo,Mon Feb 08 04:20:57 +0000 2021,México,Tlalnepantla de Baz,U,-99.1158905,19.518656,13030
"Jajajaja un abrazo mi Gonza. Acuérdate que los trolls son como los zancudos: chingan un ratito y después se van. 
L… https://t.co/3P8YYj8Emm",Wed Feb 10 19:34:49 +0000 2021,Coahuila de Zaragoza,Viesca,R,-103.23313,25.244222999999998,36
"Me pico un zancudo 🦟
😡 https://t.co/lqtfMdht1g",Fri Feb 12 13:29:56 +0000 2021,Querétaro,El Marqués,R,-100.2783405,20.7456405,14
"Puro zancudo, estoy como Mr White en el capítulo de la mosca",Sat Feb 20 07:58:21 +0000 2021,Guerrero,Acapulco de Juárez,R,-99.73564950000001,16.9589495,5
"Estoy con fiebre (no sé de qué) 🤒 y en eso de estar arropando y desarropando el cuerpo, un señor zancudo se da gust… https://t.co/z93SCtT8lT",Mon Feb 22 07:16:38 +0000 2021,Ciudad de México,Cuauhtémoc,U,-99.153366,19.432836,545884
"Mm tons ya se acabó la etapa del cafesito con pan y empezó la de zancudos, cucarachas, pazuco?  :(",Wed Feb 24 01:49:45 +0000 2021,Nuevo León,Guadalupe,R,-100.196134,25.6766035,28
no puedo dormir hasta matar cada zancudo de mi habitacion,Wed Feb 24 06:56:28 +0000 2021,Oaxaca,Putla Villa de Guerrero,R,-97.919089,16.979077500000002,32
"¿En que momento pensé que abrir la ventana de mi cuarto era buena idea? 
Soy la comidilla de los zancudos",Fri Feb 26 06:04:09 +0000 2021,Chiapas,Tuxtla Gutiérrez,U,-93.13965950000001,16.7424355,578830
"@BereniceDiazG Insecticida para prevenir dengue y zika, en estas fechas empieza la reproducción de zancudos 🦟",Sun Feb 28 11:09:17 +0000 2021,Baja California,Playas de Rosarito,R,-116.929102,32.3328765,5
"Ya empezó el calor, las cucas y los zancudos. No puede jeeeeer!",Wed Mar 03 03:30:24 +0000 2021,Jalisco,Guadalajara,U,-103.335882,20.676651999999997,1385621
"Buen día...
Que tengan un gran miércoles...

Ahí filosofando: ¿Cuandos zancudos me picaban hoy?
🥴😕😆😝🤣
En dos días d… https://t.co/ovuqnUs8sP",Wed Mar 03 15:55:59 +0000 2021,Jalisco,Guadalajara,U,-103.335882,20.676651999999997,1385621
con tanto puto zancudo y mosquito ugh,Thu Mar 04 00:29:05 +0000 2021,Jalisco,Zapopan,R,-103.48477450000001,20.790657000000003,40
@LaurAlcibar Y zancudos miados 😡,Sat Mar 06 03:56:50 +0000 2021,Sonora,General Plutarco Elías Calles,R,-112.91591799999999,31.704972999999995,2
"@patriciaagv15 @Guarromantico_ 🤣🤣🤣 si soy mi amor, perdón 😥 pero lo hago para protegerte del coco y los zancudos 🤣",Sun Mar 07 05:19:52 +0000 2021,Baja California,Playas de Rosarito,R,-116.929102,32.3328765,5
the zancudos are on X games mode🥴,Tue Mar 09 03:56:15 +0000 2021,Jalisco,San Julián,R,-102.168611,20.9941685,0
"@SITEURJAL @GuadalajaraGob @Trafico_ZMG Primera vez que lo veo, pero hoy habia una infestacion de zancudos es uno d… https://t.co/oPGLdNW0EA",Tue Mar 09 13:33:22 +0000 2021,Jalisco,Guadalajara,U,-103.335882,20.676651999999997,1385621
😫😫😫 necesito algo para ponerme y que los zancudos dejen de picarme! Los odiooooo 😫😫😖,Tue Mar 09 23:55:50 +0000 2021,Chiapas,Chilón,R,-92.0478535,17.106698,105
"Por qué les gusta el calor? Con el calor hay moscas, zancudos, cucarachas, duendes ylv!!!",Thu Mar 11 00:57:59 +0000 2021,Nuevo León,Monterrey,U,-100.29359149999999,25.6417185,1142952
"La Cami: mami los zancudos piensan que soy comida, nomas me quieren estar comiendo 🤣🤣🤣🤣",Fri Mar 19 20:51:37 +0000 2021,Sinaloa,Mazatlán,R,-106.2717475,23.46814,0
Por una primavera y verano sin zancudos Amén 🙏🏻,Mon Mar 22 22:52:18 +0000 2021,Nuevo León,Apodaca,R,-100.1687175,25.778679,1879
Uno ya no puede ni cagar en paz por que ahí están los pinches zancudos chingando 😩😤,Tue Mar 23 07:35:31 +0000 2021,Oaxaca,Oaxaca de Juárez,R,-96.7250025,17.090319,685
"@Hidrocentro2011 favor ayuda, foco de infección, zancudos, deterioro del pavimento, compromete la estabilidad del p… https://t.co/0Gg3PAdwpF",Wed Mar 24 02:08:56 +0000 2021,Jalisco,Zapopan,R,-103.48477450000001,20.790657000000003,40
Y que carajo estaba pensando cuando hizo a los desgraciados zancudos? 😭,Wed Mar 24 04:46:55 +0000 2021,Oaxaca,Oaxaca de Juárez,R,-96.7250025,17.090319,685
"Guadalajara, Jal.
                   24 de marzo de 2021

Estimado zancudo de la oficina:
P R E S E N T E

Por este… https://t.co/89x17rq589",Wed Mar 24 16:29:44 +0000 2021,Jalisco,Guadalajara,U,-103.335882,20.676651999999997,1385621
"|                               Guadalajara, Jal.
                        24 de marzo de 2021

Estimado zancudo de… https://t.co/PIp5oGbQl4",Wed Mar 24 16:31:26 +0000 2021,Jalisco,Guadalajara,U,-103.335882,20.676651999999997,1385621
"da mal criada y su casa de Depa amueblado con pulgas, chinches, piojos, moscos, moscas, moscones, zancudos, garrapa… https://t.co/kTOhHuru66",Wed Mar 24 20:47:37 +0000 2021,Jalisco,Guadalajara,U,-103.328998,20.68322,1385621
Tengo tanto tiempo sin hacer el delicioso que me pico un zancudo en el cuello y me excite 😳😂😂,Thu Mar 25 01:46:41 +0000 2021,Veracruz de Ignacio de la Llave,Alvarado,R,-95.8132295,18.8352255,0
Pinches zancudos 🦟,Thu Mar 25 04:49:52 +0000 2021,Coahuila de Zaragoza,Monclova,R,-101.220857,26.878203499999998,0
"@ColaYSola Bueno, al menos no tendrás bichitos molestándote en la noche, especialmente zancudos, puta que son molestos jjjj",Mon Mar 29 22:40:59 +0000 2021,Ciudad de México,Benito Juárez,U,-99.1614805,19.380613,434153
Un zancudo me picó las patitas 🥺,Wed Mar 31 02:15:15 +0000 2021,Ciudad de México,Benito Juárez,U,-99.1614805,19.380613,434153
Si algo odio son los malditos zancudos 😫,Wed Mar 31 02:16:16 +0000 2021,Guanajuato,Uriangato,R,-101.14856850000001,20.1195135,143
"Necesito un remedio para los zancudos. Pero uno que digan: ""con este se van a extinguir"". También propongo una inca… https://t.co/HZV2wFFfy1",Fri Apr 02 13:28:09 +0000 2021,Jalisco,Guadalajara,U,-103.335882,20.676651999999997,1385621
Como shingó un zancudo anoche 🙄@DeniseDresserG,Fri Apr 02 19:55:04 +0000 2021,Coahuila de Zaragoza,Saltillo,R,-101.166961,25.0326315,97
Odio los zancudos 🦟,Sun Apr 04 01:38:43 +0000 2021,Guanajuato,San Luis de la Paz,R,-100.4568895,21.655194,2
"Y bueno, dije que hoy iba a dormir tranquilamente pero zancudo piensa lo contrario ... chin 🤦🏽‍♀️ https://t.co/abnxt9lt1v",Mon Apr 05 03:27:31 +0000 2021,Nuevo León,Monterrey,U,-100.29359149999999,25.6417185,1142952
Dije que hoy iba a dormir tranquilamente pero un zancudo opina lo contrario.... chin 🤦🏽‍♀️ https://t.co/LQsfME2F4N,Mon Apr 05 03:28:57 +0000 2021,Nuevo León,Monterrey,U,-100.29359149999999,25.6417185,1142952
Me despertó un zancudo a las 3 am 🥴🥴🥴,Mon Apr 05 16:15:54 +0000 2021,Ciudad de México,Miguel Hidalgo,U,-99.2115105,19.4299345,414470
"Me traen más ganas los pinches zancudos que tú, hijo de tu puta madre...!",Wed Apr 07 04:20:45 +0000 2021,Chiapas,Tuxtla Gutiérrez,U,-93.13965950000001,16.7424355,578830
@munecadecera_ O ya sabe compi sobres de ese zancudo 😡😎👊 https://t.co/WCMxmHXhf5,Wed Apr 07 04:54:48 +0000 2021,Guanajuato,León,R,-101.601401,21.09806,3
Me explican cómo tengo 6 piquetes de zancudo si mi puerta y mi venta están cerradas?!,Thu Apr 08 03:43:21 +0000 2021,San Luis Potosí,San Luis Potosí,R,-100.955511,22.3111195,18
"Yo NUNCA quito las telarañas de mi cuarto
Eso ayuda a que vivan arañas, y se coman a los zancudos.
Es un pacto que tenemos entre ellas y yo.",Thu Apr 08 07:11:46 +0000 2021,Jalisco,Zapopan,R,-103.48477450000001,20.790657000000003,40
"Gilda 0 - Zancudos 1000 
#Huejutla",Sat Apr 10 06:00:42 +0000 2021,Hidalgo,Huejutla de Reyes,R,-98.448182,21.145068000000002,0
Que CHASM el zancudo que nos está tragando 😾,Tue Apr 13 22:01:03 +0000 2021,Jalisco,Zapopan,R,-103.48477450000001,20.790657000000003,40
"Ya me conté más de 20 piquetes de zancudo en el cuerpo, ya déjenme malditos 😡",Wed Apr 14 20:36:03 +0000 2021,Nuevo León,General Escobedo,R,-100.3652735,25.807314499999997,1682
"En serio no entiendo cómo hay gente que le gusta el calor, o sea es la temporada donde hay muchísimos zancudos y cu… https://t.co/KGIhISWNsx",Thu Apr 15 13:25:59 +0000 2021,San Luis Potosí,San Luis Potosí,R,-100.955511,22.3111195,18
Amable recordatorio a los laguneros: ya estamos en temporada de moscos y zancudos. Salí a hacer ejercicio y me picaron varios. 😂,Fri Apr 16 01:36:20 +0000 2021,Coahuila de Zaragoza,Viesca,R,-103.23313,25.244222999999998,36
Me tienen frito los putos zancudos,Fri Apr 16 01:48:24 +0000 2021,Sinaloa,Mazatlán,R,-106.2717475,23.46814,0
¿Ya hay zancudos?,Tue Apr 20 17:09:20 +0000 2021,Puebla,Amozoc,R,-98.1542665,19.0322295,616
"@chinito_chen13 @baby_manguito Y unas sábanas en la noche, no les vaya a picar un zancudo y hasta ahí.",Sat Apr 24 17:33:52 +0000 2021,Sonora,Hermosillo,R,-111.498181,28.9698625,5
"@angetuliann Digo eso y me la mientan, donde vivo los zancudos  deboran gente viva",Tue Apr 27 01:40:46 +0000 2021,Tamaulipas,Altamira,R,-98.082815,22.560886000000004,0
Odio los zancudos!!!!! 🦟,Tue Apr 27 04:14:59 +0000 2021,Morelos,Cuernavaca,R,-99.260819,18.933812,78
Nunca había sufrido tanto unos piquetes de zancudos.,Tue Apr 27 06:10:53 +0000 2021,Nuevo León,Salinas Victoria,R,-100.244559,26.1232495,3
Tengo piquetes de zancudo por todas partes de mi cuerpo 🤦🏼‍♂️🦟,Wed Apr 28 17:02:39 +0000 2021,Jalisco,Mascota,R,-105.14858050000001,20.697052499999998,0
"2:11 am, cacería de putos zancudos, llevo 4, el quinto se hizo el muerto y al llegar a matarlo huyó, seguimos vigilando",Thu Apr 29 07:11:28 +0000 2021,Querétaro,Querétaro,R,-100.4405945,20.7152745,9
"¡Santos Brebajes ! 
Avenida universidad  #1009 
Nieto #418 

By :zancudo @carlos_lpzmtz en Brebajes https://t.co/ntrRkMjukV",Sun May 02 23:33:39 +0000 2021,Aguascalientes,Aguascalientes,R,-102.327207,21.849459000000003,0
"Soñé que me depilaba las piernas, obviamente lo que sentía eran las picaduras de los zancudos.",Mon May 03 15:04:37 +0000 2021,Quintana Roo,Othón P. Blanco,R,-88.3857435,18.5934905,0
Si no es una pinche mosca es un puto zancudo!!! Los odio 🤯🥺🥺🥺,Mon May 03 18:03:33 +0000 2021,Puebla,Izúcar de Matamoros,R,-98.4261095,18.5035495,1425
@PedroiCarla Wowwww... Que bella postal. Y como me hubiese gustado ser el zancudo.,Tue May 04 06:08:44 +0000 2021,Jalisco,Guadalajara,U,-103.335882,20.676651999999997,1385621
"@luiscavazosr Para eliminar a los zancudos tienes que ser el zancudo, pensar como zancudo.",Tue May 04 06:14:57 +0000 2021,México,Ayapango,R,-98.7271865,19.1256435,20
Me comieron los zancudos 🦟 😩😫,Wed May 05 23:50:31 +0000 2021,Tamaulipas,Victoria,R,-99.187904,23.685934,0
😣Inicia temporada de cacería de zancudos. 🦟,Thu May 06 12:45:54 +0000 2021,Guanajuato,León,R,-101.601401,21.09806,3
Me estoy tomando una cervecita tan agusto aquí afuera y llegan los zancudos a chingar. Me pican exactamente dónde n… https://t.co/B8Csn86tuh,Sat May 08 02:28:16 +0000 2021,Sonora,Empalme,R,-110.72232699999999,27.8836995,1
"@luciatorrero Jajaja es que ésto ya es acoso en serio lo de los zancudos contra mi, a nadie de la casa le pican más que a mí.",Sat May 08 02:32:09 +0000 2021,Sonora,Empalme,R,-110.72232699999999,27.8836995,1
Que triste que me anden comiendo los zancudos y no tú 😥,Sat May 08 05:38:04 +0000 2021,Guanajuato,Guanajuato,R,-101.250134,21.0254965,0
Para ellos somos como molestos zancudos; esos montos representan lo que valen las vidas de sus votantes para ellos.,Sat May 08 17:26:14 +0000 2021,Ciudad de México,Tlalpan,R,-99.208364,19.199485,86
ando peleándome con un zancudo,Sun May 09 03:21:58 +0000 2021,Nuevo León,Apodaca,R,-100.1687175,25.778679,1879
"Zancudo, personaje cultural.",Sun May 09 04:55:05 +0000 2021,Oaxaca,Cuilápam de Guerrero,R,-96.80849900000001,17.004507,32
Aplicando las posturas para matar zancudos en la noche es mi pasión,Sun May 09 06:23:59 +0000 2021,Veracruz de Ignacio de la Llave,Xalapa,R,-96.886083,19.542054,0
Nuev@ inquilin@ en mi Jardín... espero las arañas y los zancudos sean de su agrado 🤢 https://t.co/f58hbFQsH5,Mon May 10 04:39:42 +0000 2021,Jalisco,Tlajomulco de Zúñiga,R,-103.407581,20.489708999999998,15
"Van 48 piquetes  en seis horas, y tan  solo tres zancudos muertos.
Y no veo esquina, siento hasta fiebre, me rindo.… https://t.co/2chRSRfIOu",Thu May 13 06:48:58 +0000 2021,Jalisco,Zapopan,R,-103.48477450000001,20.790657000000003,40
Hay zancudos que te pican toditx 🙃,Thu May 13 22:36:19 +0000 2021,Tlaxcala,Huamantla,R,-97.922756,19.3343475,1227
"Decisiones de mi vida, muero de calor dentro del pabellón o dejo que me coman los zancudos 🦟....",Sat May 15 03:59:46 +0000 2021,Oaxaca,Santa María Tonameca,R,-96.67803550000001,15.784410999999999,93
Na mms hoy no voy a dormí o qué? Pinches putos perros zancudos 🦟😡,Sat May 15 07:40:32 +0000 2021,Jalisco,Tonalá,U,-103.25907799999999,20.658987,64886
"Yo en casa de mi abuelita:
Dónde chingados está el raid casa jardín que ya me están tragando los zancudos. 
Mi abue… https://t.co/L5tTDjoW3V",Sun May 16 22:16:12 +0000 2021,Guanajuato,León,R,-101.601401,21.09806,3
Pinches zancudos están comiendo rico 🤬,Mon May 17 03:00:48 +0000 2021,Chiapas,Ocosingo,R,-91.50345250000001,16.6592965,390
"Putos zancudos 
Les puse un raidolito 
Y casi casi hasta se paran en el jajaja",Mon May 17 14:23:00 +0000 2021,Tamaulipas,Victoria,R,-99.187904,23.685934,0
Esta noche soy cena de zancudos !! 😥😥,Tue May 18 06:50:38 +0000 2021,Querétaro,Querétaro,R,-100.4405945,20.7152745,9
"@letichelius Pero zancudos en la CDMX antes no había tantos o no me habían tocado, aunque es la primera vez que viv… https://t.co/vIUHCuiPIb",Tue May 18 15:22:49 +0000 2021,Ciudad de México,Benito Juárez,U,-99.1614805,19.380613,434153
Ya empezaron los zancudos a joder,Wed May 19 00:08:48 +0000 2021,Chihuahua,Chihuahua,R,-106.1628985,28.941865999999997,0
@IsraelTrejoM Y los zancudos...😩,Wed May 19 22:42:55 +0000 2021,San Luis Potosí,San Luis Potosí,R,-100.955511,22.3111195,18
Perros Zancudos 🤬,Thu May 20 06:17:32 +0000 2021,Aguascalientes,Aguascalientes,R,-102.327207,21.849459000000003,0
Temporada de zancudos = dengue seguro 😒,Fri May 21 12:08:07 +0000 2021,San Luis Potosí,Ciudad Fernández,R,-100.0744965,21.9820385,315
Me picó un zancudo (moyote) en el dedo índice 😡,Sun May 23 06:26:39 +0000 2021,Oaxaca,Oaxaca de Juárez,R,-96.7250025,17.090319,685
"Aveces es más cansón el pobre de  JP matando en la madrugada a un zancudo, que el mismo zancudo que se metió a la h… https://t.co/8uxxAddvFY",Sun May 23 10:22:22 +0000 2021,Ciudad de México,Miguel Hidalgo,U,-99.2115105,19.4299345,414470
Chinga tu madre zancudo que me pico en el talón,Mon May 24 01:30:45 +0000 2021,Querétaro,Querétaro,R,-100.4405945,20.7152745,9
"Me pico un zancudo en el cuello 🥺🥺😭😭😭😭😭
Si no ne muero de Covid, va a ser por Zika, dengue o chikungunya
🦟🦟🦟🦟",Wed May 26 09:35:31 +0000 2021,Nuevo León,Salinas Victoria,R,-100.244559,26.1232495,3
"Al parecer solo le gusto a los zancudos, porque son los únicos que me quieren picar. 🙃",Thu May 27 01:01:50 +0000 2021,Veracruz de Ignacio de la Llave,Castillo de Teayo,R,-97.6677,20.7316075,4
Fucking zancudos man,Thu May 27 06:00:29 +0000 2021,Jalisco,San Pedro Tlaquepaque,R,-103.34832399999999,20.592133,0
"@soy_LinMarianne Son unos pillos esos zancudos, no se dejan ver 😅 https://t.co/y8JF4Q1PDC",Fri May 28 03:16:22 +0000 2021,Veracruz de Ignacio de la Llave,Poza Rica de Hidalgo,R,-97.44749449999999,20.536509000000002,3
Putos zancudos me despertaron todo picado. https://t.co/TROtRVPzMU,Fri May 28 12:10:39 +0000 2021,México,Tlalnepantla de Baz,U,-99.1158905,19.518656,13030
Crónicas de un perro zancudo que no me dejó dormir bien y me dejó bien picado.,Sat May 29 12:02:15 +0000 2021,Jalisco,Tonalá,U,-103.2131755,20.6215735,3280
Me están acribillando los zancudos... :(,Tue Jun 01 04:32:13 +0000 2021,Jalisco,Zapopan,R,-103.48477450000001,20.790657000000003,40
"Y justo cuando ya se estaban calmando los zancudos, vuelve a llover! 🦟🦟🌧",Tue Jun 01 20:17:47 +0000 2021,Tamaulipas,Matamoros,R,-97.547392,25.558993,0
Menos mal los únicos que me quieren comer son los zancudos,Wed Jun 02 07:11:18 +0000 2021,Sonora,Imuris,R,-110.7478515,30.8344905,0
Hoy me desperté odiando demasiado a los zancudos y al calor que hace en Gdl,Wed Jun 02 12:17:39 +0000 2021,Jalisco,Zapopan,R,-103.48477450000001,20.790657000000003,40
Si les pica un zancudo no se rasquen ☹️🦟 https://t.co/STKXEWGPkQ,Wed Jun 02 16:56:04 +0000 2021,Tamaulipas,Llera,R,-98.83887849999999,23.2986025,0
"@dark_crawling Quisera ser tu zancudo,unos te pican en la cara y otros en el cuello.👼👼👼👼",Wed Jun 02 17:10:46 +0000 2021,México,Ecatepec de Morelos,R,-99.0444445,19.56828,615
"Uno menos ☺🤗😊😎👏🏼👏🏼👏🏼👏🏼
¿Que creían que en el trabajo no me comen los zancudos ? 
Que les pasa si tengo un imán para… https://t.co/bgi6VBLGxU",Wed Jun 02 17:42:10 +0000 2021,Jalisco,Guadalajara,U,-103.335882,20.676651999999997,1385621
"Te escucho en la penumbra, zancudo... Y no descansaré hasta que mueras e.e'",Thu Jun 03 06:21:19 +0000 2021,Michoacán de Ocampo,Morelia,R,-101.27577,19.652724,84
Me picó un zancudo en la planta del pie 😭,Thu Jun 03 09:38:03 +0000 2021,Coahuila de Zaragoza,Saltillo,R,-101.166961,25.0326315,97
"Duermo entre letras y cartones
bajo un techo de historias y colores
Entre pájaros en pleno regocijo
y un zancudo qu… https://t.co/Q73RdjvnEg",Thu Jun 03 18:31:55 +0000 2021,México,Tlalnepantla de Baz,U,-99.1158905,19.518656,13030
Te odio zancudo.,Mon Jun 07 02:03:34 +0000 2021,Aguascalientes,Jesús María,R,-102.42918150000001,21.9341455,0
"Obstruyendo el paso, colonias sin agua, luz o piso firme, inundaciones cada vez que llueve, zancudos por todos lado… https://t.co/WKx40n3Zph",Mon Jun 07 06:00:35 +0000 2021,Veracruz de Ignacio de la Llave,Veracruz,R,-96.22939650000001,19.183953,3
Otra vez 4 am que me levantan los perros zancudos 🤬,Mon Jun 07 10:23:51 +0000 2021,Querétaro,Querétaro,R,-100.4405945,20.7152745,9
Que le dan a los zancudos aquí!!! https://t.co/BNEvf4WG1W,Mon Jun 07 20:19:15 +0000 2021,Nuevo León,Allende,R,-100.0350375,25.29571,0
Voy terminando de correr y no quiero me quiero parar pq me va achingar los zancudos,Tue Jun 08 01:55:26 +0000 2021,Sinaloa,Ahome,R,-109.1037265,25.921946500000004,308
Fui violada por Un ejército de zancudos que se metieron a mi cuarto 😫😫😭🤬,Tue Jun 08 02:21:20 +0000 2021,Aguascalientes,Aguascalientes,R,-102.327207,21.849459000000003,0
"Pinches raidolitos no sirven para nada, los zancudos🦟 parecen kamikazes atacando.",Tue Jun 08 04:09:32 +0000 2021,Ciudad de México,Cuauhtémoc,U,-99.153366,19.432836,545884
The zancudos are beating my ass,Wed Jun 09 02:12:02 +0000 2021,Jalisco,Mascota,R,-105.14858050000001,20.697052499999998,0
@Lunaazulada_ Creo es lo mejor con este calor y con zancudos integrados,Wed Jun 09 03:25:15 +0000 2021,Tamaulipas,Altamira,R,-98.082815,22.560886000000004,0
ME EMPERRAN LOS ZANCUDOS Y LAS MOSCAS ODIO EL CALORRR LO ODIO!! ODIO AQUÍ,Wed Jun 09 19:40:22 +0000 2021,Coahuila de Zaragoza,Monclova,R,-101.220857,26.878203499999998,0
Me picó un zancudo en el tatuaje del tobillo 😭😭😭,Thu Jun 10 04:51:55 +0000 2021,Coahuila de Zaragoza,Saltillo,R,-101.166961,25.0326315,97
"De verdad que no hay cosa que no soporte más que los zancudos, me cago en su vida de verdad",Thu Jun 10 14:00:35 +0000 2021,Nuevo León,Apodaca,R,-100.27047400000001,25.736714999999997,0
Creo otra noche siendo cena de zancudos !,Fri Jun 11 04:00:02 +0000 2021,Querétaro,Querétaro,R,-100.4405945,20.7152745,9
También me están comiendo los zancudos.,Fri Jun 11 06:03:53 +0000 2021,Guanajuato,León,R,-101.601401,21.09806,3
"Maldito calor, ni idea de él por qué les gusta estar lleno de zancudos 😖😖😖",Fri Jun 11 09:27:39 +0000 2021,Jalisco,Guadalajara,U,-103.335882,20.676651999999997,1385621
Bien picado por los zancudos 😤 https://t.co/WRqYP75oMH,Fri Jun 11 17:58:28 +0000 2021,Nuevo León,Monterrey,U,-100.29359149999999,25.6417185,1142952
Malditos zancudos me están comiendo. 😩,Fri Jun 11 22:02:57 +0000 2021,Nuevo León,Monterrey,U,-100.29359149999999,25.6417185,1142952
"@r9carloss fue el balon, la cancha, el aire, los zancudos.... que se yo. jajjaa",Sat Jun 12 13:51:06 +0000 2021,Nuevo León,Apodaca,R,-100.27047400000001,25.736714999999997,0
"Las mucamas del hotel dejaron la ventana abierta, y ahora toda mi familia y yo estamos matando zancudos
😠",Sun Jun 13 02:15:40 +0000 2021,Veracruz de Ignacio de la Llave,Tecolutla,R,-96.99347999999999,20.4182895,25
Esos zancudos ya me tienen alucinada... 😩😩😩😩 https://t.co/a7glwQWsOA,Sun Jun 13 07:06:45 +0000 2021,Ciudad de México,Iztacalco,U,-99.09649599999999,19.399101,404695
Prometí que nadie volvería a incidir sobre mi tranquilidad y ese puto zancudo nomás está chingando la madre me dirijo a aplastarlo,Sun Jun 13 15:13:56 +0000 2021,Aguascalientes,Aguascalientes,R,-102.327207,21.849459000000003,0
Harta de este sufrimiento llamado ZANCUDOS 🦟🦟🦟,Mon Jun 14 01:20:55 +0000 2021,Tamaulipas,San Fernando,R,-97.9904885,24.873091000000002,0
"@lizyporelmundo Somos morelenses, esos zancudos no nos duraron nada.",Mon Jun 14 01:24:34 +0000 2021,Morelos,Jonacatepec de Leandro Valle,R,-98.81335,18.6691735,83
"Dice el zancudo
Que me cuide del vampiro.",Mon Jun 14 21:08:03 +0000 2021,Tabasco,Nacajuca,R,-92.9164995,18.0219595,432
@JhonDoe11111 Si jajajaja pero ya me voy a dormir. Me levanté a encender incienso para que se alejen los zancudos.,Tue Jun 15 04:32:48 +0000 2021,Guanajuato,León,R,-101.601401,21.09806,3
No sé que es peor. El calor o los zancudos.,Wed Jun 16 05:06:06 +0000 2021,Guanajuato,León,R,-101.601401,21.09806,3
Buenos días. Odio a los zancudos 😶.,Wed Jun 16 09:36:35 +0000 2021,Guanajuato,León,R,-101.601401,21.09806,3
"#EnriqueAlfaro antes de comprar portadas y si mejor nos fumigas las barrios? Paro, nos están inundando los zancudos 🦟",Wed Jun 16 20:29:22 +0000 2021,Jalisco,Zapopan,R,-103.48477450000001,20.790657000000003,40
