Tweet,Fecha,Estado,Locacion,Tipo,Longitud,Latitud,Poblacion
@Lunadescalza Che aguacero que cayó aquí en Coapa como 2-3 de la mañana,Thu Jun 24 11:42:47 +0000 2021,Ciudad de México,Tlalpan,R,-99.208364,19.199485,86
El aguacero finalmente llegó a Puebla… https://t.co/iBuKBNmdyO,Fri Jun 25 00:22:26 +0000 2021,Puebla,Amozoc,R,-98.1542665,19.0322295,616
Pobre de toda la raza que le tocó el aguacero por todo Gdl,Fri Jun 25 00:53:09 +0000 2021,Jalisco,Guadalajara,U,-103.335882,20.676651999999997,1385621
"⁉️⛈

Cae un #aguacero sobre el sur de la ciudad de #Querétaro 🌧

Es probable que la #tormenta esté acompañada de gr… https://t.co/ed6ZcKL3VN",Fri Jun 25 22:32:19 +0000 2021,Querétaro,Querétaro,R,-100.4405945,20.7152745,9
Se soltó el aguacero. 😶😶😶,Sat Jun 26 19:31:39 +0000 2021,Quintana Roo,Puerto Morelos,R,-87.0316645,21.048719,0
El cielo del atardecer en Puebla después de un aguacero. #fotodd #ClimaAlAire #Puebla https://t.co/KWu7gtvCvS,Mon Jun 28 17:59:22 +0000 2021,Veracruz de Ignacio de la Llave,Xalapa,R,-96.886083,19.542054,0
"@VivoEnLeon Que buen aguacero. Mi roof es ahora un chapoteadero. Mi domo está dejando pasar una brisa, está casa necesita mantenimiento.",Mon Jun 28 21:54:27 +0000 2021,Guanajuato,León,R,-101.601401,21.09806,3
Vaya aguacero a caido ahora alrrato empieza el frio,Mon Jun 28 23:04:37 +0000 2021,Ciudad de México,Iztapalapa,U,-99.050461,19.342788499999997,1835486
Casi literalmente yo saliendo del súper y con un aguacero https://t.co/W0cGujqbqN,Tue Jun 29 04:42:15 +0000 2021,Sinaloa,Culiacán,R,-107.3420565,24.6624885,0
"Miro por la ventana agradezco el nuevo día, el sol saliendo, voy por café miro de nuevo por la ventana y el aguacero!!",Tue Jun 29 13:38:14 +0000 2021,Quintana Roo,Puerto Morelos,R,-87.0316645,21.048719,0
"@ca11ochoa Saludos mi Charlie, todo bien con los aguaceros, un abrazo y que tengas un excelente Martes!!! ☠☠☠",Tue Jun 29 14:32:08 +0000 2021,Ciudad de México,Miguel Hidalgo,U,-99.2115105,19.4299345,414470
"Ya le cayó el aguacero,de mentadas",Tue Jun 29 18:48:10 +0000 2021,Ciudad de México,Iztacalco,U,-99.09649599999999,19.399101,404695
"En #Monterrey
Cuando el #CerrodelaSilla 
lleva sombrero…
¡Seguro aguacero!

#CronicasNL #sinmiedoalblackandwhite https://t.co/yYKlGibqhi",Tue Jun 29 23:04:55 +0000 2021,Nuevo León,Guadalupe,R,-100.196134,25.6766035,28
Cacho de aguacero 👌,Wed Jun 30 02:45:07 +0000 2021,Tabasco,Jalapa,R,-92.801837,17.777682,308
"Sin parar lluvia al poniente sector mitras norte,cumbres, Gonzalitos,de pronto aguacero y de pronto un poco más tra… https://t.co/5zpp2xEbj3",Wed Jun 30 06:17:49 +0000 2021,Nuevo León,Monterrey,U,-100.29359149999999,25.6417185,1142952
"Fuerte Aguacero inundó algunas calles de la Ciudad de #Guadalajara
1/Julio /2021 en Guadalajara, Jalisco https://t.co/QBRjCRDu7t",Thu Jul 01 19:30:04 +0000 2021,Jalisco,Guadalajara,U,-103.335882,20.676651999999997,1385621
Me agarró el aguacero. Fin.,Fri Jul 02 00:32:30 +0000 2021,Guanajuato,Irapuato,R,-101.3403935,20.673542,23
"#Lluvia  #Tormenta #Aguacero ⛈ #Corriente de #Agua en San Lorencito, Chihuahua https://t.co/tSqMMcmiGR",Fri Jul 02 03:30:54 +0000 2021,Chihuahua,Ahumada,R,-106.381591,30.4287375,0
Vean que aguacero esta cayendo! https://t.co/HLXi2jg1l9,Fri Jul 02 21:10:39 +0000 2021,México,Atizapán de Zaragoza,R,-99.269192,19.564587500000002,13
Calderón con dinero del PRIAN le pago a los gringos para que usen el HAAARP y provoquen un aguacero que ya lleva me… https://t.co/6ua2Uvyw6w,Fri Jul 02 21:21:33 +0000 2021,México,Tlalnepantla de Baz,U,-99.1158905,19.518656,13030
"Que aguacero cayó en Atizapan, no se había visto algo parecido desde 2017.  😦",Fri Jul 02 22:53:05 +0000 2021,México,Atizapán de Zaragoza,R,-99.269192,19.564587500000002,13
@monitom14 Peor tantito y déjame decirte q me tocó un mega aguacero pero mi impermeable me protegió 😃,Sat Jul 03 00:09:33 +0000 2021,México,Tlalnepantla de Baz,U,-99.1642825,19.543933000000003,658907
Olvidenlo ya está el gran aguacero,Sat Jul 03 11:50:08 +0000 2021,Chiapas,San Fernando,R,-93.20642749999999,16.912427,8
Ya hacía falta un buen aguacero como este..🌧 https://t.co/z5uCCarjge,Sat Jul 03 23:39:07 +0000 2021,Sonora,Hermosillo,R,-111.498181,28.9698625,5
Tremendo aguacero https://t.co/2bMOMqJVwB,Sun Jul 04 22:23:05 +0000 2021,México,Tecámac,R,-98.9903395,19.7051795,531
@laKaro_gc @MisMariachisGDL @DiablosRojosMX @LoboMorales_ @jorgealcarazb Vamos Diablos!!!!! Aguante el aguacero par… https://t.co/i1heu3pelX,Sun Jul 04 23:12:23 +0000 2021,Ciudad de México,Iztacalco,U,-99.09649599999999,19.399101,404695
"🔴 Además del fuerte aguacero suscitado en #Pachuca, en la #carretera México-Pachuca se encuentra un largo tramo de… https://t.co/PXJ6RnjaUD",Mon Jul 05 00:45:30 +0000 2021,Hidalgo,Metztitlán,R,-98.81185,20.563844500000002,88
"Todo valió la pena: miel aguacero, el lodo, el dinero, la desvelada; todo para ver feliz a mi Nico. 💙 https://t.co/KCRfN5j56p",Mon Jul 05 03:10:02 +0000 2021,Ciudad de México,Xochimilco,R,-99.08179,19.236244499999998,123
Pinche aguacero que se soltó lluvia 🌧,Mon Jul 05 23:29:38 +0000 2021,Ciudad de México,Cuajimalpa de Morelos,R,-99.30558049999999,19.318697,728
...Seguro aguacero,Tue Jul 06 02:35:16 +0000 2021,Nuevo León,Cadereyta Jiménez,R,-99.9312465,25.519292,0
"#Video |  ¡AZOTA AGUACERO EN CDMX Y EDOMEX!
 #Atizapán una de las zonas más afectadas en donde incluso se inundó el… https://t.co/GrKmCIgRq5",Tue Jul 06 03:47:38 +0000 2021,México,Atizapán de Zaragoza,R,-99.2489725,19.567409,13
@BaggyOficial No digas idioteces. Ahora hasta los aguaceros e inundaciones del Estado de Mexico son su culpa. Qué estupidez.,Tue Jul 06 08:15:26 +0000 2021,Ciudad de México,Tlalpan,R,-99.208364,19.199485,86
"@NextFmMX @CoachLuisRobert @DonLimon #ElGallitoInglés

Efectivamente, ayer cayó un aguacero en toda la zona Norponi… https://t.co/AqBSWsMvJI",Tue Jul 06 16:05:03 +0000 2021,México,Ecatepec de Morelos,R,-99.0444445,19.56828,615
@annagzz Seguro aguacero https://t.co/uybtax4bUM,Tue Jul 06 16:26:51 +0000 2021,Nuevo León,San Pedro Garza García,R,-100.366033,25.650287499999997,2
Aguacero en #Cuajimalpa @AlcCuajimalpa  ☔️,Tue Jul 06 21:24:18 +0000 2021,Ciudad de México,Cuajimalpa de Morelos,R,-99.30558049999999,19.318697,728
Quién dijo que bajo el aguacero no se ve la sonrisa?,Tue Jul 06 23:57:25 +0000 2021,México,Xalatlaco,R,-99.398748,19.148777,549
Namas era un aviso y  sopas se vino al aguacero! https://t.co/waqPvLYk6A,Wed Jul 07 00:15:01 +0000 2021,Veracruz de Ignacio de la Llave,Tantoyuca,R,-98.19090349999999,21.3911935,237
"Dios de mi vida , se cayó el cielo, tremendo aguacero",Wed Jul 07 00:33:03 +0000 2021,Ciudad de México,Miguel Hidalgo,U,-99.2115105,19.4299345,414470
#parecequevaallover #nubes #cielonublado #aguacero #durangomexico #durangomx #huaweimate20 #loves_durango… https://t.co/Og1vzAoE4o,Wed Jul 07 01:11:58 +0000 2021,Durango,Durango,R,-104.83757800000001,23.954162500000002,0
Yisus el aguacero que se viene 🌂,Wed Jul 07 04:03:44 +0000 2021,Guerrero,Zihuatanejo de Azueta,R,-101.457015,17.8005545,11
Jajajaja así salen del pantano y del Río en mi puerto cuando están los aguaceros fortísimos como el que está ahora… https://t.co/fjafkC3L25,Wed Jul 07 04:45:18 +0000 2021,Veracruz de Ignacio de la Llave,Coatzacoalcos,U,-94.43248200000001,18.135455,212540
@pcmqro @arco_piedra @spublicosqro Protección Civil gracias x el apoyo recibido en Arco de Piedra x aguacero La uni… https://t.co/kfGrmvSNuU,Wed Jul 07 10:41:36 +0000 2021,Querétaro,Querétaro,R,-100.4405945,20.7152745,9
Regresan los #colores después de tremendos aguaceros con el #cielo limpio de nubes y los #árboles florecen. Solo ca… https://t.co/PvVFlkgLR0,Wed Jul 07 16:33:30 +0000 2021,Morelos,Cuernavaca,R,-99.260819,18.933812,78
@Trafico_ZMG Emoieza torrencial aguacero a la altura de Glendale en Tlaquepaque,Fri Jul 09 01:34:36 +0000 2021,Jalisco,San Pedro Tlaquepaque,R,-103.34832399999999,20.592133,0
@DavidPraDino @Jazzrockman @genesimmons Torrencial aguacero y casi nos lo cancelan 🤟🏻,Fri Jul 09 01:52:16 +0000 2021,Jalisco,Zapopan,R,-103.48477450000001,20.790657000000003,40
@Fernand01351403 @dtrejo3 A ver qué sucede. Buen aguacero está cayendo!,Fri Jul 09 02:19:20 +0000 2021,Jalisco,Zapopan,R,-103.48477450000001,20.790657000000003,40
"#zacatecasdeslumbrante 
Bien decía mi abuelo 👴, neblina en los cerros, seguros aguaceros 🌧 en Zacatecas City https://t.co/2OXpi80jfs",Fri Jul 09 02:45:01 +0000 2021,Zacatecas,Zacatecas,R,-102.6943495,22.7306065,-
"Por culpa del gato me quedé encerrado en el jardín. 

Estaba cayendo un aguacero y bendito sea mi Galaxy Watch me salvó la vida  🥲🥲🥲🥲🥲🥲🥲🥲",Sat Jul 10 23:51:47 +0000 2021,Jalisco,San Pedro Tlaquepaque,R,-103.34832399999999,20.592133,0
"Oye @LigaMexBeis el campo del Francisco I. Madero es un potrero, como es posible que cayendo un aguacero desde hace… https://t.co/p8idIilro8",Sun Jul 11 01:58:10 +0000 2021,México,Tlalnepantla de Baz,U,-99.1158905,19.518656,13030
@veroce75 @RbKdAguilar Me avisan muy tarde! Voy llegando así a la casa! Me cayó un mendigo aguacero!! https://t.co/xK7BCkVydc,Sun Jul 11 06:30:53 +0000 2021,Sonora,Hermosillo,R,-111.498181,28.9698625,5
@whocaressssss3 Andaba en la caminata dominical y me cayó el aguacero como a 2km de mi casa jajajaj pero estuvo divertido la neta,Sun Jul 11 16:44:13 +0000 2021,Coahuila de Zaragoza,Viesca,R,-103.23313,25.244222999999998,36
Que bonito CDMX…. Recibiéndome con un aguacero… 🌧☔️,Sun Jul 11 23:52:53 +0000 2021,México,Tlalnepantla de Baz,U,-99.1158905,19.518656,13030
Vean nomás el aguacero que cayó hace rato en mi rancho. Ccp. @ClimaYucatan https://t.co/J4Xoq7C1xQ,Mon Jul 12 22:27:35 +0000 2021,Yucatán,Mérida,R,-89.687528,20.937676,1119
Por pinche tragón salí por una memela y ya me agarró el aguacero 🙄,Tue Jul 13 02:55:58 +0000 2021,Veracruz de Ignacio de la Llave,Orizaba,R,-97.112844,18.856709,61
"Con todo y aguacero! 🌩️🌧️ GANAMOS!

Pd: ignoren el tiradero XD. https://t.co/PzjM6f6j3E",Tue Jul 13 02:58:59 +0000 2021,Jalisco,Zapotlanejo,R,-103.0757815,20.642842,642
"Con aguacero!🌧️🌩️ pero GANAMOS! 

Resbalones, caídas en los charcos y muchos goles ⚽, pura diversión. https://t.co/8HI6JXZz6l",Tue Jul 13 03:08:40 +0000 2021,Jalisco,Zapotlanejo,R,-103.0757815,20.642842,642
2 horas y contando sin luz y un aguacero 🙃,Tue Jul 13 03:19:32 +0000 2021,Sinaloa,Culiacán,R,-107.3420565,24.6624885,0
"Ayer antes de dormir pensé ""que llueva"" en la madrugada me levante y estaba un aguacero que ni me quería dormir jaj… https://t.co/nkyImANP1P",Tue Jul 13 14:32:03 +0000 2021,San Luis Potosí,San Luis Potosí,R,-100.955511,22.3111195,18
"@_Blue_SV 🤭🤭🤭🤭 

Hasta ahorita y después del aguacero de ayer y la empapada que me puse, todo bien 🤟",Tue Jul 13 16:04:42 +0000 2021,Ciudad de México,Tlalpan,R,-99.208364,19.199485,86
Mi cara cuando ya me toca salir a comer … y escucho el aguacero 🌧🌧😫😫😫😫😫😫😫 https://t.co/gPkHhfQxop,Tue Jul 13 19:42:23 +0000 2021,Ciudad de México,Benito Juárez,U,-99.1614805,19.380613,434153
Aguacero acá por rincón de Guadalupe,Tue Jul 13 21:33:35 +0000 2021,Nuevo León,Guadalupe,R,-100.196134,25.6766035,28
"Váyanse preparando que ahí viene el aguacero. Cuidado con los árboles, los baches y los encharcamientos. Guadalajar… https://t.co/JRmxEtooIB",Tue Jul 13 23:21:37 +0000 2021,Jalisco,Zapopan,R,-103.48477450000001,20.790657000000003,40
"#Merida #Yucatán
Se aproxima una tremenda lluvia #aguacero #vientos https://t.co/5AQjg3YiKx",Tue Jul 13 23:36:02 +0000 2021,Yucatán,Mérida,R,-89.62361100000001,20.941035,0
Super aguacero a la altura del Complejo Deportivo Kukulcan. https://t.co/vBuPJDiAk9,Tue Jul 13 23:50:35 +0000 2021,Yucatán,Kanasín,U,-89.594575,20.942881,139753
"#ladofdefrankenvivo recuerdo el concierto de guns &amp; roses estuvo genial!!! Cayo un aguacero esa vez, fue en abril 2… https://t.co/JDnMHFlM43",Tue Jul 13 23:52:13 +0000 2021,Veracruz de Ignacio de la Llave,Tlaltetela,R,-96.6498045,19.341894500000002,111
@DM_LVR Salud oiga. Aquí aprovechando el aguacero,Wed Jul 14 01:35:48 +0000 2021,Jalisco,Zapopan,R,-103.48477450000001,20.790657000000003,40
Me agarró el aguacero cuando estaba corriendo... 🥺😥,Wed Jul 14 01:40:48 +0000 2021,Ciudad de México,Coyoacán,U,-99.15234000000001,19.328383000000002,614447
Y que se viene el aguacero!!! https://t.co/vwudFQf4qk,Wed Jul 14 03:09:22 +0000 2021,Quintana Roo,Benito Juárez,U,-86.819846,21.150229,888797
@martibatres @Claudiashein Y se hizo el aguacero y se les inundaron las cabinas.Córrele Martí a entregar impermeabl… https://t.co/0zZuIPZGZf,Wed Jul 14 03:33:35 +0000 2021,Ciudad de México,Miguel Hidalgo,U,-99.2115105,19.4299345,414470
"Esos aguaceros conejos desos re sabrosos en mi costa orejona ⛱️🐇☀️

Aquí en el #Chilango se asustan con pinshes chi… https://t.co/woKo2wNvIh",Wed Jul 14 04:19:04 +0000 2021,Ciudad de México,Cuajimalpa de Morelos,R,-99.302516,19.348253,80
"Me siento en Chiriquí, clase de AGUACERO https://t.co/Ds7ZNkb3tm",Wed Jul 14 05:53:28 +0000 2021,Quintana Roo,Puerto Morelos,R,-87.0316645,21.048719,0
Te amooo desde la vez que me agarro un súper aguacero en Reforma222 y fuiste por mi!! Y luego fuimos a ver Godzilla… https://t.co/5S3QEQyAld,Wed Jul 14 15:52:26 +0000 2021,Ciudad de México,Miguel Hidalgo,U,-99.2115105,19.4299345,414470
Ayyyy qué bonito se nubló. Ya déjate venir aguacero perrón.,Wed Jul 14 17:02:51 +0000 2021,Veracruz de Ignacio de la Llave,Veracruz,R,-96.22939650000001,19.183953,3
Cómprate tu sombrilla para cuando te toque tu aguacero.,Wed Jul 14 18:58:21 +0000 2021,Tamaulipas,Ciudad Madero,U,-97.8225365,22.283026,205933
Vine a Veracruz tan primaveral y me topo con un aguaceros… 🤦🏻‍♂️ https://t.co/X3bBlOaAZX,Wed Jul 14 21:18:30 +0000 2021,Veracruz de Ignacio de la Llave,Boca del Río,U,-96.0989905,19.1431005,132011
"Yo me iba a ir a Tlatelolco desde hoy para poder irme mañana en bici al trabajo... Pero no, ya se soltó el aguacero… https://t.co/s4cwDjIOVu",Wed Jul 14 21:52:11 +0000 2021,México,Cuautitlán Izcalli,R,-99.233657,19.6562895,6730
"Rodri salió a correr sus 100mil kms del día, no sé si reír o llorar cuando regrese mojado con este perro aguacero 🤪… https://t.co/FVcXtUFuSQ",Wed Jul 14 22:08:42 +0000 2021,Yucatán,Mérida,R,-89.62361100000001,20.941035,0
"Pues si, pero con estos climas, este aguacero #Chilango y una taza de cafécito dese re sabroso en #SanAngel la verd… https://t.co/v6i2XwOaRe",Thu Jul 15 00:09:11 +0000 2021,Ciudad de México,Coyoacán,U,-99.19353799999999,19.344314,614447
@climahillo Colonia bugambilias fuerte aguacero y lleva 10 min sin parar.,Thu Jul 15 09:23:07 +0000 2021,Sonora,Hermosillo,R,-111.498181,28.9698625,5
"Tu recuerdo sigue aquí...🎤
como un aguacero....🎵
Rompe fuerte sobre mi...🎶
Ay pero a fuego lento...🎤

Te recuerdo a… https://t.co/Dy0MMzDO90",Thu Jul 15 13:51:27 +0000 2021,Guanajuato,San Miguel de Allende,R,-100.88441999999999,20.8765485,135
Perro coraje por qué está el aguacero y no puedo grabar mí tarea 😥,Thu Jul 15 17:36:50 +0000 2021,Veracruz de Ignacio de la Llave,Xico,R,-97.022154,19.44429,8
Lo bueno que en Xalapa está el aguacero y aun así se puede jugar PlayStation sin miedo a que se vaya la luz,Thu Jul 15 21:51:43 +0000 2021,Veracruz de Ignacio de la Llave,Xalapa,R,-96.886083,19.542054,0
Impresionante aguacero en #Puebla capital ☁💧 https://t.co/2taKXusXRM,Thu Jul 15 21:59:22 +0000 2021,Puebla,Amozoc,R,-98.1542665,19.0322295,616
"Jueves 15 9:50pm 
Intensa actividad eléctrica con fuerte aguacero al norte de la ciudad y puerto de #Veracruz, #Mexico 
#Spcver @spcver",Fri Jul 16 02:52:25 +0000 2021,Veracruz de Ignacio de la Llave,Veracruz,R,-96.22939650000001,19.183953,3
Que aguacero en Acapulco #acapulco  es hora de sacar a estrenar mi lancha #contodo,Fri Jul 16 03:43:25 +0000 2021,Guerrero,Acapulco de Juárez,R,-99.73564950000001,16.9589495,5
Llueve sobre la ciudad (el aguacero en la isla).,Fri Jul 16 04:45:33 +0000 2021,Campeche,Carmen,R,-91.6332875,18.4528265,2
@Trafico_ZMG aguacero por oblatos https://t.co/QtF5JFwYz2,Fri Jul 16 22:06:38 +0000 2021,Jalisco,Guadalajara,U,-103.335882,20.676651999999997,1385621
"Y si, nos tocó un pequeño aguacero al norte del puerto.",Mon Jul 19 00:03:09 +0000 2021,Veracruz de Ignacio de la Llave,Veracruz,R,-96.22939650000001,19.183953,3
Cómo que es domingo? 😩 en Cascada el Aguacero (Centro Ecoturistico) https://t.co/Obbi5l5vDP,Mon Jul 19 02:08:58 +0000 2021,Chiapas,Jiquipilas,R,-93.702145,16.571945499999998,8
Un aguacero de poca madre!!! Hasta granizo. Omg! 😱,Mon Jul 19 06:56:04 +0000 2021,Jalisco,Guadalajara,U,-103.335882,20.676651999999997,1385621
@webcamsdemexico @Trafico_ZMG Buenos días aquí en los cabos el pronóstico era que se iba caer le cielo del aguacero… https://t.co/Qf36aaRa1t,Mon Jul 19 11:29:20 +0000 2021,Baja California Sur,Los Cabos,R,-109.7662685,23.269879,2
"Un aguacero tapatío, me inspiró para escribir #NodoSur.",Mon Jul 19 15:49:21 +0000 2021,Yucatán,Mérida,R,-89.62361100000001,20.941035,0
"Al salir de la estación del tren ligero línea 3 en el mero centro de la ciudad, ya se había soltado el aguacero...c… https://t.co/5o7bYhL7c5",Tue Jul 20 02:33:39 +0000 2021,Jalisco,Guadalajara,U,-103.335882,20.676651999999997,1385621
"#Aguacero de @BuenRostromx en la #SpotifyPlaylist #Bugambilias entre otros grandes artistas 😎

Échenle oreja 👂🏽🎧👉🏽… https://t.co/Qu09DDuwAx",Tue Jul 20 05:57:53 +0000 2021,Ciudad de México,Milpa Alta,R,-99.0580225,19.138592000000003,0
Y aquí viene el aguacero!,Tue Jul 20 21:24:26 +0000 2021,México,Toluca,U,-99.655676,19.284321499999997,33089
Así hace una hora...luego un aguacero. 💁‍♀️ la cdmx es poquis como yo. https://t.co/JrgXBmyZlB,Tue Jul 20 22:13:58 +0000 2021,Ciudad de México,Benito Juárez,U,-99.1614805,19.380613,434153
Nos agarró el aguacero aquí pues ni modo si no se quita nos quedaremos al cabrito jajajaja,Wed Jul 21 15:44:31 +0000 2021,Nuevo León,San Pedro Garza García,U,-100.354403,25.670774,132128
La roooooooooopa! Ya se soltó el aguacero en monterrey😍❤🌩☔,Wed Jul 21 16:11:04 +0000 2021,Nuevo León,Monterrey,U,-100.29359149999999,25.6417185,1142952
"Aguacero en #monterrey #rain en Monterrey, Nuevo León... La Ciudad de las Montañas https://t.co/l9auiGxajy",Wed Jul 21 19:48:53 +0000 2021,Nuevo León,Monterrey,U,-100.29359149999999,25.6417185,1142952
@ClimaYucatan antes del aguacero de 10 minutos https://t.co/HRuNnd07YG,Wed Jul 21 22:16:06 +0000 2021,Yucatán,Mérida,R,-89.62361100000001,20.941035,0
Odio cuando cae un aguacero y no estoy en casa porque pienso que mis perros se ponen tristes preguntándose porque n… https://t.co/89qXUbHpVd,Wed Jul 21 23:18:23 +0000 2021,Sinaloa,Culiacán,R,-107.3420565,24.6624885,0
"Perro aguacero se soltó, se fue la luz. https://t.co/Gl0KUehIOg",Thu Jul 22 00:04:15 +0000 2021,Sinaloa,Culiacán,R,-107.3420565,24.6624885,0
Que pedo con la raza en Culiacán.. cayendo un aguacero y el morro con una caguama en mano. https://t.co/waAA7RpSG6,Thu Jul 22 03:47:09 +0000 2021,Sinaloa,Culiacán,R,-107.3420565,24.6624885,0
"3:30 am Tremenda tormenta eléctrica con fuerte aguacero sobre la zona conurbada de #Veracruz, #Mexico https://t.co/LxOEgO36eb",Thu Jul 22 08:46:26 +0000 2021,Veracruz de Ignacio de la Llave,Veracruz,R,-96.22939650000001,19.183953,3
"La de esperar en casa a que pase el aguacero en Condesa, Cd. De Mexico. https://t.co/pzIEiX0lRN",Thu Jul 22 21:15:46 +0000 2021,Ciudad de México,Cuauhtémoc,U,-99.153366,19.432836,545884
@Angelika8882 En cdmx calló un aguacero ... Linda tarde hermosa. Con cuidado,Thu Jul 22 21:54:58 +0000 2021,Ciudad de México,Tlalpan,R,-99.208364,19.199485,86
Se reventó el aguacero por estos lares🌧⛈🌨,Thu Jul 22 23:19:34 +0000 2021,Jalisco,Zapopan,R,-103.48477450000001,20.790657000000003,40
@fcjuarezoficial @TUDNMEX @AztecaDeportes @TolucaFC Pues aquí estoy afuera del estadio y está un aguacero tremendo  🤦🏽‍♀🤣🤣🏃🏃🏃,Sat Jul 24 00:46:01 +0000 2021,Chihuahua,Juárez,R,-106.568008,31.452274000000003,-
Aguacero en Juárez,Sat Jul 24 02:07:01 +0000 2021,Ciudad de México,Coyoacán,U,-99.15234000000001,19.328383000000002,614447
Se vino el aguacero en la cuna de la perla del Guadiana,Sun Jul 25 01:10:44 +0000 2021,Durango,Durango,R,-104.83757800000001,23.954162500000002,0
"@esme_diosa Estaba lavando y me agarró el aguacero, no me mojé mucho pero sí estaba fría el agua. Un chocolate nunca sobra o un pastelito",Sun Jul 25 23:43:50 +0000 2021,Ciudad de México,Coyoacán,U,-99.15234000000001,19.328383000000002,614447
"De regreso a la Costa, ¡que tremendo aguacero!",Tue Jul 27 00:33:53 +0000 2021,Guerrero,Cuajinicuilapa,R,-98.53960950000001,16.454991,0
Se viene el aguacero en Aduana AICM https://t.co/T2Zb2b75fu,Tue Jul 27 00:47:00 +0000 2021,México,Nezahualcóyotl,R,-99.087817,19.4320755,0
Terminar un día cansado disfrutando un aguacero y una taza de café con rico pan❤️,Tue Jul 27 02:19:46 +0000 2021,Chiapas,Escuintla,R,-92.58834399999999,15.355297,0
Buen aguacero. https://t.co/rgiIuqrYqy,Tue Jul 27 02:59:48 +0000 2021,Tlaxcala,Huamantla,R,-97.897037,19.351519500000002,0
"Yo no quiero a París con aguacero, ni Venecia sin ti",Tue Jul 27 07:47:23 +0000 2021,Nuevo León,Monterrey,U,-100.29359149999999,25.6417185,1142952
Se paró el aguacero ahora somos flotando dos gotas...,Tue Jul 27 14:40:48 +0000 2021,Sinaloa,Ahome,R,-109.1037265,25.921946500000004,308
Buenos y Bendecidos días mundo 🌎 estos son mis pasos de hoy !! A cuidarnos de los aguaceros que rondan por esta CIT… https://t.co/RsngsLBLhm,Wed Jul 28 14:15:37 +0000 2021,Jalisco,Guadalajara,U,-103.335882,20.676651999999997,1385621
Sr. Aguacero,Wed Jul 28 22:22:21 +0000 2021,Ciudad de México,Iztapalapa,U,-99.050461,19.342788499999997,1835486
Qué aguacero en la hermana República de Contreras.... Helppppp https://t.co/8wkrx8foQu,Wed Jul 28 23:04:42 +0000 2021,Ciudad de México,La Magdalena Contreras,R,-99.26452649999999,19.2755645,10
"#Lluvia 🚤 #Aguacero #Ejidos 😲 #Monzón en Villa Ahumada Y Anexas, Chihuahua https://t.co/N0wma7xliD",Thu Jul 29 00:35:56 +0000 2021,Chihuahua,Ahumada,R,-106.381591,30.4287375,0
Y que nos cae el aguacero aquí en bodega aurrera @camion_desde ⛈️🌧️☁️☔☔ @bdm_agtv,Thu Jul 29 01:03:02 +0000 2021,Nuevo León,Apodaca,R,-100.27047400000001,25.736714999999997,0
Se ve que ya caerá un aguacero 😳,Thu Jul 29 19:22:57 +0000 2021,Chiapas,San Fernando,R,-93.20642749999999,16.912427,8
"""El Cerro de la Silla cuando tiene sombrero, seguro aguacero"".
🤯 https://t.co/OL5L3vgvaL",Fri Jul 30 19:31:40 +0000 2021,Nuevo León,Monterrey,U,-100.29359149999999,25.6417185,1142952
"¿Qué está pasandaaaaaaa?

Este aguacero en el #zocalo NO es normal

🤣",Fri Jul 30 21:05:33 +0000 2021,Ciudad de México,Cuauhtémoc,U,-99.153366,19.432836,545884
Pinche aguacero!,Fri Jul 30 21:28:02 +0000 2021,Ciudad de México,Miguel Hidalgo,U,-99.2115105,19.4299345,414470
Hay algo peor que salir en el aguacero? Pues Salir 10 min. Después y que toda el agua encharcada y sucia te vaya salpicando,Fri Jul 30 23:21:00 +0000 2021,México,Nezahualcóyotl,R,-99.087817,19.4320755,0
"Gabriela Hernández
Me quería cubrir del aguacero que cayó en la CDMX y me resguarde en el metro, pero salió peor 😂😂… https://t.co/r4mao8quDh",Fri Jul 30 23:47:26 +0000 2021,México,Toluca,U,-99.655676,19.284321499999997,33089
"@Borisanimalo Un pinche aguacero de puta madre, no me moje, pero si se oía y veía de la verga carnal!",Fri Jul 30 23:56:56 +0000 2021,Ciudad de México,Azcapotzalco,U,-99.18212600000001,19.4857835,432205
"Me agarró el aguacero haciendo ejercicio y además ya se me fue la luz llegando a casa. 
Comiendo unos taquitos esto… https://t.co/BZPmLKJ4Vk",Sat Jul 31 01:16:29 +0000 2021,Ciudad de México,Iztacalco,U,-99.14011350000001,19.365949,404695
"Todo el camino de CDMX a Valle de Bravo mega aguacero!!! 
Hoy cansado 
Mañana a entrenar líderes!!!",Sat Jul 31 04:25:02 +0000 2021,México,Valle de Bravo,R,-100.1125095,19.1713575,227
No se si sea reacción o el aguacero que me agarro 💉🌡🤧😷🤒,Sat Jul 31 07:16:53 +0000 2021,México,Nezahualcóyotl,R,-99.087817,19.4320755,0
"Lloviendo está
Señor Aguacero",Sat Jul 31 21:38:40 +0000 2021,Ciudad de México,Iztapalapa,U,-99.050461,19.342788499999997,1835486
"Mañana se viene un aguacero, tengan cuidado",Sun Aug 01 04:53:15 +0000 2021,Nuevo León,Cadereyta Jiménez,R,-99.9312465,25.519292,0
"Agradecer AmmaBaghavan
El cerro tiene sombrero!!! Aguacero
Empieza el 8vo mes del 2021
Estamos vivos y eso ya es mu… https://t.co/fmJvGOqKLC",Sun Aug 01 12:36:11 +0000 2021,Nuevo León,Monterrey,U,-100.29359149999999,25.6417185,1142952
@VialidadXalapa ¿En dónde está el aguacero?,Sun Aug 01 17:47:47 +0000 2021,Veracruz de Ignacio de la Llave,Xalapa,R,-96.886083,19.542054,0
Me agarro el aguacero en la marisquería ¿pido más cerveza?,Sun Aug 01 21:30:30 +0000 2021,México,Tecámac,R,-98.9903395,19.7051795,531
A ver si con este aguacero me cae el título universitario 🙏😂,Mon Aug 02 06:01:04 +0000 2021,Zacatecas,Moyahua de Estrada,R,-103.162358,21.1973845,0
"@Trafico_ZMG 
Se soltó el aguacero en Santa Elena alcalde https://t.co/lBHt2Jp8GW",Mon Aug 02 23:50:38 +0000 2021,Jalisco,Guadalajara,U,-103.335882,20.676651999999997,1385621
@richardvs80 Me agarró un aguacero ya casi pa y si me acordaba que había un bache pero PS lo tapo el agua,Tue Aug 03 00:06:42 +0000 2021,México,Ecatepec de Morelos,R,-99.0444445,19.56828,615
Sr. Aguacero ☔,Tue Aug 03 01:47:47 +0000 2021,Ciudad de México,Iztapalapa,U,-99.050461,19.342788499999997,1835486
