Tweet,Fecha,Estado,Locacion,Tipo,Longitud,Latitud,Poblacion
"Como le hago para llevarme este aguacero, pa’ l rancho? https://t.co/tOF13Zze4t",Mon May 23 23:00:24 +0000 2022,Ciudad de México,Tlalpan,R,-99.208364,19.199485,86
Como me llevo este aguacero pal rancho? https://t.co/Xee7kCaFX5,Mon May 23 23:20:46 +0000 2022,Ciudad de México,Tlalpan,R,-99.208364,19.199485,86
"Ni me gusta la lager...
📍 Cascada ""El Aguacero"", Ocozocoautla de Espinosa, Chiapas. https://t.co/X4z9Z1NvXx",Tue May 24 01:18:23 +0000 2022,Chiapas,Comitán de Domínguez,R,-92.30098799999999,16.2586045,132
La canción de aguacero de bad bunny 📈📈,Tue May 24 12:09:29 +0000 2022,Nuevo León,Apodaca,R,-100.1687175,25.778679,1879
"Venia escuchando aguacero , caminando abajo del aguacero (barras)",Tue May 24 12:19:21 +0000 2022,Nuevo León,Apodaca,R,-100.1687175,25.778679,1879
"⛅️ ok si, si! 🤤🤯 si el calor el de 90 el aguacero es de 100, vamos a pasarla bien 🤤🔥 https://t.co/54PNYlNhmL",Wed May 25 13:41:34 +0000 2022,Hidalgo,El Arenal,R,-98.89303799999999,20.2948005,78
Goey por qué nadie habla de lo sensual que está la canción de aguacero (?!?!) 🤤🔥,Wed May 25 18:48:54 +0000 2022,Jalisco,Zapopan,R,-103.48477450000001,20.790657000000003,40
Ya se viene el aguacero Masters!!! en Servicio LUNA https://t.co/capAMM0PS8,Wed May 25 22:21:35 +0000 2022,Ciudad de México,Iztapalapa,U,-99.050461,19.342788499999997,1835486
"@PrincipeAlii En Puebla capital, pero igual está del carajo, antier me empapé con el aguacero que cayó, hoy me estoy derritiendo jajaja 🙈",Fri May 27 00:16:59 +0000 2022,Puebla,Amozoc,R,-98.1542665,19.0322295,616
Cómo aguacero de Mayo…,Fri May 27 02:51:58 +0000 2022,Quintana Roo,Felipe Carrillo Puerto,R,-88.0134815,19.749553,11
si el calor es d 90 el aguacero es d 100,Sat May 28 14:48:41 +0000 2022,Baja California Sur,Los Cabos,R,-109.7662685,23.269879,2
@ClimaYucatan Cayó un breve aguacero en Cancún con ligera tormenta eléctrica. https://t.co/uJJ90MzfVO,Sun May 29 01:42:57 +0000 2022,Quintana Roo,Puerto Morelos,R,-87.0316645,21.048719,0
Estoy de lo más contento. Cayó un aguacero magnífico en el Rocco y el Cuexcomate. Mañana sabremos la magnitud. Segu… https://t.co/rulrX3oq6n,Mon May 30 01:27:28 +0000 2022,Morelos,Jonacatepec de Leandro Valle,R,-98.81335,18.6691735,83
"Pitó el árbitro y empezó el aguacero en GDL, épico",Mon May 30 03:39:27 +0000 2022,Jalisco,Zapopan,R,-103.48477450000001,20.790657000000003,40
"Empieza a caer un aguacero en GDL, ¿será una señal de inconformidad? 😅",Mon May 30 03:48:32 +0000 2022,Jalisco,Zapopan,R,-103.48477450000001,20.790657000000003,40
"30 de mayo

Me moriré en París con aguacero, un día del cual tengo ya el recuerdo.
Me moriré en París -y no me corr… https://t.co/7XSGiZVvLz",Mon May 30 12:07:02 +0000 2022,Veracruz de Ignacio de la Llave,Papantla,R,-97.31118099999999,20.419946,0
"Todxs hablan del album y sus joyitas de rolitas, pero neta ya le pusieron atención a la rola de aguacero neta ufff",Mon May 30 14:18:21 +0000 2022,Jalisco,Guadalajara,U,-103.335882,20.676651999999997,1385621
Agradecido con el tren de Aguacero 🙌🏽,Mon May 30 16:15:36 +0000 2022,Coahuila de Zaragoza,Ramos Arizpe,R,-101.2359675,25.921345000000002,23
aguacero de Bad Bunny tiene nombre y apellido,Mon May 30 21:40:01 +0000 2022,Morelos,Cuernavaca,R,-99.260819,18.933812,78
La necesidad de no publicar el trend de #aguacero me está carcomiendo Marce,Mon May 30 22:16:58 +0000 2022,San Luis Potosí,San Luis Potosí,R,-100.955511,22.3111195,18
@LaEufe El frío del aguacero que ha caído... Me gusta más el frío sin agua,Tue May 31 14:42:58 +0000 2022,Oaxaca,Oaxaca de Juárez,R,-96.7250025,17.090319,685
"El Aguacero 😍🌧️🤩PorQue La Vida Se Vive Una Vez💁🏻‍♀️ en Ocozocoautla De Espinosa, Chiapas, Mexico https://t.co/qfcZpoBxKO",Tue May 31 20:53:27 +0000 2022,Chiapas,Jiquipilas,R,-93.536185,16.7863745,335
Tarde de aguacero. https://t.co/13tAtdLv7h,Tue May 31 22:25:52 +0000 2022,Puebla,San Andrés Cholula,U,-98.2697855,18.997352499999998,99736
"Hay trend de aguacero y está uff 🥵 
Procedo a hacerlo",Tue May 31 23:16:16 +0000 2022,Veracruz de Ignacio de la Llave,Orizaba,R,-97.112844,18.856709,61
Que buen aguacero se vino por La Rioja!!🙌🏻👏🏼 19:58,Wed Jun 01 00:58:14 +0000 2022,Nuevo León,Monterrey,U,-100.29359149999999,25.6417185,1142952
Ya está cayendo un aguacero acá en el Ajusco. La rodilla jamás se equivoca.,Wed Jun 01 21:20:50 +0000 2022,Ciudad de México,Tlalpan,R,-99.208364,19.199485,86
Que rico aguacero 😭😭😭,Wed Jun 01 21:28:29 +0000 2022,Veracruz de Ignacio de la Llave,Xalapa,R,-96.886083,19.542054,0
"Se vino el aguacero y ya llene una cubeta de pintura, voy por el segundo,.mañana si me baño",Thu Jun 02 01:48:37 +0000 2022,Nuevo León,Monterrey,U,-100.29359149999999,25.6417185,1142952
"Señor aguacero, @joluisgarcia, Padre Mier y Juárez, centro de #Monterrey 🌧️☔ https://t.co/Eq6Bm5QwBT",Thu Jun 02 01:49:25 +0000 2022,Nuevo León,Monterrey,U,-100.29359149999999,25.6417185,1142952
"@charlymils @joluisgarcia De hecho vino del Sur el aguacero.
Llegaste bien?",Thu Jun 02 02:58:04 +0000 2022,Nuevo León,Monterrey,U,-100.29359149999999,25.6417185,1142952
"El aguacero no es un milagro. Junio - agosto es temporada de chubascos, tormentas y hasta huracanes en NL. Pero nad… https://t.co/ROQzFVuPX9",Thu Jun 02 03:09:05 +0000 2022,Nuevo León,Guadalupe,R,-100.196134,25.6766035,28
"@LoQuePasaEnNL Al poniente de la ciudad de MTY una hora un buen aguacero 
Se necesitaba 
Veremos ahora que hace AyD… https://t.co/fkbr0GQqkc",Thu Jun 02 03:54:27 +0000 2022,Nuevo León,Monterrey,U,-100.29359149999999,25.6417185,1142952
@Dibanny_Fz aguacero,Thu Jun 02 11:44:49 +0000 2022,Jalisco,Zapopan,R,-103.48477450000001,20.790657000000003,40
@cartgz ¡Pero ayer cayó un aguacero! ¿No juntaste ni una tinita? https://t.co/m1dPiPjzgW,Thu Jun 02 14:10:53 +0000 2022,Nuevo León,Monterrey,U,-100.29359149999999,25.6417185,1142952
"Azu.. me mojé en el aguacero del martes y ahora tengo ""gdipa"" https://t.co/MPR0PKpK3o",Fri Jun 03 13:33:49 +0000 2022,Oaxaca,Oaxaca de Juárez,R,-96.7250025,17.090319,685
"Si hace sol, un sombrero o manga larga, si cae un aguacero, no importa, a Si el pavimento está 42 grados o hay bach… https://t.co/CIUnTwbC0m",Fri Jun 03 18:32:59 +0000 2022,Chiapas,Tapachula,R,-92.3094495,14.920494999999999,8
Se nos viene el aguacero ☔️⚡️,Mon Jun 06 23:13:28 +0000 2022,Jalisco,Guadalajara,U,-103.335882,20.676651999999997,1385621
Subi un tiktok con la canción de aguacero de bad bunny pero me da mucha pena JAJAJAJA MEJOR LO BORRE,Tue Jun 07 00:04:02 +0000 2022,Nuevo León,Apodaca,R,-100.27047400000001,25.736714999999997,0
Ah pa buen aguacero que se dejó venir,Tue Jun 07 01:43:11 +0000 2022,Jalisco,Guadalajara,U,-103.335882,20.676651999999997,1385621
"@cieloenpicsis Y con el aguacero de hoy , ya te quiero ver con quema cocos",Tue Jun 07 02:41:02 +0000 2022,Jalisco,Zapopan,R,-103.48477450000001,20.790657000000003,40
@adriano_numa Se supone que mañana caerá aguacero,Tue Jun 07 19:56:13 +0000 2022,Ciudad de México,Cuauhtémoc,U,-99.153366,19.432836,545884
"Aguacero y granizo en #Iztapalapa, Ermita y Tlahuac, precauciones!! https://t.co/cQbvaFpnEg",Wed Jun 08 02:03:07 +0000 2022,Ciudad de México,Tlalpan,R,-99.208364,19.199485,86
"Gracias por las rolas vecino, hiciste que las de cocodrilo se volvieran aguacero",Wed Jun 08 04:38:55 +0000 2022,Hidalgo,Santiago Tulantepec de Lugo Guerrero,R,-98.404774,20.0291985,4
"@ChicIeBomba En serio?, A ver muestranoslos para ver si v a ser una llovisnita o un aguacero o si va a ser con true… https://t.co/5ulnoautTy",Wed Jun 08 20:22:35 +0000 2022,México,Zumpango,R,-99.0829075,19.8131445,30
Que buena rola es aguacero de Bad Bunny,Wed Jun 08 22:14:02 +0000 2022,Veracruz de Ignacio de la Llave,Veracruz,R,-96.22939650000001,19.183953,3
@SoyJosefo En Cuernavaca no son raros los aguaceros. 🤭,Thu Jun 09 03:11:50 +0000 2022,Puebla,Cuautlancingo,R,-98.26134149999999,19.1193045,11
Oigan soñé con muchas cascadas 😱... Será por el tremendo aguacero que hubo en la madrugada ?,Thu Jun 09 10:31:02 +0000 2022,Veracruz de Ignacio de la Llave,Veracruz,R,-96.22939650000001,19.183953,3
@MariLoliPellon envío un afectuoso slaudos desde Veracruz Puerto tuvimos fuerte aguacero en la madrugada éxito en s… https://t.co/xChCj4b1Zc,Thu Jun 09 11:02:00 +0000 2022,Veracruz de Ignacio de la Llave,Veracruz,R,-96.22939650000001,19.183953,3
"@bearod_76 Ayer tuve un día de locura y ajetreo en el tráfico, además de un mega aguacero jajaja pero no me disgustó.",Thu Jun 09 14:22:57 +0000 2022,Ciudad de México,Iztacalco,U,-99.09649599999999,19.399101,404695
"Llegué a Xalapa ayer, hoy amanece con un aguacero clásico de Xalapa, es una señal para seguir durmiendo porque… https://t.co/n5WNuRGXkC",Thu Jun 09 16:28:34 +0000 2022,Veracruz de Ignacio de la Llave,Xalapa,R,-96.886083,19.542054,0
"Desde el aguacero de las 8am sin corriente eléctrica, @CFEmx  en sitio,  llevan 3 hrs y no pueden reestablecer….emp… https://t.co/P1d1S5HF9o",Thu Jun 09 17:04:44 +0000 2022,Jalisco,Tlajomulco de Zúñiga,U,-103.356606,20.546459,20465
@Normishka31 Hermana cayo un aguacero terrible y es que vine acá pa donde mi hermana... Hace harto frío!!!,Fri Jun 10 02:25:35 +0000 2022,Ciudad de México,Iztapalapa,U,-99.050461,19.342788499999997,1835486
@loretui @Arachno_Cosas Salen en los primeros aguaceros. Hasta parece ud citadina.,Fri Jun 10 20:40:56 +0000 2022,Ciudad de México,La Magdalena Contreras,U,-99.24800950000001,19.318042,246428
En #nacorichico tamieeen cashyooo un aguacero🙌🙌🙌 alabado sea el señor 🙌 https://t.co/vhRetLSe0X,Sat Jun 11 05:43:43 +0000 2022,Sonora,Hermosillo,R,-111.498181,28.9698625,5
He vuelto a ser aquel cantor del aguacero,Sat Jun 11 10:50:37 +0000 2022,Ciudad de México,Tlalpan,R,-99.208364,19.199485,86
"@MarioBonola @LOVREGA Y todavía más impresionante ""el velo de novia"" cerca de Comitan o  este ""el aguacero"" en el m… https://t.co/9SRP5sBMMN",Sat Jun 11 18:01:51 +0000 2022,Ciudad de México,Coyoacán,U,-99.15234000000001,19.328383000000002,614447
"Recomiéndenme un rizado de pestañas, especial para pestañas de aguacero, que dure . 
#SanLuisPotosi",Sat Jun 11 22:45:28 +0000 2022,San Luis Potosí,San Luis Potosí,R,-100.955511,22.3111195,18
un ratito es mi favorita o aguacero o Andrea pero jamás ojitos lindos e maybe moscow mule,Sun Jun 12 03:00:20 +0000 2022,México,Cuautitlán,U,-99.1634475,19.678076,117995
Tremendo aguacero!!! En el centro de Chilpancingo se está cayendo el cielo 🌧️🌧️⛈️⛈️🌧️🌧️,Sun Jun 12 05:16:54 +0000 2022,Guerrero,Chilpancingo de los Bravo,R,-99.72418149999999,17.3916575,663
Corran porque viene el aguacero en la #CDMX,Sun Jun 12 23:15:59 +0000 2022,Ciudad de México,Cuauhtémoc,U,-99.153366,19.432836,545884
Aguacero magistral en @Alcaldia_Coy pero seguimos #SinGotaDeAgua en la Country Club. Llevamos casi dos meses.… https://t.co/0Bt6Pq1Pks,Sun Jun 12 23:39:43 +0000 2022,Ciudad de México,Coyoacán,U,-99.15234000000001,19.328383000000002,614447
El fin del mundo está cerca #diluvio #Mixcoac #Aguacero,Mon Jun 13 02:24:08 +0000 2022,Ciudad de México,Coyoacán,U,-99.15234000000001,19.328383000000002,614447
"Cortinas de lluvia en el poniente de Mérida. 
Ahora cae un aguacero en la zona de plaza dorada. @ClimaYucatan… https://t.co/2dKcwVLH7A",Mon Jun 13 22:29:27 +0000 2022,Yucatán,Mérida,R,-89.62361100000001,20.941035,0
Vaya aguacero en Guadalajara 😵‍💫,Tue Jun 14 02:48:16 +0000 2022,Jalisco,Guadalajara,U,-103.335882,20.676651999999997,1385621
Perros aguaceros caen en GDL,Tue Jun 14 03:25:52 +0000 2022,Michoacán de Ocampo,Zamora,R,-102.26462249999999,20.0301115,9
Que así sea para todos a la hora del aguacero ☀️🌤⛅️🌦🌧⛈,Tue Jun 14 12:43:07 +0000 2022,Ciudad de México,Iztapalapa,U,-99.050461,19.342788499999997,1835486
@Paarlet Y esta también es … y aquí me tienes buscando un lugar para dos en esté aguacero… 🎤 https://t.co/7DqdE4UY4J,Tue Jun 14 12:43:22 +0000 2022,Nuevo León,Monterrey,U,-100.29359149999999,25.6417185,1142952
"Día lluvioso, gris, música de DLD, lo único que puedo esperar es la hora de salida para empaparme con este aguacero 🤷🏻‍♀️😅",Tue Jun 14 22:38:05 +0000 2022,Puebla,Amozoc,R,-98.1542665,19.0322295,616
Vaya aguacero en puebla,Tue Jun 14 23:16:21 +0000 2022,Puebla,San Andrés Cholula,R,-98.308599,19.022994,246
"Ojalá con ese aguacero,se quiebren los once que están jugando para que no vayan al mundial",Wed Jun 15 01:40:00 +0000 2022,San Luis Potosí,Zaragoza,R,-100.6639345,22.041044,377
Le trajeron mariachi a una vecina con todo y aguacero 🥹,Wed Jun 15 04:51:29 +0000 2022,Veracruz de Ignacio de la Llave,Veracruz,R,-96.22939650000001,19.183953,3
@InfoMeteoro Querétaro antier un fuerte aguacero que ya hacía falta. Ayer sólo viento y nublado pero de nuevo ni un… https://t.co/17sAeYG285,Wed Jun 15 08:01:06 +0000 2022,Querétaro,Corregidora,R,-100.43973100000001,20.478755,2494
"@UniformesSelec1 Se suspendió el juego al medio tiempo por un aguacero, dijeron que regresarían a la selección a Pu… https://t.co/mc7ayPg3pB",Wed Jun 15 16:57:35 +0000 2022,Puebla,Amozoc,R,-98.1542665,19.0322295,616
Tremendo aguacero se avecina en el Valle de #Iguala https://t.co/WrPMsK8LU9,Wed Jun 15 22:15:29 +0000 2022,Guerrero,Tepecoacuilco de Trujano,R,-99.572036,18.188380000000002,381
Chulo aguacero en la Roma Norte,Wed Jun 15 23:41:42 +0000 2022,Ciudad de México,Cuauhtémoc,U,-99.153366,19.432836,545884
Tarde de chismecito y café en la #Guerrero con todo y aguacero nos echamos una buena platicada y quedamos en seguir… https://t.co/Fa8u4gM4yj,Thu Jun 16 02:53:34 +0000 2022,Ciudad de México,Cuauhtémoc,U,-99.153366,19.432836,545884
"@erickvazdel @dtrejo3 Gracias, Erick! Aunque con este aguacero no se puede ir a ningún lado 😂 Haremos camping en cabina.",Thu Jun 16 05:47:20 +0000 2022,Jalisco,Zapopan,R,-103.48477450000001,20.790657000000003,40
Nos despierta un repentino silbido del viento y detrás un aguacero. Me levante a cerrar ventanas y ahora sin poder… https://t.co/gyNvv2HjpC,Thu Jun 16 09:34:36 +0000 2022,Veracruz de Ignacio de la Llave,Xalapa,R,-96.886083,19.542054,0
"@rataenbici Que chido Nic! Muchas felicidades! Cayó un mega aguacero en nuestros terruños así que con cuidado, exce… https://t.co/XHqzfWE2fJ",Fri Jun 17 12:50:27 +0000 2022,México,Cuautitlán Izcalli,R,-99.233657,19.6562895,6730
Viene un aguacero,Fri Jun 17 18:49:15 +0000 2022,Campeche,Campeche,R,-90.27714,19.601414,0
@ErikaAraujoMX zona de xola tremendo aguacero... Hasta aquí mi reporte porque me estoy mojando 👀😁😁😁😁 https://t.co/bjAbAWYFaD,Fri Jun 17 23:11:03 +0000 2022,Ciudad de México,Benito Juárez,U,-99.1614805,19.380613,434153
la cara de ahuevado por quedarme varado en un krispy kreme en medio de un aguacero no me la quita nadie… https://t.co/yDYEJ2XbwL,Fri Jun 17 23:35:14 +0000 2022,Ciudad de México,Cuauhtémoc,U,-99.153366,19.432836,545884
"@Israelsv74 Y será un aguacero muy fuerte.
Hasta mañana Isra. https://t.co/cVfnHKxeYF",Fri Jun 17 23:44:22 +0000 2022,Ciudad de México,Miguel Hidalgo,U,-99.2115105,19.4299345,414470
"En medio de tremendo aguacero en el paradero de CU, un don chófer empapado llega con su compi...

-Esta bien, compa… https://t.co/HD1d2uQgdK",Fri Jun 17 23:47:55 +0000 2022,Ciudad de México,Coyoacán,U,-99.15234000000001,19.328383000000002,614447
"Así quede porque olvide mis llaves en la oficina, me di cuenta en medio del aguacero y tuve que regresar por ellas https://t.co/56kW0ABZVP",Sat Jun 18 00:47:33 +0000 2022,México,Tlalnepantla de Baz,U,-99.1158905,19.518656,13030
"Se vienen aguaceros por ‘Celia’: creará temporal de lluvias en 8 estados. Incluyendo #Oaxaca 
@p360mx @CEPCO_GobOax… https://t.co/S02M2kMrx1",Sat Jun 18 03:39:44 +0000 2022,Oaxaca,Santa Cruz Amilpas,U,-96.6754285,17.055128500000002,13200
@ClimaYucatan Chetumal desde las 10 am esta llueve qué llueve. No cesa el aguacero . https://t.co/4tAy4PIszd,Sat Jun 18 18:46:55 +0000 2022,Quintana Roo,Othón P. Blanco,R,-88.3857435,18.5934905,0
Atrapada en el súper con el perro aguacero que se dejó venir y se me ocurre la grandiosa idea de traerme el coche🥹🫠,Sat Jun 18 20:07:16 +0000 2022,Veracruz de Ignacio de la Llave,Xalapa,R,-96.886083,19.542054,0
Ni idea de que evento habrá en la Plaza de Toros.. pero pobres de los asistentes les está cayendo un mega aguacero 🥺,Sun Jun 19 02:01:37 +0000 2022,Ciudad de México,Benito Juárez,U,-99.1614805,19.380613,434153
A dices metros de la puerta para meterme y no puedo por el aguacero,Sun Jun 19 07:17:08 +0000 2022,Veracruz de Ignacio de la Llave,Lerdo de Tejada,R,-95.498013,18.6588695,5
Se soltó el aguacero en Álamos 🌧️ https://t.co/jh4g9Asz15,Mon Jun 20 02:22:33 +0000 2022,Sonora,Hermosillo,R,-111.498181,28.9698625,5
"Como un par de niños como un aguacero, pero no te vayas porque yo me muero….",Mon Jun 20 03:43:47 +0000 2022,Tabasco,Nacajuca,R,-92.9447745,18.175748,531
Se complica la cosecha de hoy con los aguaceros pronosticados @huertasmagana en Huertas Magaña https://t.co/P1lpFBfKqX,Mon Jun 20 17:43:19 +0000 2022,Yucatán,Tekax,R,-89.34091550000001,20.2609245,0
@Olivareslucia Hola se via que iba  llegar un gran aguacero  pero no fue tanta lluvia  pero  si sesintio  más agrad… https://t.co/cHmsCsBP1M,Mon Jun 20 18:08:44 +0000 2022,Durango,Gómez Palacio,R,-103.50417999999999,25.711095,3
"Es que está el aguacero, tremendo ⛈️⛈️",Tue Jun 21 02:52:59 +0000 2022,Tabasco,Nacajuca,R,-92.9164995,18.0219595,432
"@The_Master85 Es que envidiosa pupitres aquí tenemos todas la semana con aguaceros de Dios Padre
Ya se volvió a rec… https://t.co/wchLeVIbku",Tue Jun 21 03:08:39 +0000 2022,México,Tecámac,R,-98.9903395,19.7051795,531
"Increíble que todo se inunde con cualquier aguacero. Pero más increíble que todos callen en silencio cómplice. 
Obr… https://t.co/QU4ct1AIZo",Tue Jun 21 06:17:31 +0000 2022,Tabasco,Nacajuca,R,-92.9164995,18.0219595,432
"@unpunktual Aguacero perron en Huixquilucan Palo solo 
Hasta aquí mi reporte",Tue Jun 21 22:54:04 +0000 2022,México,Huixquilucan,R,-99.3184285,19.3740755,142
"Parece que nada más va a caer el aguacero con granizo aquí.
#granizo 
#aguacerazo en Ocotepec, Morelos, Mexico https://t.co/arM9Rn0z6i",Tue Jun 21 23:30:01 +0000 2022,Morelos,Cuernavaca,R,-99.260819,18.933812,78
@Leto2405 ¿Y cayó un buen aguacero?,Tue Jun 21 23:32:29 +0000 2022,Oaxaca,Zapotitlán Palmas,R,-97.81145750000002,17.8777445,208
"Que onda con el aguacero no mamen 
#tlatelolco #cdmx #lluvia https://t.co/hKjgYwTpgb",Tue Jun 21 23:43:07 +0000 2022,Ciudad de México,Cuauhtémoc,U,-99.147726,19.455684,545884
@_priscilalara Quizás aguacero,Wed Jun 22 00:17:22 +0000 2022,Nuevo León,Monterrey,U,-100.29359149999999,25.6417185,1142952
@_priscilalara Seguro aguacero,Wed Jun 22 01:14:56 +0000 2022,Nuevo León,Monterrey,U,-100.29359149999999,25.6417185,1142952
"@samuel_garcias manda cerrar las compuertas de las presas, ahí viene el aguacero, no se vayan a apendejar otra vez,… https://t.co/7Vln1Ke3fN",Wed Jun 22 01:18:33 +0000 2022,Nuevo León,Guadalupe,R,-100.26914,25.608018,0
Milagro!!!! Agua en Monterrey 🌧🌧🌦⁦@nelvaldez⁩ ⁦@abimaelsalas⁩ aguacero en ⁦@parquefundidora⁩ 21:48 horas https://t.co/tjUS24pJz5,Wed Jun 22 02:48:36 +0000 2022,Nuevo León,Monterrey,U,-100.284078,25.677584,1142952
@Monicao2712 Ya lo decía Chava Flores los aguaceros tuvieron la culpa..,Wed Jun 22 05:27:09 +0000 2022,Baja California,Mexicali,R,-115.22918000000001,31.789669500000002,19
esta noche esta para escuchar aguacero de Benito ❤️,Wed Jun 22 07:35:30 +0000 2022,Veracruz de Ignacio de la Llave,Xalapa,R,-96.886083,19.542054,0
"¡Días por qué bueno el aguacero que se avecina!

#FelizMiercoles",Wed Jun 22 12:22:08 +0000 2022,México,Metepec,U,-99.5799145,19.2515305,11001
Me cayeron como aguacero de mayo los ingresos pkm :(,Wed Jun 22 15:02:19 +0000 2022,Veracruz de Ignacio de la Llave,Orizaba,R,-97.112844,18.856709,61
"Quiero hacer el trend de tiktok con la canción de""aguacero"" pero no sé si sea muy maestra miel de mi part jakakaja",Wed Jun 22 17:27:33 +0000 2022,Veracruz de Ignacio de la Llave,Xalapa,R,-96.886083,19.542054,0
El aguacero es de 100,Wed Jun 22 18:44:16 +0000 2022,Nuevo León,Monterrey,U,-100.29359149999999,25.6417185,1142952
"@Jess_Tegui Somos amix, salí del examen y me tocó el aguacero me acordé de alguien 🫤",Sat Jun 25 02:20:02 +0000 2022,Ciudad de México,Miguel Hidalgo,U,-99.2115105,19.4299345,414470
"Ayer tacos 🌮 
Hoy  ☕️  @BaileysConCafe 

Después de un aguacero con granizo https://t.co/Cvv6aaH51X",Sat Jun 25 02:57:41 +0000 2022,Hidalgo,Tepeji del Río de Ocampo,U,-99.340954,19.90519,36618
no me puedo ni salir del carro😭😨 mendigo aguacero #lluvia con #granizo https://t.co/DOQ1CJwCRi,Sun Jun 26 00:29:20 +0000 2022,Ciudad de México,Iztacalco,U,-99.09649599999999,19.399101,404695
¿Es culpa del #Pride2022 el aguacero de esta noche? 🤔🤔🤔🤔,Sun Jun 26 02:20:51 +0000 2022,México,Tlalnepantla de Baz,U,-99.1158905,19.518656,13030
te amo aguacero de bad bunny pinche canción espectacular,Sun Jun 26 06:32:23 +0000 2022,Chiapas,Tuxtla Gutiérrez,U,-93.13965950000001,16.7424355,578830
"Imágenes del aguacero de ayer sábado por la noche en pleno concierto de la Marcha Orgullo LGBTTTI 2022.
✍️:… https://t.co/2n8O2jcd4q",Sun Jun 26 23:32:01 +0000 2022,Ciudad de México,Benito Juárez,U,-99.1614805,19.380613,434153
Solo me faltaba este hermoso aguacero para mimir mendigo.,Mon Jun 27 07:39:04 +0000 2022,Veracruz de Ignacio de la Llave,Boca del Río,U,-96.0989905,19.1431005,132011
"Yo quiero que alguien me diga cómo Bad Bunny en aguacero
""Pero si tú quieres, cuando sea soy tu esposo"".",Mon Jun 27 19:35:09 +0000 2022,Ciudad de México,Iztapalapa,U,-99.050461,19.342788499999997,1835486
"¡Aguacero! (@ Cherch Home in Mexico, Distrito Federal) https://t.co/zTEkS3AkEN",Tue Jun 28 04:16:56 +0000 2022,Ciudad de México,La Magdalena Contreras,U,-99.24800950000001,19.318042,246428
"Antes de que me agarrara el aguacero, pude tomar esta foto la gama de colores se veía mas chida en la realidad.
Ata… https://t.co/eUNmaOcUk0",Tue Jun 28 05:12:43 +0000 2022,Sinaloa,Culiacán,R,-107.3420565,24.6624885,0
MTY ya deja caer un aguacero plis 🌬🌩 https://t.co/piqhXR8MS0,Tue Jun 28 20:45:37 +0000 2022,Nuevo León,Apodaca,R,-100.1687175,25.778679,1879
Con el aguacero que está cayendo allá afuera me acabo de dar cuenta que no tengo un paraguas en mi departamento 😰,Tue Jun 28 21:14:01 +0000 2022,Ciudad de México,Benito Juárez,U,-99.1614805,19.380613,434153
"De volada, aunque me agarró el aguacero mamón (at @SuperamaMx in Iztapalapa, DF) https://t.co/1Y1QnDLGCP",Tue Jun 28 21:14:32 +0000 2022,Ciudad de México,Iztapalapa,U,-99.050461,19.342788499999997,1835486
"En lo que pasa el fokin aguacero (@ Starbucks in Iztapalapa, DF) https://t.co/urlgfd4ayO",Tue Jun 28 21:15:03 +0000 2022,Ciudad de México,Iztapalapa,U,-99.050461,19.342788499999997,1835486
Que rico aguacero en Xalapa! 🤗 ojalá no haya colonias o avenidas afectadas por esta lluvia! 😖😖,Tue Jun 28 21:37:58 +0000 2022,Veracruz de Ignacio de la Llave,Xalapa,R,-96.886083,19.542054,0
por fin un buen aguacero,Wed Jun 29 05:33:03 +0000 2022,Nuevo León,San Pedro Garza García,R,-100.366033,25.650287499999997,2
"En México aguacero.

En Mty agua-cero.",Wed Jun 29 07:10:24 +0000 2022,Ciudad de México,Benito Juárez,U,-99.1614805,19.380613,434153
"Hagamos un poema, con tu piel y mis labios, con la brisa de Noviembre y los aguaceros de Junio.

#Miercoles… https://t.co/ESDYtu8x87",Wed Jun 29 17:38:28 +0000 2022,Veracruz de Ignacio de la Llave,Acayucan,R,-95.053988,18.0279365,6
"@jgnaredo Neta... Tanto te interesa burlarte de ese tema, que no te has enterado del aguacero nocturno...

Caray, s… https://t.co/UhD8DaJ8Fg",Thu Jun 30 04:21:10 +0000 2022,Nuevo León,Monterrey,U,-100.29359149999999,25.6417185,1142952
@El_Mulix @ClimaYucatan Te salvaste del aguacero! Llegaste a quitar la ropa?,Thu Jun 30 23:06:21 +0000 2022,Yucatán,Mérida,R,-89.62361100000001,20.941035,0
@davidfaz Julio sorprendemos con aguaceros ☔🌧️,Fri Jul 01 13:17:10 +0000 2022,Nuevo León,Apodaca,R,-100.27047400000001,25.736714999999997,0
"Santos aguaceros, Claudia!!!",Fri Jul 01 23:17:24 +0000 2022,Ciudad de México,Miguel Hidalgo,U,-99.2115105,19.4299345,414470
"Qué curiosito el zanate que se está dando chapuzones en la alberquita que se formó después del aguacero, vedá? 🙇🏻‍♂️ https://t.co/rRIqk90rq6",Sat Jul 02 01:12:59 +0000 2022,Ciudad de México,Azcapotzalco,U,-99.196958,19.447936,432205
"Amonos que aquí espantan jajaja...

Nocierto me faltan 15 minutos, pinche aguacero de la tarde por poco no llego 🫢 https://t.co/mtsZbku6lw",Sat Jul 02 02:47:03 +0000 2022,Ciudad de México,Álvaro Obregón,U,-99.161671,19.395796,759003
"Desde que salió Aguacero de Bad Bunny me dijo que había pensando en nosotros, obvio él es piscis, así que lit nuest… https://t.co/7Vul0F1uXT",Sat Jul 02 07:03:24 +0000 2022,Jalisco,Zapopan,R,-103.48477450000001,20.790657000000003,40
Tremendo aguacero https://t.co/Ghl99p9mt5,Sun Jul 03 00:13:18 +0000 2022,México,Almoloya de Juárez,R,-99.82745249999999,19.397225499999998,323
"¡Vaya aguacero en el sur de la CDMX! Manejen con cuidado, neta de Perisur a Constituyentes me tocó una de esas lluvias mamalonas.",Sun Jul 03 04:47:01 +0000 2022,Ciudad de México,Miguel Hidalgo,U,-99.2115105,19.4299345,414470
