Tweet,Fecha,Estado,Locacion,Tipo,Longitud,Latitud,Poblacion
@ClimaYucatan En komchen viene el aguacero https://t.co/b3rr2O3Kd8,Fri Aug 28 20:36:00 +0000 2020,Yucatán,Mérida,R,-89.662777,21.103843,0
@ClimaYucatan Tremendo aguacero zona norte,Fri Aug 28 20:47:41 +0000 2020,Yucatán,Mérida,R,-89.62361100000001,20.941035,0
"Detenido el @MazatlanFC vs @TigresOficial , está cayendo un aguacero en el Puerto Mazatleco. Aquí se verá qué tan b… https://t.co/KyScB4Dei2",Sat Aug 29 02:33:06 +0000 2020,Jalisco,Guadalajara,U,-103.335882,20.676651999999997,1385621
"Precaución fuerte aguacero sobre algunas zonas de León, Guanajuato, @Proteccion_leon @ELPODERNOTICIAS… https://t.co/FyigrngH8Z",Sat Aug 29 03:53:41 +0000 2020,Guanajuato,León,R,-101.601401,21.09806,3
"Aprender a los 45 a disfrutar dormir con el sonido de la lluvia... hasta cuando son mega aguaceros, en… https://t.co/PVXcuTDGsW",Sat Aug 29 06:52:26 +0000 2020,Morelos,Xochitepec,R,-99.201801,18.782704,15
"Cascada El Aguacero en Chiapas.

#Chiapas #México #Turismo #TuriMexico #YoMeQuedoEnCasa #QuedateenCasa 

Foto:… https://t.co/3DNKKIvdha",Sat Aug 29 18:25:54 +0000 2020,Chiapas,Jiquipilas,R,-93.702145,16.571945499999998,8
"Buenos días Mexico.

Después del mega aguacero de ayer en Tierra Santa, vamonos a correr.

 🏃‍♂️",Sun Aug 30 12:18:59 +0000 2020,México,Cuautitlán Izcalli,R,-99.233657,19.6562895,6730
@tere_alcantarav La primera foto de la nube ☁ fue 10 min. antes del aguacero,Sun Aug 30 19:52:28 +0000 2020,Querétaro,Querétaro,R,-100.4405945,20.7152745,9
"@Pablo15Victoria @Dorados @CimarronesFC Recuerdo un juego ante la filial del santos , el sábado cayó un aguacero y… https://t.co/2ibogx0DTI",Mon Aug 31 00:38:54 +0000 2020,Sinaloa,Culiacán,R,-107.3420565,24.6624885,0
"⚡️ #Hidalgo | Tras aguacero así luce el bulevar #Tula - Iturbe, también se reportan afectaciones en la Plaza del Ta… https://t.co/VToLUaOX7z",Mon Aug 31 00:46:33 +0000 2020,Hidalgo,Tula de Allende,R,-99.384564,20.0567145,888
"⚡️ #Hidalgo | Bomberos atendieron incidencias tras aguacero en #Tula

Aquí la información 👇

https://t.co/KwqiFVtXo3",Mon Aug 31 02:19:18 +0000 2020,Hidalgo,Tula de Allende,R,-99.384564,20.0567145,888
"Ayer regresando a casa cayó un aguacero, mi amigo me dio su sombrilla, él quedó empapado. Y hoy amanecio bien enfermo, me siento culpable.",Mon Aug 31 05:30:29 +0000 2020,Hidalgo,Tizayuca,U,-98.9642575,19.8533755,2926
"Tu recuerdo sigue aquí, como un aguacero.",Mon Aug 31 19:52:41 +0000 2020,Oaxaca,Oaxaca de Juárez,R,-96.7250025,17.090319,685
"Ojalá que llueva café ☕ en campo, que caiga un aguacero de... en Mezcala, Jalisco https://t.co/yXloRWJfmX",Tue Sep 01 01:22:37 +0000 2020,Jalisco,Poncitlán,R,-102.896122,20.264175,0
Me acaba de agarrar un aguacero...! Pero marca diablo!!! Malditenceeeeeen! 😫,Tue Sep 01 02:28:25 +0000 2020,Querétaro,El Marqués,R,-100.2783405,20.7456405,14
Comienza septiembre con fuerte aguacero y granizadas en la sierra de Durango. Favor de confirmar si septiembre es e… https://t.co/sRDNrLJrI3,Tue Sep 01 15:25:31 +0000 2020,Durango,Durango,R,-104.83757800000001,23.954162500000002,0
Les comparto unas pics de ayer que andábamos de callejeros después del aguacero... https://t.co/jOFSVMWLK6,Wed Sep 02 18:44:46 +0000 2020,Durango,Durango,R,-104.83757800000001,23.954162500000002,0
¿Valdrá la pena maquillarme hoy? Naaa... Solamente le daré amor s mis pestañas (las tengo de aguacero),Wed Sep 02 20:44:20 +0000 2020,México,Jilotepec,R,-99.585473,20.019439,1408
"@MemoCalderonS En el 23097 me agarró el aguacero de salida pero en el 23010 soleado, así que me quedé sin pretexto… https://t.co/UYfqxbEwnS",Thu Sep 03 00:18:57 +0000 2020,Baja California Sur,La Paz,R,-110.8545845,24.107996999999997,0
"El cielo truena y el aguacero se presento, todos dicen que el agua la trajiste tu.",Thu Sep 03 03:35:32 +0000 2020,Sinaloa,Guasave,R,-108.5232665,25.501625500000003,25
@spcver Antes del aguacero en Veracruz https://t.co/v2wzOSDmQi,Fri Sep 04 17:47:07 +0000 2020,Veracruz de Ignacio de la Llave,Veracruz,R,-96.22939650000001,19.183953,3
"@randeles Buena granizada y fuerte aguacero Real del Mequital, Valle del Mezquital y todos esos rumbos",Fri Sep 04 20:41:21 +0000 2020,Durango,Durango,R,-104.83757800000001,23.954162500000002,0
"@CarlosGarzaSala Igualmente mi buen Carlos bonita tarde, bonito aguacero pura agua Bendita gracias a dios que nos la envió",Fri Sep 04 20:48:29 +0000 2020,Durango,Durango,R,-104.83757800000001,23.954162500000002,0
Fuertes chubascos o aguaceros en sectore en este atardecer en #Mty https://t.co/vYH9zo2J9x,Sat Sep 05 00:37:56 +0000 2020,Nuevo León,Apodaca,R,-100.27047400000001,25.736714999999997,0
@AmaroGemm Ya llegó el aguacero 🙌🏽,Sat Sep 05 18:26:14 +0000 2020,Tamaulipas,Victoria,R,-99.187904,23.685934,0
"Paseíto y que nos cae el aguacero....
#ZonaHotelera #Cancún https://t.co/Xw3b0CVKmw",Sat Sep 05 21:42:01 +0000 2020,Quintana Roo,Puerto Morelos,R,-87.0316645,21.048719,0
"@IvnPineda En días pasados sólo se nubla muchísimo, pero no más no cae el aguacero",Sun Sep 06 20:32:54 +0000 2020,Ciudad de México,Coyoacán,U,-99.15234000000001,19.328383000000002,614447
Me agarró el aguacero,Mon Sep 07 00:40:01 +0000 2020,Durango,Durango,R,-104.83757800000001,23.954162500000002,0
"buenas noches 
Fresca la noche después del aguacero",Mon Sep 07 05:11:50 +0000 2020,Sinaloa,Ahome,R,-109.1037265,25.921946500000004,308
"Después del aguacero... 
Más lluvia??? en Progreso Macuiltepetl, Xalapa-Enríquez https://t.co/7IsST4Rfx6",Mon Sep 07 17:03:33 +0000 2020,Veracruz de Ignacio de la Llave,Xalapa,R,-96.886083,19.542054,0
"@interestelar66 !A mojarte en aguacero!
!A bailar en la calle! 💜 🌹",Mon Sep 07 18:41:11 +0000 2020,Ciudad de México,Cuauhtémoc,U,-99.153366,19.432836,545884
Tiempo que no me agarraba un aguacero en el centro. en Iguala de la Independencia https://t.co/Vht7GQvggz,Tue Sep 08 01:27:49 +0000 2020,Guerrero,Tepecoacuilco de Trujano,R,-99.572036,18.188380000000002,381
Wtf? Me perdí de un mega aguacero en el centro o porque tanta calle inundada?,Tue Sep 08 21:09:33 +0000 2020,Baja California Sur,La Paz,R,-110.8545845,24.107996999999997,0
Y que se suelta el aguacero! 👨🏻☔️⛈,Tue Sep 08 22:24:44 +0000 2020,San Luis Potosí,San Luis Potosí,R,-100.955511,22.3111195,18
"⚡️ #Hidalgo | Encharcamientos y caída de árbol tras aguacero en #Tula

Aquí la información 👇

https://t.co/YQr6YhfSWU",Wed Sep 09 01:33:51 +0000 2020,Hidalgo,Tula de Allende,R,-99.384564,20.0567145,888
Esta cayendo un aguacero por Maravillas. En el segundo tiempo se quita.,Wed Sep 09 02:10:06 +0000 2020,Puebla,Coronango,U,-98.28600399999999,19.133485999999998,15943
Ojalá se suelte un aguacero,Wed Sep 09 13:28:00 +0000 2020,Sonora,Hermosillo,R,-111.498181,28.9698625,5
Tremendo aguacero el que me tocó de mi pueblo a Cárdenas 😰 Nula visibilidad en un buen tramo de la carretera 🥺,Wed Sep 09 22:36:16 +0000 2020,Tabasco,Cárdenas,R,-93.70619099999999,18.163317,815
"Cae un chulo aguacero sobre la zona conurbada y no solo es agua, no! También caen rayos. https://t.co/JBOzQPhOl2",Thu Sep 10 10:02:45 +0000 2020,Veracruz de Ignacio de la Llave,Boca del Río,U,-96.0989905,19.1431005,132011
Tremendo aguacero en #cdmx ⛈⛈⛈,Thu Sep 10 10:17:33 +0000 2020,Ciudad de México,Coyoacán,U,-99.15234000000001,19.328383000000002,614447
"Aguacero madrugador! 
Buenos días.",Thu Sep 10 11:45:56 +0000 2020,Ciudad de México,La Magdalena Contreras,U,-99.24800950000001,19.318042,246428
"Senos vino el aguacero, amicses.",Thu Sep 10 21:45:59 +0000 2020,Ciudad de México,Miguel Hidalgo,U,-99.2115105,19.4299345,414470
Señor Aguacero en CDMX https://t.co/7hVbZjuWw0,Thu Sep 10 21:55:03 +0000 2020,Ciudad de México,Iztacalco,U,-99.09649599999999,19.399101,404695
"🎶Hoy que ya tengo impermeable, sombrero y paraguas, no encuentro tu amor. Los aguaceros de Mayo, tuvieron la culpa… https://t.co/GrcooftJgt",Thu Sep 10 21:58:16 +0000 2020,Ciudad de México,Cuauhtémoc,U,-99.153366,19.432836,545884
"🎶Hoy que veo llorar al cielo, yo lo acompaño en su llanto. Me acuerdo los aguaceros, cuando yo te quise tanto. ¡Caray, que sufrir!🎶",Thu Sep 10 22:01:26 +0000 2020,Ciudad de México,Cuauhtémoc,U,-99.153366,19.432836,545884
"El aguacero provocó encharcamientos en la calle de #Sullivan, frente al parque del arte, en la #CDMX y un vecino tu… https://t.co/eExeGhZiCk",Thu Sep 10 22:59:06 +0000 2020,Ciudad de México,Cuauhtémoc,U,-99.153366,19.432836,545884
@SCT_Puebla R-76 U-71 NO FINALIZA SU RECORRIDO Y NOS BAJA EN PLENO AGUACERO! Y RESULTA QUE SI LLEGO A SU BASÉ 😠OJAL… https://t.co/VdRrqmT43z,Fri Sep 11 01:01:41 +0000 2020,Puebla,Amozoc,R,-98.1542665,19.0322295,616
No mamen con el aguacero!! Se va a inundar #Durango,Fri Sep 11 04:53:14 +0000 2020,Durango,Durango,R,-104.83757800000001,23.954162500000002,0
Se dejó venir el aguacero,Fri Sep 11 05:55:19 +0000 2020,Veracruz de Ignacio de la Llave,Coatzacoalcos,U,-94.43248200000001,18.135455,212540
"Mala noche para tener insomnio, cae un aguacero se va el internet y yo con el ojo pelón y en 4 hrs tengo una clase que dar 🙃",Fri Sep 11 08:25:13 +0000 2020,Sinaloa,Mazatlán,R,-106.2717475,23.46814,0
Se soltó el aguacero! https://t.co/wit9JmGUOt,Fri Sep 11 08:32:53 +0000 2020,Sinaloa,Mazatlán,R,-106.2717475,23.46814,0
11/9 Yo estaba en la prepa 7 oriente nos dieron la salida por el aguacero llege a casa y estaba mi mamá viendo a Ra… https://t.co/gWVHWSTik5,Fri Sep 11 13:55:55 +0000 2020,Nuevo León,Apodaca,R,-100.27047400000001,25.736714999999997,0
"El 9/11 fue el dia del aguacero, no pude ir a la oficina y estaba hablango con Don Rober por telefono acerca del pr… https://t.co/pz3tDhnuB7",Sat Sep 12 07:10:39 +0000 2020,Nuevo León,Guadalupe,R,-100.196134,25.6766035,28
"#PoesiaFrancese #SalaLettura @SalaLettura 
Cuando fijas los ojos yo no sé si tú mientes
Parece un aguacero que abre… https://t.co/NP04TM55y9",Sat Sep 12 13:39:54 +0000 2020,Ciudad de México,Iztapalapa,U,-99.050461,19.342788499999997,1835486
@CFE_Contigo favor de atender apagon por aguacero en calle nicolas bravo entre abasolo y allende. Col Gonzalo bautista c.p. 72350,Sun Sep 13 01:19:01 +0000 2020,Puebla,Amozoc,R,-98.1542665,19.0322295,616
Buen aguacero,Sun Sep 13 03:04:15 +0000 2020,Puebla,Amozoc,R,-98.1542665,19.0322295,616
"Se inunda la Gran Bodega de Chapultepec, con el aguacero de este sábado https://t.co/xgto5emaOp",Sun Sep 13 03:08:34 +0000 2020,Puebla,Amozoc,R,-98.1542665,19.0322295,616
Hoy quería salir a correr y se viene el aguacero.,Mon Sep 14 19:28:39 +0000 2020,Nuevo León,Monterrey,U,-100.29359149999999,25.6417185,1142952
@LIZBL1 @MemoCalderonS Es que me agarró el aguacero fuerte del Centro a Las Garzas. Ya me veía rumbo a mi casa llam… https://t.co/2baygeG62V,Mon Sep 14 22:35:43 +0000 2020,Baja California Sur,La Paz,R,-110.8545845,24.107996999999997,0
"Tormentón en #Tapachula, es normal los aguaceros fuertes en la ciudad, pero el viento uffff! @ChaacTlaloc",Tue Sep 15 01:08:10 +0000 2020,Chiapas,Tapachula,R,-92.3094495,14.920494999999999,8
"Tlaloc, preocupado por los idiotas llamados mexicanos, nos envia un aguacero para mantenernos en nuestras casitas.",Wed Sep 16 00:34:31 +0000 2020,Ciudad de México,La Magdalena Contreras,R,-99.26452649999999,19.2755645,10
"Bajo torrencial aguacero, @sergio17flores en el festival de Apizaco https://t.co/yvwDKCN1lu",Wed Sep 16 20:26:07 +0000 2020,Tlaxcala,Yauhquemehcan,U,-98.169534,19.4169935,10139
"Estos sí son aguaceros chilangos, así.",Wed Sep 16 23:50:17 +0000 2020,Ciudad de México,Benito Juárez,U,-99.1614805,19.380613,434153
Dios @SoyTlaloc ya deja la fiesta lleva dos días cayendo tremendo aguaceros con sus respectivos relámpagos y truenos. Da miedo!!!!,Thu Sep 17 00:13:05 +0000 2020,Ciudad de México,Benito Juárez,U,-99.1614805,19.380613,434153
Que aguacero me agarro. https://t.co/Vdcu5MfSe1,Thu Sep 17 00:51:00 +0000 2020,México,Valle de Bravo,R,-100.1125095,19.1713575,227
"Coger es rico, pero hacerlo mientras afuera cae un aguacero es otro pedo. 🤭",Thu Sep 17 03:04:59 +0000 2020,Ciudad de México,Benito Juárez,U,-99.1614805,19.380613,434153
"@roblesmaloof Hace años (25 o 30), las estaciones estaban muy bien definidas, los aguaceros, muy puntuales, eran ca… https://t.co/oSgWhjXS4M",Thu Sep 17 16:49:16 +0000 2020,México,Nezahualcóyotl,R,-99.087817,19.4320755,0
"El aguacero de los días pasados acabó con el hermoso huevito en San Miguel Chapultepec, Miguel Hidalgo https://t.co/k705yMMF2f",Fri Sep 18 04:21:53 +0000 2020,Ciudad de México,Miguel Hidalgo,U,-99.2115105,19.4299345,414470
"Yo no quiero Paris sin aguacero, ni Venecia sin ti NG...",Fri Sep 18 04:50:35 +0000 2020,Puebla,Zacatlán,R,-98.019571,19.9617935,332
Ya se dejo caer el aguacero.....,Fri Sep 18 05:45:42 +0000 2020,Tabasco,Nacajuca,R,-92.9164995,18.0219595,432
@InfoMeteoro El lunes en la noche cayó un aguacero,Fri Sep 18 19:03:35 +0000 2020,Coahuila de Zaragoza,Monclova,R,-101.220857,26.878203499999998,0
"@DIVALUSTAR @Ikaros57 No aguantarán ni el primer aguacero en el Zócalo, de esos que caen profusamente",Sat Sep 19 19:28:08 +0000 2020,Ciudad de México,Coyoacán,U,-99.1525965,19.3206955,614447
"Jajajaja fallido movimiento del @OficialFrenaaa
Al primer aguacero van a salir corriendo como ratas que son. No sab… https://t.co/vQpwetEimx",Sat Sep 19 20:32:57 +0000 2020,Aguascalientes,Aguascalientes,R,-102.327207,21.849459000000003,0
@jairocalixto Ojalá carga un aguacero,Sun Sep 20 03:08:45 +0000 2020,Ciudad de México,Tlalpan,R,-99.208364,19.199485,86
Donde estarás @Hipolito_Rguez en este mega aguacero que esta callendo en la capital veracruzana. Las colonias se in… https://t.co/dGeJwHX0hJ,Mon Sep 21 00:12:57 +0000 2020,Veracruz de Ignacio de la Llave,Xalapa,R,-96.886083,19.542054,0
Pues el líder Gilberto ya se fué y las señoras de Polanco no creo que estén aguantando el aguacero.,Mon Sep 21 00:27:53 +0000 2020,Ciudad de México,Azcapotzalco,U,-99.18212600000001,19.4857835,432205
"Piden un buen Aguacero
Con granizo
Y vientos huracanados
Y un frío por la noche
A Rompe madres",Mon Sep 21 00:58:20 +0000 2020,México,Ecatepec de Morelos,R,-99.0444445,19.56828,615
"🚨¡Así el aguacero  en #Puebla!⛈🌧
Colapsa coladera en bulevar 5 de mayo a la altura de San Francisco 

🚧¡Conduzca co… https://t.co/ofG2cGCa1d",Mon Sep 21 01:19:09 +0000 2020,Puebla,Amozoc,R,-98.1542665,19.0322295,616
Qué onda con el aguacero??...,Mon Sep 21 01:29:23 +0000 2020,Sonora,Hermosillo,R,-111.498181,28.9698625,5
@julioastillero @CamMttz @OficialFrenaaa Con ese aguacero chaira ni modo que durmieran nadando.,Mon Sep 21 12:00:43 +0000 2020,Querétaro,Querétaro,R,-100.4405945,20.7152745,9
Cielo entre aguaceros en #xalapa @ Gerardo Bonilla Fotografía https://t.co/x4pgaLjSsa,Mon Sep 21 16:34:26 +0000 2020,Veracruz de Ignacio de la Llave,Xalapa,R,-96.886083,19.542054,0
"Qué hacer si cae un aguacero mientras manejas: Si un aguacero te tomó por sorpresa durante el camino, ten en cuenta… https://t.co/DPeKx4njty",Mon Sep 21 19:49:11 +0000 2020,Ciudad de México,Benito Juárez,U,-99.1614805,19.380613,434153
Dominguito a gusto!! en Cascada el Aguacero (Centro Ecoturistico) https://t.co/qQt1t2QS7J,Mon Sep 21 20:34:52 +0000 2020,Chiapas,Jiquipilas,R,-93.702145,16.571945499999998,8
Precaución fuerte aguacero sobre León @Proteccion_leon @ELPODERNOTICIAS @pequeezquerrall https://t.co/6Brfe4KV1J,Mon Sep 21 22:54:45 +0000 2020,Jalisco,Guadalajara,U,-103.335882,20.676651999999997,1385621
".. CHE... Aguacero ya hasta cerraron las vialidades inferiores del Malecón porque el río 

@Jen_m6 @Antoniorochape… https://t.co/RkfS0b0d0Z",Mon Sep 21 23:06:46 +0000 2020,Guanajuato,León,R,-101.601401,21.09806,3
"@UnaNutria La Flor del Profesor sigue hermosa, hoy con ese aguacero que dificultará el accionar de posesión de León 🦁",Tue Sep 22 01:34:58 +0000 2020,Morelos,Yecapixtla,R,-98.8606355,18.859481000000002,0
"Ya listos con Anita
@ANARADIOYTV
para escuchar en
@sabrosita590 
#SalsaParaLosMuySalsas
#Aguacero  @GranComboPR
Sal… https://t.co/b4nxskxRWA",Tue Sep 22 19:09:37 +0000 2020,Ciudad de México,Iztapalapa,U,-99.050461,19.342788499999997,1835486
Hoy empieza el otoño y yo huyendo de los aguaceros de CDMX 😐,Tue Sep 22 22:30:06 +0000 2020,Ciudad de México,Miguel Hidalgo,U,-99.2115105,19.4299345,414470
"Seas mamón, Tlaloc sista emputado. 
¡Pinche aguacero! 🙃",Tue Sep 22 22:58:32 +0000 2020,Puebla,Amozoc,R,-98.1542665,19.0322295,616
Ya me canse de tener pestañas de aguacero,Wed Sep 23 22:28:06 +0000 2020,Sinaloa,Ahome,R,-109.1037265,25.921946500000004,308
Chale fui a cascariar y cayó un aguacero marca acné 😡,Wed Sep 23 23:18:01 +0000 2020,Quintana Roo,Puerto Morelos,R,-87.0316645,21.048719,0
"Hoy salió el sol después del aguacero, así también pasará en todo, ánimo! 💪🏻🙃",Wed Sep 23 23:22:26 +0000 2020,Puebla,Amozoc,R,-98.1542665,19.0322295,616
"Buenos días, impresionantes los truenos, relámpagos que precedieron a casi una hora de torrencial aguacero en Cancú… https://t.co/7CYSZtFkNh",Thu Sep 24 12:28:13 +0000 2020,Quintana Roo,Puerto Morelos,R,-87.0316645,21.048719,0
Ahora si que inche aguacero !!!,Thu Sep 24 21:44:38 +0000 2020,Oaxaca,Oaxaca de Juárez,R,-96.7250025,17.090319,685
"Yo contaba con que hoy hubiera un solazo bien cabron, pero el día comenzó con un aguacero toda la madrugada 🧐",Fri Sep 25 12:56:36 +0000 2020,Tabasco,Nacajuca,R,-92.9164995,18.0219595,432
Yo no quiero Paris con aguaceros,Mon Sep 28 04:53:37 +0000 2020,Veracruz de Ignacio de la Llave,Tuxpan,R,-97.409066,20.936595500000003,4
Chulo aguacero 🌧,Tue Sep 29 05:12:32 +0000 2020,Veracruz de Ignacio de la Llave,Xalapa,R,-96.886083,19.542054,0
"@Jose09838724 Así es, se llama EL AGUACERO.😊",Tue Sep 29 11:03:53 +0000 2020,Chiapas,Tuxtla Gutiérrez,U,-93.13965950000001,16.7424355,578830
"@warkentin @jrisco Buenos días,  en Texcoco tenemos un buen aguacero @asilascosasw !! https://t.co/tTa8bEuwlD",Tue Sep 29 11:14:54 +0000 2020,México,Texcoco,R,-98.787435,19.468545499999998,2725
"Quien me manda a venir al puerto con norte, perro aguacero que está cayendo!",Tue Sep 29 14:21:22 +0000 2020,Veracruz de Ignacio de la Llave,Veracruz,R,-96.22939650000001,19.183953,3
"Okey 
Ya se nublo cañón  😐 parece que caerá un aguacero",Tue Sep 29 16:41:54 +0000 2020,Chiapas,San Fernando,R,-93.20642749999999,16.912427,8
"Yo vine preparada para que no me muera de frío, más no preparada para el aguacero que va a caer 😱😱😱",Wed Sep 30 18:58:40 +0000 2020,Campeche,Tenabo,R,-90.24089749999999,19.948625999999997,0
"#BuenJueves, después de una intensa madrugada, de aguacero e inundaciones, ahí vamos por La primer mañana de #Octubre2020. ¡Ánimo!",Thu Oct 01 13:28:43 +0000 2020,Tabasco,Nacajuca,R,-92.9164995,18.0219595,432
"Después de 40 min de aguacero, llegamos sanos y salvos!!! #coupletravel #sisal #beachday @ Sisal, Yucatan https://t.co/eNTt3ydZR4",Thu Oct 01 18:29:09 +0000 2020,Yucatán,Hunucmá,R,-90.0317245,21.071831500000002,0
"Después de un fuerte aguacero, así quedó la tapa de la coladera (echa de plástico) y hasta el momento, 1 motoclista… https://t.co/qtvLGjaCdL",Thu Oct 01 22:41:03 +0000 2020,Tabasco,Centro,U,-92.966705,17.98992,340060
"De por sí, me encanta que llueva, y justo ahora, aquí el aguacero nocturno está...
Delicioso !
⛵🌧️❤️🌧️🤪🌊",Fri Oct 02 02:44:04 +0000 2020,Quintana Roo,Puerto Morelos,R,-87.0316645,21.048719,0
Esta cayendo un aguacero que me va a hacer dormir delicioso!!! *rocía las almohadas con su spray de “flores en armonía”* hahaha,Fri Oct 02 05:08:17 +0000 2020,Quintana Roo,Cozumel,R,-86.878029,20.4321525,0
"Viernes 2 de octubre con tremendo aguacero en Playa del Carmen, buenos días...!!",Fri Oct 02 11:04:35 +0000 2020,Quintana Roo,Solidaridad,R,-87.346982,20.5845305,27
"Que cae un aguacero de aquellos y me tengo que resguardar con esto, ni modos, está cayendo un diluvio en Wings Army… https://t.co/XmHUiRfYwO",Sat Oct 03 00:49:31 +0000 2020,Campeche,Carmen,R,-91.6332875,18.4528265,2
"Esos aguaceros de los buenos en mis #Altos😳
⛈️☔🐇⛈️💕☔🐴",Mon Oct 05 20:59:56 +0000 2020,Ciudad de México,Miguel Hidalgo,U,-99.184817,19.41099,414470
@ernx26 Nunca sabes jaja ayer en pleno aguacero vino un alma necesitada desde Kukulcán jaja,Tue Oct 06 13:17:02 +0000 2020,Yucatán,Mérida,R,-89.62361100000001,20.941035,0
¡vaya aguacero que nos está cayendo! Ya van varias veces que se va la luz 😮,Sun Oct 11 20:41:15 +0000 2020,Chiapas,San Fernando,R,-93.20642749999999,16.912427,8
Cómo ven el súper aguacero https://t.co/oFveH8iVcK,Mon Oct 12 04:29:30 +0000 2020,Ciudad de México,La Magdalena Contreras,U,-99.24800950000001,19.318042,246428
"Pinche aguacero que se soltó, afortunadamente soy maestro en conducir moto en tormentas.",Mon Oct 12 05:03:05 +0000 2020,Ciudad de México,Iztacalco,U,-99.09649599999999,19.399101,404695
"El rancho en 2 momentos:
#1 Aguacero con un poquitín de granizo en el zócalo de #Tlaxcala desde el café Moya. https://t.co/xBQ94x7jU2",Mon Oct 12 05:57:44 +0000 2020,Tlaxcala,Tlaxcala,U,-98.23831,19.316299,3254
El aguacero,Mon Oct 12 19:09:12 +0000 2020,Tamaulipas,Victoria,R,-99.187904,23.685934,0
"Se llama calma y me costó muchas tormentas obtenerla. ⭐ en El Aguacero, ocozocoautla https://t.co/2VsKYLXTFf",Tue Oct 13 00:55:08 +0000 2020,Chiapas,San Cristóbal de las Casas,R,-92.534411,16.663044499999998,0
Qué aguacero! @MazatlanMex,Tue Oct 13 02:44:21 +0000 2020,Sinaloa,Mazatlán,R,-106.2717475,23.46814,0
@ivonne_banda Se borró pero la banqueta de la Belisario Domínguez con este perro aguacero!,Tue Oct 13 04:52:56 +0000 2020,Sinaloa,Mazatlán,R,-106.2717475,23.46814,0
@nenissh @trikisllamas Acá fue aguacero!,Tue Oct 13 20:48:46 +0000 2020,Sinaloa,Mazatlán,R,-106.2717475,23.46814,0
@DIFCDMX  @TlalpanAl  @UCS_GCDMX  niña vende pulque debajo del aguacero . Sierra de San Juan esq. Cerrada sierra de… https://t.co/7UQRgKsGoR,Tue Oct 13 23:10:15 +0000 2020,Ciudad de México,Tlalpan,R,-99.208364,19.199485,86
ASI EL AGUACERO EN EL .CENTRO DE CUERNAVACA ...A QUE HORQ PODRE LLEGAR A MI CASA? 😪😰😥⛈⛈☔ https://t.co/LyXEkDnATc,Wed Oct 14 00:31:47 +0000 2020,Morelos,Cuernavaca,R,-99.260819,18.933812,78
Al momento Dos vehículos anegados por el torrencial aguacero quedan varados sobre Av Cuauhtémoc esq. Alta Tensión e… https://t.co/iyiJsq43t1,Wed Oct 14 01:32:27 +0000 2020,Morelos,Cuernavaca,R,-99.260819,18.933812,78
Tlaloc le abrió la llave a la manguera... Que aguacero esta cayendo....,Wed Oct 14 11:56:13 +0000 2020,Veracruz de Ignacio de la Llave,Coatzacoalcos,U,-94.43248200000001,18.135455,212540
Tlaloc le abrió la llave a la manguera... Que aguacero está cayendo,Wed Oct 14 11:57:29 +0000 2020,Veracruz de Ignacio de la Llave,Coatzacoalcos,U,-94.43248200000001,18.135455,212540
Tlaloc le abrió la llave a la manguera... Que aguacero está cayendo...,Wed Oct 14 11:58:12 +0000 2020,Veracruz de Ignacio de la Llave,Coatzacoalcos,U,-94.43248200000001,18.135455,212540
Ojalá que llueva café en el campo...que caiga un aguacero de yuca y té...,Thu Oct 15 15:43:54 +0000 2020,Jalisco,Guadalajara,U,-103.335882,20.676651999999997,1385621
"Tu recuerdo sigue aquí como aguacero de Mayo🎶🐄

-Ya no sé lo que pensar, si tu recuerdo me hace bn o me hace mal🎤🐓",Fri Oct 16 03:00:51 +0000 2020,Baja California,Playas de Rosarito,R,-116.929102,32.3328765,5
"🔵#ÚLTIMAHORA: La ciudad de #Reynosa con severas inundaciones tras registrarse un fuerte aguacero.

Varias avenidas… https://t.co/3MSefr9agL",Fri Oct 16 15:07:49 +0000 2020,Tamaulipas,Reynosa,R,-98.36253100000002,25.836567499999997,1
"Para curar el encanto
de algún amor traicionero,
Muy temprano me levanto
Y en medio de un aguacero
Bebo lagrimas de… https://t.co/NI4KY2I2mr",Sun Oct 18 03:05:56 +0000 2020,Veracruz de Ignacio de la Llave,Veracruz,R,-96.22939650000001,19.183953,3
"Para curar el encanto
de algún amor traicionero,
Muy temprano me levanto
Y en medio de un aguacero
Bebo lágrimas de… https://t.co/V53vgXV4aJ",Sun Oct 18 03:09:51 +0000 2020,Veracruz de Ignacio de la Llave,Veracruz,R,-96.22939650000001,19.183953,3
No me chinguen... cae el aguacero justo cuando el rappi ya había recogido mi pedido de pizza 😭😭😭😭😭😭😭😭😭😭😭😭,Sun Oct 18 22:26:00 +0000 2020,Ciudad de México,Cuauhtémoc,U,-99.153366,19.432836,545884
ALV! Creo cayó un perro aguacero,Mon Oct 19 00:28:30 +0000 2020,Tlaxcala,Apizaco,U,-98.1218485,19.4260765,47632
"@tachomx @BicireporteraDF Jajaja a nosotros nos atrapó en la cervecería y cuando decidimos salir, aguacero y granizo 🙄",Mon Oct 19 13:51:48 +0000 2020,Ciudad de México,Cuauhtémoc,U,-99.153366,19.432836,545884
@daanasu No aguanto que me tengas registrado cómo Aguacero 😂😂😂😂🥺❤️ https://t.co/xtwQY2PCGP,Mon Oct 19 21:49:29 +0000 2020,Hidalgo,Tula de Allende,R,-99.384564,20.0567145,888
Se soltó mamón el aguacero. 👁👄👁,Mon Oct 19 23:32:36 +0000 2020,Puebla,San Martín Texmelucan,R,-98.42957299999999,19.2652435,25
Nota.2 Dispensaran lo maltrecho del libro pues en una andanza cosmopolita fuimos presa de un aguacero sufriendo dañ… https://t.co/JAJusMfunI,Tue Oct 20 01:26:58 +0000 2020,Morelos,Jojutla,R,-99.2788965,18.587272,68
El aguacero y yo somos uno mismo 😂♥️,Tue Oct 20 18:49:17 +0000 2020,Hidalgo,Tula de Allende,R,-99.384564,20.0567145,888
Se nos secó el aguacero. Será que ya no nos tenemos ni en los sueños...,Tue Oct 20 19:06:25 +0000 2020,Guanajuato,Guanajuato,R,-101.250134,21.0254965,0
Yo no quiero París con aguacero ni Venecia sin ti.,Wed Oct 21 05:30:31 +0000 2020,Tamaulipas,Tampico,R,-97.91677200000001,22.270295,19
