Tweet,Fecha,Estado,Locacion,Tipo,Longitud,Latitud,Poblacion
"@CarlosTorresF_ @RealidadSieteMx Las RATAS son RATAS y no respetan ETICA alguna, si les avientan migajas hasta por… https://t.co/IJ50kCAxNU",Wed Jun 08 19:10:59 +0000 2022,Baja California,Playas de Rosarito,R,-116.929102,32.3328765,5
"@Paolaorm5 Así debe ser siempre, merecemos todo y no migajas🫶🏻",Wed Jun 08 23:21:10 +0000 2022,Veracruz de Ignacio de la Llave,Tuxpan,R,-97.409066,20.936595500000003,4
"@darktuit Dice un amigo si voy hacer algo es porque va hacer mío nada más , hay quienes dan flores y solo reciben migajas",Wed Jun 08 23:26:03 +0000 2022,Ciudad de México,Iztapalapa,U,-99.050461,19.342788499999997,1835486
"@DoreFerriz A dónde pasó por mi cheque? 
🤣🤣🤣🤣🤣🤣🤣🤣
Vieja ridícula, crees que porque tú recibes migajas por ladrar, l… https://t.co/3sgAaDRa9k",Thu Jun 09 04:30:43 +0000 2022,Ciudad de México,Benito Juárez,U,-99.1614805,19.380613,434153
Deja migajas de pan para que no me desvíe de tu camino 🙏🏻,Thu Jun 09 17:42:46 +0000 2022,Veracruz de Ignacio de la Llave,Coatzacoalcos,U,-94.43248200000001,18.135455,212540
"No te conformes con migajas de amor por no saber esperar la voluntad de Dios.

No busques físicos, fijate en alguie… https://t.co/u4zUfJyFDq",Thu Jun 09 19:54:17 +0000 2022,Veracruz de Ignacio de la Llave,Minatitlán,R,-94.3909125,17.706791000000003,8
"@Mike_Oviedo Gracias al INE, a sus cómplices y a los qué venden su voto por migajas, ahí está el problema ahora igu… https://t.co/C02qLuXrsF",Sat Jun 11 03:51:03 +0000 2022,Hidalgo,El Arenal,R,-98.89303799999999,20.2948005,78
"@NotiGDL Sueña con la presidencia, no quiere migajas...no va con el tamaño de su ego.",Sat Jun 11 21:00:24 +0000 2022,Jalisco,Tlajomulco de Zúñiga,R,-103.407581,20.489708999999998,15
@Nina_Olmos @PorMiMexico71 @gog_antonio @lopezobrador_ Misma estrategia del viejo PRI. Migajas para el Pueblo. Priv… https://t.co/WBWvsrTdYo,Sun Jun 12 22:19:20 +0000 2022,México,Coacalco de Berriozábal,U,-99.130628,19.6302155,293245
@TheNukaBoy @pablo91568990 @DemetrioRosas2 @LilithFal @FranMontanez80 @alucardthekid Aquí ella espera las migajas t… https://t.co/eGgTx8m2dF,Mon Jun 13 03:15:18 +0000 2022,Jalisco,Zapopan,R,-103.48477450000001,20.790657000000003,40
"Gorditas de maíz quebrado rellenas de migaja
#Cookingmonster 
#cocinatradicionalmexicana🇲🇽 
#GastroMX… https://t.co/sqxLE3UYKM",Mon Jun 13 05:09:31 +0000 2022,Querétaro,Corregidora,R,-100.43973100000001,20.478755,2494
"Está bien que sea un presidente cercano al pueblo, pero luego se aprovechan de ellos dándoles migajas para mantener… https://t.co/LncBHxNsc4",Mon Jun 13 19:52:13 +0000 2022,Jalisco,Zapopan,R,-103.48477450000001,20.790657000000003,40
@DafneC4 Recordemos que @VeroDelgadilloG prefiere perder la dignidad y ser pisoteada por una cuántas migajas y como… https://t.co/B1ZYVBUYk2,Tue Jun 14 05:48:39 +0000 2022,Baja California Sur,Los Cabos,R,-109.7662685,23.269879,2
Que no se te olvide tus raíces cuando estes arriba y no les des la migajas a los de avajo si ayudas ayudalos bien m… https://t.co/mN9Jb7sxeO,Tue Jun 14 14:57:31 +0000 2022,Nuevo León,San Pedro Garza García,R,-100.366033,25.650287499999997,2
"@MajoSoberanis Super bien! Cumplen con el cometido de que "" al pueblo pan y circo"" felicidades...que disfrutes las migajas qué te avientan.",Tue Jun 14 16:42:08 +0000 2022,Jalisco,Zapopan,R,-103.48477450000001,20.790657000000003,40
Señor te pido por todos aquellas personitas del mundo que con ancia desean un migaja dé pan porque esta tan caro qu… https://t.co/fYaVuKUy55,Wed Jun 15 12:02:22 +0000 2022,México,Villa Guerrero,R,-99.692166,18.959223,1827
"@Margaritarosadf Esas son migajas, digan no al Populismo, están a tiempo. Saludos desde México.",Wed Jun 15 22:33:12 +0000 2022,Tamaulipas,Ciudad Madero,U,-97.8225365,22.283026,205933
@uzihofficial @JAVIS3085 @werevertumorro México de pendejo aceptando migajas por quedar bien con EU,Thu Jun 16 18:47:39 +0000 2022,Nuevo León,General Escobedo,R,-100.3652735,25.807314499999997,1682
¿En verdad les emocionan las migajas que nos van a dar para el #Mundial2026? 🇲🇽 🥲,Thu Jun 16 20:10:09 +0000 2022,Querétaro,Querétaro,R,-100.4405945,20.7152745,9
Puras migajas comosiempre,Fri Jun 17 02:08:33 +0000 2022,Coahuila de Zaragoza,Saltillo,R,-101.166961,25.0326315,97
No queremos tus migajas gringo progre,Sat Jun 18 14:34:20 +0000 2022,Nuevo León,Guadalupe,R,-100.196134,25.6766035,28
@fer_esquivel22 Mamadas por un jugador que no hizo nada. Solo fichamos migajas.,Sat Jun 18 17:30:30 +0000 2022,Campeche,Carmen,R,-91.6332875,18.4528265,2
"A partir del lunes, después de desayunar, ahí les pasó estás migajas, pueblo bueno.",Sat Jun 18 19:27:56 +0000 2022,Baja California,Playas de Rosarito,R,-116.929102,32.3328765,5
"@LocutorAlejo Con morena en el gobierno, nos esperan puras pend......s , pero así lo quiere el pueblo manteniendo. Todo por migajas.",Sun Jun 19 18:37:24 +0000 2022,Oaxaca,Oaxaca de Juárez,R,-96.7250025,17.090319,685
"De poquito en poquito fui restaurando mi corazón, por eso la indiferencia, la falta de iniciativa o las migajas com… https://t.co/KRe71SaooO",Mon Jun 20 04:31:30 +0000 2022,Tabasco,Nacajuca,R,-92.9447745,18.175748,531
"Capitaliza Morena el gasto social - Vía @reforma https://t.co/rSBcwSH39F

Puras migajas, en lugar de trabajo, salud y educación de calidad",Mon Jun 20 13:04:07 +0000 2022,Ciudad de México,Benito Juárez,U,-99.1614805,19.380613,434153
@mediotiempo El america agarrando migajas! Se nota que estan quebrados! Lo que es!,Mon Jun 20 18:41:44 +0000 2022,Baja California,Playas de Rosarito,R,-116.929102,32.3328765,5
@Pepeqezada Le aventamos las migajas como quiera compadre jajajaja,Tue Jun 21 22:07:54 +0000 2022,Nuevo León,Apodaca,R,-100.1687175,25.778679,1879
@noloseparanada @SegusGuillen @julioastillero No te da vergüenza q asco aplaudir por migajas,Tue Jun 21 22:49:40 +0000 2022,Ciudad de México,Benito Juárez,U,-99.1614805,19.380613,434153
"Así son los chairos, viven del pan y del circo, tragan migajas, viven en la miseria y @Claudiashein y… https://t.co/F9Gg2w3uhb",Wed Jun 22 06:05:41 +0000 2022,Ciudad de México,Benito Juárez,U,-99.1614805,19.380613,434153
"Así son los chairos, viven del pan y del circo, tragan migajas, viven en la miseria y @Claudiashein y… https://t.co/DiqMTxL0At",Wed Jun 22 06:06:40 +0000 2022,Ciudad de México,Benito Juárez,U,-99.1614805,19.380613,434153
@gjse56_jess Ps por eso votaron x morena por las migajas que dan,Wed Jun 22 12:46:23 +0000 2022,Michoacán de Ocampo,Lázaro Cárdenas,R,-102.45755600000001,18.083858499999998,12
"No mames que sí apareció otra vez en mi sueño, pero no, yo sé que quiero y merezco, no voy a aceptar migajas de nad… https://t.co/z1KbYw1fEK",Wed Jun 22 21:25:42 +0000 2022,Ciudad de México,Miguel Hidalgo,U,-99.2115105,19.4299345,414470
"@bambinoslp A cuenta gotas y migajas pero te freseas.
Ya estuvieras en la lista del ""Potosí para unos cuantos"".",Thu Jun 23 01:52:14 +0000 2022,San Luis Potosí,San Luis Potosí,R,-100.955511,22.3111195,18
"Gente que esta en Av. Miguel Alemán no acepten sus migajas, fuerza, y sumense.",Thu Jun 23 02:00:44 +0000 2022,Nuevo León,Juárez,R,-100.118882,25.6083315,5
@azucenau Entregan el poder por migajas,Thu Jun 23 03:25:25 +0000 2022,Guanajuato,León,R,-101.601401,21.09806,3
"Buenos días.
No te conformes con migajas, mereces quien te ame con todas sus fuerzas, que te vea como la única persona sobre la tierra.",Thu Jun 23 12:35:03 +0000 2022,Veracruz de Ignacio de la Llave,Xalapa,R,-96.886083,19.542054,0
Sólo les daban migajas.,Thu Jun 23 23:11:06 +0000 2022,Ciudad de México,Coyoacán,U,-99.15234000000001,19.328383000000002,614447
Que violenta la calma con la que los empachados nos dicen que agradezcamos las migajas. Nina Ferrari,Sun Jun 26 02:06:13 +0000 2022,Guerrero,Zihuatanejo de Azueta,R,-101.457015,17.8005545,11
Ni migajas tengo 😢,Sun Jun 26 08:02:42 +0000 2022,Aguascalientes,Aguascalientes,R,-102.327207,21.849459000000003,0
@VicenteFoxQue Rescate lo que estamos haciendo las migajas que dejaron los prianistas,Mon Jun 27 22:39:55 +0000 2022,San Luis Potosí,San Luis Potosí,R,-100.955511,22.3111195,18
"@Bragi_Gunlod Solo mantener su base de mantenidos estira mano, que se conforman con migajas!!!",Tue Jun 28 18:18:50 +0000 2022,Ciudad de México,Cuauhtémoc,U,-99.153366,19.432836,545884
Ya no quiero migajas,Thu Jun 30 21:50:58 +0000 2022,Sonora,Hermosillo,R,-111.498181,28.9698625,5
"@carlosGomez1326 @adrianm10 Ya me depositan los días 15 y no migajas por idioteces en redes sociales, pero gracias.",Fri Jul 01 04:56:10 +0000 2022,Nuevo León,San Pedro Garza García,R,-100.366033,25.650287499999997,2
@acastagne @lopezobrador_ Migajas que antes eran toneladas de dinero que se robaban los ratas prianistas.,Sat Jul 02 07:32:21 +0000 2022,Chihuahua,Guerrero,R,-107.5712295,28.456083,0
"No hay que andar esperando migajas de invitaciones, después de tanto uno se da cuenta donde no lo quieren.",Sat Jul 02 16:13:03 +0000 2022,Sinaloa,Mazatlán,R,-106.2717475,23.46814,0
@_VicenteSerrano @lopezobrador_ Comprando el voto a cambio de migajas. Después no se vale chillar cuando el país es… https://t.co/PbMVdaHaCo,Sat Jul 02 21:23:24 +0000 2022,Hidalgo,Tizayuca,U,-98.9642575,19.8533755,2926
"Me suena...no sólo en espectáculos, suelen hacerlo en política y luego terminan siendo casi sirvientes por migajas.",Sun Jul 03 03:47:59 +0000 2022,Veracruz de Ignacio de la Llave,Xalapa,R,-96.886083,19.542054,0
@ericchazaro Y todos aquellos que critican simulan ser expertos siendo que lo que si son es paleros que acepta migajas de los vendé patrias,Sun Jul 03 10:31:02 +0000 2022,México,Nezahualcóyotl,R,-99.087817,19.4320755,0
"@PartidoMorenaMx @lopezobrador_ ATOLEEEEE .... DE PROMESAS, DE MAQUETAS , DE MENTIRAS, DE CORRUPCIÓN Y MIGAJAS . https://t.co/sWqZU2pAaL",Sun Jul 03 19:12:54 +0000 2022,Puebla,Amozoc,R,-98.1542665,19.0322295,616
@acastagne @lopezobrador_ Señor que triste que se exprece asi tan vil del pueblo y aclaro no son migajas es nuestro… https://t.co/UFrp0O1Gtn,Mon Jul 04 03:11:13 +0000 2022,Ciudad de México,Iztacalco,U,-99.09649599999999,19.399101,404695
Yo que hago recibiendo migajas y mendigando un amor que ni si quiera es mío,Mon Jul 04 15:32:17 +0000 2022,Tabasco,Jalapa,R,-92.801837,17.777682,308
"@leonelangello9 Desde que tengo uso de razon, hsbia pasado el PRI repartia migajas y el PAN ni agua",Mon Jul 04 19:31:02 +0000 2022,Ciudad de México,Cuauhtémoc,U,-99.153366,19.432836,545884
@rosete_noe @chioreya Y tú ? Ardido de a   ?   .... ¡ Migajas ! .,Mon Jul 04 21:16:03 +0000 2022,México,Nezahualcóyotl,R,-99.01701650000001,19.432722,85
@LOVREGA Tienen migajas....,Wed Jul 06 21:58:46 +0000 2022,Veracruz de Ignacio de la Llave,Veracruz,R,-96.22939650000001,19.183953,3
"Hoy decido dejar de rogar por amor, merezco más que migajas de cariño y afecto por todo lo que soy y doy.",Fri Jul 08 17:34:27 +0000 2022,Hidalgo,Francisco I. Madero,R,-99.0838745,20.232006499999997,223
@tedisen Definitivamente cierto.. Cuando nos queremos ya no aceptamos migajas!!,Fri Jul 08 19:59:51 +0000 2022,Tabasco,Comalcalco,R,-93.341606,18.291262,1056
@inggromero01 @acostanaranjo @lopezobrador_ @jesusortegam @Jesus_ZambranoG Estos personajes vivieron de las migajas… https://t.co/1sFUfuzOr9,Sat Jul 09 19:08:13 +0000 2022,Tamaulipas,Altamira,R,-98.082815,22.560886000000004,0
Las Diosas no aceptan migajas.,Mon Jul 11 01:43:46 +0000 2022,San Luis Potosí,San Luis Potosí,R,-100.955511,22.3111195,18
@feyrei77 @myriambregman Y votaron en blanco en 2015 beneficiando a Macri que ganó por migajas…,Mon Jul 11 19:08:42 +0000 2022,Quintana Roo,Puerto Morelos,R,-87.0316645,21.048719,0
"@Jean_0097 Malditos vende patrias entreguistas, se ponían de tapete a cambio de migajas de la mesa del imperio, hoy… https://t.co/z6316EONK0",Tue Jul 12 22:29:05 +0000 2022,Ciudad de México,Benito Juárez,U,-99.1614805,19.380613,434153
@castonio Gracias ☺️ pero no comí pastel por qué comí demasiado así que me lo traje a casa te mando una migaja jaja… https://t.co/QEtuSaU6Kh,Thu Jul 14 04:10:47 +0000 2022,Nuevo León,García,R,-100.640491,25.8057225,714
El problema lleva ya meses pero ello hasta dentro de los próximos días dirán qué migajas van a aportar...,Thu Jul 14 20:40:33 +0000 2022,Nuevo León,Monterrey,U,-100.29359149999999,25.6417185,1142952
Quienes critican ésta transformación pacífica eran rémoras que se alimentaban de las migajas del neoliberalismo mex… https://t.co/aBgz65pcYk,Tue Jul 19 19:24:40 +0000 2022,Jalisco,Tonalá,U,-103.2131755,20.6215735,3280
Las migajas no alimentan un corazón hambriento,Tue Jul 19 21:52:58 +0000 2022,Colima,Colima,R,-103.65673849999999,19.100341999999998,0
Pago por 25 minutos de cuestionario y en México aún nos pagan migajas por toda una jornada a los médicos… https://t.co/4WHEaeKpdk,Wed Jul 20 20:38:36 +0000 2022,Baja California,Playas de Rosarito,R,-116.929102,32.3328765,5
"Porque cuando lo dicen sientes mariposas en el estómago, pero es porque son migajas de amor y hasta esas migajas te… https://t.co/P4eRNbpddc",Thu Jul 21 12:12:49 +0000 2022,Baja California Sur,Loreto,R,-111.2433815,25.920035000000002,0
mmmmhm migajas,Sat Jul 23 15:21:57 +0000 2022,Jalisco,Zapopan,R,-103.48477450000001,20.790657000000003,40
"Me merezco quien me quiera mucho, no menos, no migajas, la vida es buena, no pa andar valiendo verga.",Sat Jul 23 16:33:58 +0000 2022,Ciudad de México,Iztapalapa,U,-99.050461,19.342788499999997,1835486
No le des tu vida a alguien que te da migajas con lastima.,Sat Jul 23 21:10:47 +0000 2022,Ciudad de México,Xochimilco,R,-99.08179,19.236244499999998,123
"Que difícil es la espera, que hasta se vuelve agonía, mientras vivimos de migajas que hacen pensar que hay esperanz… https://t.co/WKaG8xEWHR",Sun Jul 24 13:31:33 +0000 2022,Baja California Sur,Loreto,R,-111.2433815,25.920035000000002,0
"Eres la persona que me está enseñando lo que no debo aceptar en mi vida jamás, migajas.",Sun Jul 24 14:54:48 +0000 2022,México,Tenancingo,R,-99.565185,18.945956,3061
"No sé quién es más patético, si el político que defiende las empresas a cambio de migajas o los fachos que no recib… https://t.co/ml93ymS0fP",Mon Jul 25 20:54:51 +0000 2022,México,Ecatepec de Morelos,R,-99.09030349999999,19.626005,1043
"Harta de que me fallen 🥹 Yo siempre trato de apoyar Y estar al 100, en cambio a mí sólo me tocan las migajas.",Tue Jul 26 04:35:49 +0000 2022,Zacatecas,Villa de Cos,R,-102.5580375,23.6254185,0
@RbKdAguilar Ufa ni las migajas quedaron del combo https://t.co/4nAw3z6Cr8,Tue Jul 26 23:36:26 +0000 2022,Sonora,Hermosillo,R,-111.498181,28.9698625,5
@ferbelaunzaran Si hay que amar a los que por migajas le vendieron su alma a #iberdrola,Wed Jul 27 14:04:28 +0000 2022,San Luis Potosí,San Luis Potosí,R,-100.955511,22.3111195,18
"Él,  su familia y los suyos, seguirán sirviéndose con la cuchara grande... Para el pueblo, las migajas que caigan d… https://t.co/PVAjZhHdvO",Wed Jul 27 22:31:00 +0000 2022,Morelos,Cuernavaca,R,-99.260819,18.933812,78
"@ArturoZaldivarL El Arturo Zaldívar, no puede criticar al qué le da migajas, por eso es dirá que se equivocó… https://t.co/P60Jx0uV0b",Thu Jul 28 00:25:46 +0000 2022,México,Nezahualcóyotl,R,-99.01701650000001,19.432722,85
Es feo conformarte por migajas de cariño.,Thu Jul 28 07:07:18 +0000 2022,Veracruz de Ignacio de la Llave,Veracruz,R,-96.22939650000001,19.183953,3
"@_VicenteSerrano @lopezobrador_ ¡¡¡¡¡ ESTUPIDO !!!!!, son personas que no se venden por esas migajas de ""pensiones""… https://t.co/KXir5Ht9uL",Thu Jul 28 12:57:48 +0000 2022,México,Tlalnepantla de Baz,U,-99.1642825,19.543933000000003,658907
@SergioSarmiento Te das cuenta cuanto robaban tus patrones y las migajas que levantabas ?,Thu Jul 28 19:13:58 +0000 2022,Jalisco,Zapopan,R,-103.48477450000001,20.790657000000003,40
"@marcelareynoso @PedroSvGuerrero Esa gente, que le gustan las migajas..
Yo por eso me quejo y me quejo...",Fri Jul 29 16:32:47 +0000 2022,Guerrero,Zihuatanejo de Azueta,R,-101.457015,17.8005545,11
@AmandoMontero Ora sí que aprieta mesta... Las maromas que se avientan para que les den unas migajas del pastel.,Fri Jul 29 20:22:43 +0000 2022,Ciudad de México,Xochimilco,R,-99.08179,19.236244499999998,123
"Imagínate rogar por migajas de amor cuando el Creador del Universo se muere, literalmente, de amor por ti.",Fri Jul 29 22:09:06 +0000 2022,Veracruz de Ignacio de la Llave,Jilotepec,R,-96.94156699999999,19.5868205,12
"No voy a esperar un día más, no quiero tus migajas ⏯️",Sat Jul 30 03:51:47 +0000 2022,Veracruz de Ignacio de la Llave,Veracruz,R,-96.22939650000001,19.183953,3
"Una gordita de migajas con sabor a recuerdo, besos al cielo mi chula! en La Loma, Santiago de Querétaro https://t.co/y1UzzwaOZ0",Sat Jul 30 22:19:26 +0000 2022,Querétaro,Querétaro,R,-100.4405945,20.7152745,9
Este tipo de parásitos peleándose por las migajas que dejan criminales y pillos  como  @rocionahle @lopezobrador_ s… https://t.co/jLxxU0lLIp,Sun Jul 31 01:16:09 +0000 2022,Ciudad de México,Cuajimalpa de Morelos,R,-99.30558049999999,19.318697,728
"Amooo-o-oor, qué conveniente situación... Me has conformado el corazón, con las migajas de tu amor, por ti... No cr… https://t.co/LSjnrsyt7r",Sun Jul 31 04:44:35 +0000 2022,Guanajuato,Guanajuato,R,-101.250134,21.0254965,0
"Tengo fé en que sanaré, dejaré de buscar migajas de amor porque confío en que llegará alguien que me hará sentir qu… https://t.co/RCYj2HRC7k",Sun Jul 31 18:39:11 +0000 2022,Chiapas,Villa Comaltitlán,R,-92.56311699999999,15.1255925,76
@alejandromurat Las tradiciones son tu? Porque en las fotos estás tú y no las tradiciones. Que ausencia de dignidad por recibir migajas.,Sun Jul 31 23:36:13 +0000 2022,Michoacán de Ocampo,Morelia,R,-101.27577,19.652724,84
Lo peor de todo es que ya me acostumbre a ser feliz con las migajas de amor que recibo,Mon Aug 01 07:02:30 +0000 2022,Nuevo León,Monterrey,U,-100.29359149999999,25.6417185,1142952
"@carolina_rocha_ Quiero ver a estos ""Tres Tristes Tigres"" peleando por las migajas que dejará @PartidoMorenaMx https://t.co/DsyhMz1Rb4",Mon Aug 01 22:24:04 +0000 2022,Quintana Roo,Puerto Morelos,R,-87.0316645,21.048719,0
No quedan ni migajas de la Sheila que tenía su Instagram abierto en el celular de su novio 👁👄👁,Tue Aug 02 02:02:26 +0000 2022,México,Cuautitlán,U,-99.1634475,19.678076,117995
"Que sé deben dar las gracias al ""gobierno del pan""por las migajas que da algunas personas...",Tue Aug 02 02:24:01 +0000 2022,Querétaro,Querétaro,R,-100.4405945,20.7152745,9
"@FreddyOliviery @FelipeCalderon Los reunió a huevo, acarreados porque sino les quitaban las migajas de subsidios",Tue Aug 02 15:25:30 +0000 2022,Nuevo León,Guadalupe,R,-100.196134,25.6766035,28
Que dice el mugroso que no se baña que si por qué al otro palero le están pagando más y que el solo recibe migajas,Tue Aug 02 15:37:10 +0000 2022,Sonora,Hermosillo,R,-111.498181,28.9698625,5
"Los usan nada más para hacer campaña, a la hora de las reparticiones sólo les tiran con migajas en el mejor de los casos.",Wed Aug 03 02:06:49 +0000 2022,Sinaloa,Ahome,R,-109.1037265,25.921946500000004,308
@martikarinaz Toda la cama llena de hormigas y migajas 🙉,Wed Aug 03 05:54:59 +0000 2022,Sonora,Hermosillo,R,-110.94024999999999,29.103035499999997,0
@epigmenioibarra Ese padrón es de los que reciben las migajas del sistema...,Wed Aug 03 18:45:39 +0000 2022,Sonora,Hermosillo,R,-111.498181,28.9698625,5
"Mujeres luchando por mujeres, que si quieren ser objetos de los hombres por migajas. https://t.co/jGJcgw8LR5",Wed Aug 03 20:30:50 +0000 2022,Sonora,Hermosillo,R,-111.498181,28.9698625,5
Las migajas nunca son suficientes.,Fri Aug 05 05:49:56 +0000 2022,Sinaloa,Culiacán,R,-107.3420565,24.6624885,0
"Para después que sea un logro de la 4T el dar migajas y usar ese rubro para cambiarlo por votos, ""si no votas por m… https://t.co/QfwAWiUQ2g",Fri Aug 05 18:43:42 +0000 2022,Quintana Roo,Puerto Morelos,R,-87.0316645,21.048719,0
"Hay gremios de transportes y uniones de taxistas que por unas migajas venden si Voto ,",Fri Aug 05 19:40:06 +0000 2022,México,Acambay de Ruíz Castañeda,R,-99.89822649999999,19.9614515,566
Siempre recibiendo migajas,Sat Aug 06 03:58:37 +0000 2022,Campeche,Campeche,R,-90.27714,19.601414,0
"I’m so sorry, pero no soy fan de las migajas de cariño.",Sat Aug 06 19:59:22 +0000 2022,Tamaulipas,Ciudad Madero,U,-97.8225365,22.283026,205933
Aquí los que buscan sacar migajas del gobierno.,Sun Aug 07 00:50:54 +0000 2022,Colima,Comala,R,-103.83782000000001,19.326965,3
Creo que hay que saberse valorar y no aceptar migajas tampoco en ese tema. La belleza te da muchos privilegios y ha… https://t.co/V4P3y2ochE,Sun Aug 07 05:55:31 +0000 2022,Ciudad de México,Tlalpan,R,-99.208364,19.199485,86
@epigmenioibarra Jejejejejeje el chayote el chayote y las migajas hay que desquitarlas!!!,Sun Aug 07 17:42:04 +0000 2022,Nuevo León,Monterrey,U,-100.29359149999999,25.6417185,1142952
"A veces hay que vivir de migajas, solo asegúrate que sean del mejor pastel del mundo.",Sun Aug 07 18:56:19 +0000 2022,México,Texcoco,R,-98.787435,19.468545499999998,2725
Me hiciste que viera tu TL para saber por qué defiendes la coalición PRIAN talvez te gusta recibir migajas y defend… https://t.co/lY87w6C4WS,Sun Aug 07 22:35:30 +0000 2022,México,Tultepec,R,-99.119063,19.678236,11
Las migajas cansan…,Mon Aug 08 02:06:38 +0000 2022,Quintana Roo,Puerto Morelos,R,-87.0316645,21.048719,0
"Ya no estoy dispuesto a recibir pinches migajas, o me das el pay completo o a la verga.",Tue Aug 09 03:35:18 +0000 2022,Ciudad de México,Tlalpan,R,-99.208364,19.199485,86
@marp7601 @lalvarado1404 @Trafico_ZMG Migajas !,Tue Aug 09 20:31:07 +0000 2022,Jalisco,Ixtlahuacán de los Membrillos,R,-103.206058,20.407090500000002,228
@marp7601 @lalvarado1404 @Trafico_ZMG Migajas y al dueño Olvera lo tienen detenido y ni así avanzan,Tue Aug 09 20:31:46 +0000 2022,Jalisco,Ixtlahuacán de los Membrillos,R,-103.206058,20.407090500000002,228
@Sallvatoree Le dejaron al siguiente un pedotototeee un estado quebrado con las migajas que mandan del gib federal… https://t.co/KM7nG0s1bb,Tue Aug 09 21:00:10 +0000 2022,Sinaloa,Mazatlán,R,-106.2717475,23.46814,0
@adamealfonso ¡’Migajas de amor’ también tuvo éxito!,Tue Aug 09 22:47:24 +0000 2022,Nuevo León,Monterrey,U,-100.29359149999999,25.6417185,1142952
"@Maramensaje Gracias a esos ancian@s es que el otro anciano esta donde está , él les debe mucho más que las migajas… https://t.co/fCz7zY4kL5",Wed Aug 10 01:06:30 +0000 2022,México,Tlalnepantla de Baz,U,-99.1158905,19.518656,13030
"@JuanPabloMarun @municipio_leon @PRILeonOficial1 Programas?????

Es presentación del presupuesto!!!
Y migajas de apoyo.",Wed Aug 10 03:42:30 +0000 2022,Guanajuato,León,R,-101.601401,21.09806,3
Día 3 sin una migaja de pan y ya siento que la vida se me va.,Wed Aug 10 12:17:59 +0000 2022,Querétaro,Querétaro,R,-100.4405945,20.7152745,9
"@viontas @lopezdoriga Y más increíble los infelices que le defienden, unos por millones y otros por migajas",Wed Aug 10 13:21:16 +0000 2022,Ciudad de México,Tláhuac,U,-99.00501849999999,19.2623115,323771
@DennBMcdougall Ahhh migajas ok en mi rancho asi les decimos.,Wed Aug 10 18:03:20 +0000 2022,Nuevo León,Guadalupe,R,-100.196134,25.6766035,28
"@Rafaherrera1983 Qué honrar que te pongan a nivel nacional como p3ndient3, lo que es el hambre de una migaja de fama 🤣🤣🤣",Wed Aug 10 20:45:33 +0000 2022,Nuevo León,Monterrey,U,-100.29359149999999,25.6417185,1142952
@HAngelopolis Vaya pendejos que no reciben migajas del gobierno mientras el presidente manda a sus hijos al extranj… https://t.co/9tkb85KzF4,Fri Aug 12 00:01:40 +0000 2022,Coahuila de Zaragoza,Arteaga,R,-100.588311,25.3331755,3
"Que no nos olvide que Él nos amó primero, ¿Porqué te conformas con las migajas de un amor humano?
Cuando tú padre t… https://t.co/XNwqS3mQXn",Fri Aug 12 02:25:26 +0000 2022,Veracruz de Ignacio de la Llave,Álamo Temapache,R,-97.714151,20.9937245,11
"@JesusRCuevas Se terminaron los casicasgos que los líderes corruptos de la la CNC, tenían con migajas a los verdade… https://t.co/siLEfFs9gt",Fri Aug 12 14:22:50 +0000 2022,Nayarit,Tepic,R,-104.8725575,21.626666,654
"Así se manipula a los analfabetas e ignorantes, éste individuo sabe perfectamente lo que hace: darle migajas de pan… https://t.co/HOMvPjhSSF",Fri Aug 12 16:46:37 +0000 2022,Ciudad de México,Coyoacán,U,-99.15234000000001,19.328383000000002,614447
"Cuando no tienes ni idea de cómo funciona la economía, todo lo quieres arreglar repartiendo migajas con cargo al er… https://t.co/oXxdwbVCsi",Fri Aug 12 18:26:05 +0000 2022,Quintana Roo,Puerto Morelos,R,-87.0316645,21.048719,0
"Merezco verte, abrazarte, decir te amo. 
Merezco tiempo de calidad más no migajas. 
Guardaste tu bonito fin de sema… https://t.co/vgy408TneJ",Sat Aug 13 03:25:55 +0000 2022,Puebla,Amozoc,R,-98.1542665,19.0322295,616
"Sumido en la mediocridad,esperando la migaja que se le caiga a ese que en su palacio come a todo lujo.",Sat Aug 13 16:19:12 +0000 2022,México,Otzolotepec,R,-99.4824945,19.4423095,299
"@Milo_del_mal @Zhemo17 Neta estás diciendo ""chale miren las migajas que nos da está transnacional que se llena los… https://t.co/g33vw1pJfq",Sat Aug 13 16:53:09 +0000 2022,Ciudad de México,Xochimilco,R,-99.08179,19.236244499999998,123
"@yassdelacruxxx @UvePath @huampoyotl Pues no van a ser migajas, te debe llegar un estado de cuenta cada cierto tiem… https://t.co/qj6dlIBvbv",Sat Aug 13 21:20:58 +0000 2022,Ciudad de México,Iztapalapa,U,-99.050461,19.342788499999997,1835486
